Handsome And Wealthy,I don't know why I came in this club with you, girl[|]Don't know why I came in with these diamonds on my chain[|]Surrounded by bad bitches I can't get 'em out my face[|]Is it cause a nigga handsome and wealthy?[|]Is it cause a nigga cook like a professor?[|]I don't know how you feel can you tell me[|]I won't know how you feel 'til you tell me[|]Is it cause a nigga handsome and wealthy[|]Is it cause I'm a star[|]It maybe could be my star status[|]I got my chain and ring[|]My Rolex watch it got 50 carats[|]It could be QC or even maybe it's me[|]It could be that 4 hour flight, shopping in Beverly[|]What's on your mind?[|]I'm not Ginuwine[|]Ain't tryna spend no time[|]I know my bitch she so fine[|]But I don't know what's on her mind[|]Gotta pay that cost to be a boss[|]I put on my Louboutins playing golf[|]Young nigga walking with Nina Ross[|]I'm dropping the bombs like Viet Cong[|]I don't know why I came in this club with you, girl[|]Don't know why I came in with these diamonds on my chain[|]Surrounded by bad bitches I can't get 'em out my face[|]Is it cause a nigga handsome and wealthy?[|]Is it cause a nigga cook like a professor?[|]I don't know how you feel can you tell me[|]I won't know how you feel 'til you tell me[|]Is it cause a nigga handsome and wealthy[|]They say I'm picky cause all my bitches exquisite[|]I'm in some vintage Givenchy smokin' a Philly[|]The dope that I sell is the purest[|]The junkies they hit it, they scratchin' and itchin'[|]The flow that we killin', the flow that we spittin'[|]My nigga you know we invented it[|]Dripping in St. Louis, I'm a lunatic[|]I'm a Migo but my bitch an immigrant[|]I got the boot but no Timberland[|]I am the plug, you the middle man[|]I never leave my niggas starvin'[|]You niggas mistake me for Marvin[|]I got 15 bricks I'm finna drop[|]In there right next to that carbon[|]I don't know why I came in this club with you, girl[|]Don't know why I came in with these diamonds on my chain[|]Surrounded by bad bitches I can't get 'em out my face[|]Is it cause a nigga handsome and wealthy?[|]Is it cause a nigga cook like a professor?[|]I don't know how you feel can you tell me[|]I won't know how you feel 'til you tell me[|]Is it cause a nigga handsome and wealthy[|]Is it my looks or is it my wealth?[|]Or is it the way that I carry myself?[|]Let me know I need some help[|]Don't keep that secret to yourself[|]Bitches be saying I'm acting funny cause a young nigga got a lotta money[|]She lookin' at me like she want somethin'[|]Can't give her nothin' but a couple hundreds[|]She sucked up on a nigga, tryna give a nigga kisses baby girl you trippin'[|]I don't know how you feel can you tell me[|]I know why you came[|]In this club tonight[|]Looking for a nigga that's gon' change your life[|]I don't know why I came in this club with you, girl[|]Don't know why I came in with these diamonds on my chain[|]Surrounded by bad bitches I can't get 'em out my face[|]Is it cause a nigga handsome and wealthy?[|]Is it cause a nigga cook like a professor?[|]I don't know how you feel can you tell me[|]I won't know how you feel 'til you tell me[|]Is it cause a nigga handsome and wealthy
One Time,One time[|]Yo, yo yoooo[|]MIGO![|]Smoke one one time[|]Drink one one time[|]Lemme fuck some one time[|]Tear the club up one time[|]Smoke some one time[|]Drink some one time[|]Lemme fuck some one time[|]Tear the club up one time[|]Only take one time[|]Only take one time[|]Only take one time[|]Only take one time[|]Only take one time[|]Only take one time[|]Only take one time[|]Only take one time[|]Only take one time for me to put my eyes on you, I'm looking at you[|]Only take one time for me to just get high with you[|]Only take one time for me to just pull up[|]Only take one time for my nigga to pull up with the choppas[|]And a hundred round drum[|]Call the Nawf one time and they come[|]What type of shit that you on?[|]What type of drug that you on?[|]YRN the label we put em on[|]Championship, you know that we winning one this year[|]I don't have to empty the clip, shoot one time, he outta here[|]Take your ho for the first time[|]And I only hit her one time[|]I walk in the jewelry store for the first time[|]I'm walking out looking like Busta Rhymes[|]I told my niggas we gonna see dollar signs, I told em one time[|]We overseas for the first time, but it sure ain't the last time[|]Smoke one one time[|]Drink one one time[|]Lemme fuck some one time[|]Tear the club up one time[|]Smoke some one time[|]Drink some one time[|]Lemme fuck some one time[|]Tear the club up one time[|]Only take one time[|]Only take one time[|]Only take one time[|]Only take one time[|]Only take one time[|]Only take one time[|]Only take one time[|]Only take one time[|]Migo gang say it one time[|]Now the choppa sounding like a drum line[|]Call up the plug one time[|]He pulling up with a hundred lines[|]One rum and one cosign[|]Have you in the drop top, no mind[|]Lemme smash one time, lemme pass one time[|]Lil mama staring at me, hit the gas one time[|]One time, one time, one time[|]I got more chains on than Busta Rhymes[|]Niggas cloning me but I am one of a kind[|]You say you be drinking but only one line[|]Only take one time for a nigga to snitch[|]Only take one time caught with a brick[|]Bumping yo lip you get shot in yo shit[|]All of this work I need me a forklift[|]Hit a nigga with a choppa only one time[|]And I got the pocket rocket and it's on me all the time[|]My diamonds hit one time and it make you blind[|]Technical foul fuck nigga crossed the line[|]Nigga one time, I stretch it to a nine[|]I got two hundred buried in the ground[|]One gun with bout 200 round[|]They looking for you in the lost and found[|]Smoke one one time[|]Drink one one time[|]Lemme fuck some one time[|]Tear the club up one time[|]Smoke some one time[|]Drink some one time[|]Lemme fuck some one time[|]Tear the club up one time[|]Only take one time[|]Only take one time[|]Only take one time[|]Only take one time[|]Only take one time[|]Only take one time[|]Only take one time[|]Only take one time[|]Only take one time for me to call my niggas up and they pulling up[|]Thinking bout running up[|]I'mma chop you with the choppa then I hit the runner up[|]My mansion's got expensive furniture[|]My stingray Corvette, it come with the turbulence[|]Hit the gas one time, it's over with[|]I'm in Vegas in casinos and I'm betting my poker chips[|]Just like a spider, I web up the game[|]People they think it's Peter Parker here[|]One song Versace and it got us the fame[|]Niggas plotting, get one shot in your brain[|]Niggas biting but ain't gon say your name[|]Migo my family, only one gang[|]I came from the Northside and invaded the A[|]Start fucking up the city now we got our own lane[|]Now we blowing up like we on a mine[|]Givenchy khakis, Versace down my spine[|]Speeding in traffic I'm doing 200[|]That nigga say fuck the stop sign[|]Taking your bitch and I fuck her one time[|]But that bitch she be calling me more than one time[|]I drop a 8 one time, y'all drinking one line[|]You ain't never seen a hundred thousand dollar one time[|]Smoke one one time[|]Drink one one time[|]Lemme fuck some one time[|]Tear the club up one time[|]Smoke some one time[|]Drink some one time[|]Lemme fuck some one time[|]Tear the club up one time[|]Only take one time[|]Only take one time[|]Only take one time[|]Only take one time[|]Only take one time[|]Only take one time[|]Only take one time[|]Only take one time
Fight Night,If you know me, know this ain't my Feng Shui[|]Certified everywhere, ain't gotta print my resume[|]Talkin' crazy, I pull up andele[|]R.I.P. to Nate Dogg, I had to regulate...[|]Public Service Announcement[|]Where all my rich niggas at, man?[|]MIGOS![|]Broke niggas stand to the left (to the left)[|]My rich niggas stand to the right (nigga...)[|]Lil' mama, she keep lookin' at me (lil' mama!)[|]I'ma knock the pussy out like fight night[|]Hit it wit the left, hit wit the right[|]I'ma knock the pussy out like fight night[|]Beat it wit the left, beat it wit the right[|]I'ma knock the pussy out like fight night[|]Pocket rocket fire, watch him disintegrate[|]It's a truckload comin' on the Interstate[|]Sirloin steak all on my dinner plate[|]Your main bitch say she wanna make a sex tape[|]Rich nigga, I could never be a broke nigga (rich nigga)[|]Broke niggas, I can never get along wit 'em![|]Always been hated since a little nigga (always)[|]It's forever, pussy nigga gotta deal wit it (nigga!)[|]Float like a butterly, sting like a bee[|]Rumble, young nigga, rumble![|]Lil' mama want a nigga like me in the sheets[|]Ice Cube knock it out like Deebo[|]Now, who's that talkin' that gangsta shit?[|]Somebody gon' kick ya ass (ya ass)[|]When I walk up in the club, I betta make a thundastorm[|]Let 'em know that this a whole lot of cash[|]Rich niggas on the right all night (rich nigga)[|]Broke niggas to the left by yaself (Brokanese)[|]Now, who the hell just said that the roof on fire?[|]Call 9-1-1 like Wyclef![|]I'm a rich nigga, I don't like a bitch nigga[|]Snitch nigga, broke nigga[|]I don't deal wit you[|]All of my niggas official (official)[|]My bitches, they skrippers[|]My niggas, they criminals tryin' to get to the M&Ms;[|]If your bitch is so innocent, why she suckin' my children?[|]Last time I asked I dine and dashed and bitch I go in the buildin'[|]Bad bitch make it clap, like Magnolia[|]Young rich nigga on the couch talkin' to Oprah[|]Bottles in the VIP while I stand on the sofa[|]I don't speak your language, Brokanese, I thought I told ya[|]These bitches they be smokin' on hookah, my nigga ballin' like Hoosiers[|]Geeked up in the Double R, go scare ya bitch, Freddy Krueger[|]Flooded Franck Muller
To Hotty,Whoop, yeah[|]Father God, Father God[|]I just wanna live life (life)[|]Lamborghini, loud pipes (Lamborghini)[|]Remember all the trap nights (trap)[|]Pull up in the Poltergeist (skrr)[|]Hundred thousand on me, yikes (yikes)[|]Shawty was suckin' too sloppy[|]She was too sloppy, I had to roll the dice[|]They think I'm 'lluminati 'cause of my profits[|]Pull up in Poltergeist (skrr)[|]You had a nigga that's poppin' bitch you got nothin'[|]Bitch, you ain't do it right (bitch)[|]Travellin' across the country[|]I been gettin' money, say you get who a night[|]Coupe make a bitch get a Kreuger fright[|]You was a bitch and your crews are dykes[|]I was born to be what I'm goin' to be[|]Raindrops on me like a storm on me (raindrops)[|]She lickin' my charm but I'm on the heat[|]The devil keep tryna come conquer me[|]Smokin' OG in a Fronto leaf[|]Droppin' a deuce in the Pure Leaf tea[|]I don't got time for no foolery[|]I'm 'bout to go drop on some jewelry[|]I'ma tell you lil' niggas somethin'[|]Fame blowin' all you niggas money[|]Maintain, gotta keep a hundred comin'[|]Ain't no pain like the name with no money[|]I ain't goin' out sad for her[|]Learned my lesson with the last whore[|]Throw these bitches off the backboard[|]I bet she fuckin' for some for some cash boy[|]She don't gotta know I gotta landlord[|]She just layin' on the land, Lord[|]All these niggas, they be payin' for her[|]Pop a perky, that's a Altoid[|]Niggas 'round you be a towel boy[|]My niggas 'round me, they some cowboys[|]I'll bite a nigga whole style boy[|]Copy the flow, give it now boy![|]Do not play with the cake[|]I pull up and hop in the dirty Wraith (Ghost)[|]She fuck on a nigga, I fuck her face[|]I'm gettin' this money, I'm gettin' paid (racks)[|]I just bought a mansion[|]On the back of the banshee no panties[|]On my money, look, nigga demanded[|]Bought a mansion, the pool got expanded[|]Put that money on your coofie like dandruff[|]Scotty 2 Hotty[|]Done put the lil' bitch on the molly, she fucked everybody (2 Hotty)[|]Shawty's somebody, lil' nigga done caught a lil body, don't know nun' about it (about it)[|]Scotty 2 Hotty[|]Done put the lil' bitch on the molly, she fucked everybody (2 Hotty)[|]Shawty's on shawty, lil' niggas gon' caught two bodies, don't know nun' about it (about it)[|]Scotty 2 Hotty[|]Put that lil' bitch on the molly, she fucked everybody (Scotty 2 Scotty)[|]Shawty's on shawty, lil' niggas gon' call them about it, don't know nun' about it (bow bow)[|]Scotty 2 Hotty[|]Put that lil' bitch on some molly, she fucked everybody (Scotty 2 Scotty)[|]Shawty's on shawty, lil' niggas gon' call them about it, don't know nun' about it[|]Quavo![|]Choppers and shottys[|]Young nigga, got two bodies (bodies)[|]Water, faucet, drippin' on my body (drip)[|]Spent 10K in Follies, niggas hatin' watchin' (Who?)[|]That's their only option (option)[|]'Cause they not gon' rob me (Nope!)[|]Pound a cookie in the backstage of Jimmy Fallon[|]500 thousand cash backstage at Ellen wildin'[|]Get right wit cha', Saint Laurent boots on Gucci saddles[|]Met Gala, dab capital, abracadabra[|]You can tell, but don't tattle (don't tell, no snitchin')[|]Put that bitch on a Addel' (Adderall)[|]Treat that bitch like a baby (whoo)[|]I give her a rattle[|]She spoiled, she spoiled, she spoiled, she spoiled on the pole, yeah I paid her toll[|]Scotty 2 Hotty, that's Scotty 2 Hotty[|]She crankin' up when on the pole[|]Scotty 2 Hotty[|]Done put the lil' bitch on the molly, she fucked everybody (2 Hotty)[|]Shawty's somebody, lil' niggas gon' call them about it, don't know nun' about it (about it)[|]Scotty 2 Hotty[|]Done put the lil' bitch on the molly, she fucked everybody (2 Hotty)[|]Shawty's on shawty, lil' niggas gon' call them about it, don't know nun' about it (about it)[|]Scotty 2 Hotty[|]Put that lil' bitch on the molly, she fucked everybody (Scotty 2 Scotty)[|]Shawty's on shawty, lil' niggas gon' call them about it, don't know nun' about it (bow bow)[|]Scotty 2 Hotty[|]Put that lil' bitch on some molly, she fucked everybody (Scotty 2 Scotty)[|]Shawty's on shawty, lil' niggas gon' call them about it, don't know nun' about it[|]Heard it was poppin' and stuffin' their pocket with cottage and dressin' all stylists (stylists)[|]Ain't no OG for the knowledge, no benjis for Wallace he pull up big body[|]One in the chamber, they pocket watchin', hit him right in his noggin, he droppin' (noggin)[|]Scotty 2 Hotty, she fucked everybody, can't wife the lil' bitch, she a thotty (thotty)[|]They know we been a trendin' topic (know that)[|]But now this shit lookin' real obvious (obvious)[|]We been sellin' out them arenas but since we went platinum look at the audience (audience)[|]I poured a fo', feelin' nausea (Actavis)[|]Drinkin' to help the insomnia (drink)[|]Migos but move like the mafia[|]Can't see it, you need some binoculars (blind)[|]We been through so many obstacles (obstacles)[|]If it ain't 'bout money, can't talk to you (talk to you)[|]I had no choice to get up and go get it, but I heard that you had it optional (you did)[|]I told 'em at school, I was too popular (popular)[|]The teacher said it was impossible (impossible)[|]They takin' the flow and ain't givin' us credit so I don't have nothin' to offer you[|](Take-Takeoff)[|]Scotty 2 Hotty[|]Done put the lil' bitch on the molly, she fucked everybody (2 Hotty)[|]Shawty's somebody, lil' niggas gon' call them about it, don't know nun' about it (about it)[|]Scotty 2 Hotty[|]Done put the lil' bitch on the molly, she fucked everybody (2 Hotty)[|]Shawty's on shawty, lil' niggas gon' call them about it, don't know nun' about it (about it)[|]Scotty 2 Hotty[|]Put that lil' bitch on the molly, she fucked everybody (Scotty 2 Scotty)[|]Shawty's on shawty, lil' niggas gon' call them about it, don't know nun' about it (bow bow)[|]Scotty 2 Hotty[|]Put that lil' bitch on some molly, she fucked everybody (Scotty 2 Scotty)[|]Shawty's on shawty, lil' niggas gon' call them about it, don't know nun' about it
Do You Love Me,
White Sand,[Chorus: Travis Scott & Ty Dolla $ign][|]Yeah, white color sand (yeah), frost in my hand, yeah (yeah)[|]Lost it again, yeah (it's lit), ghost, Danny Phantom (oh yeah)[|]Dipped in a trance, yeah (alright), ten in the van, yeah[|]Mars make her leap, yeah, shh, not a squeak (straight up)[|][Verse 1: Ty Dolla $ign & Big Sean][|]Coupe outside (outside), she say let me ride[|]Bust down Rollie with the ice (ice)[|]Ride 'round the city with a pipe[|]Wrist frozen (frozen)[|]Blessed, I guess I'm chosen (chosen)[|]Hit a lightskin from Oakland[|]In my old school sideshow[|]Supersport (oh yeah)[|]Crash the Porsche (oh yeah)[|]I was gettin' head (woah)[|]She was killin' it (woah)[|]Caught an Uber to the dealership (swerve swerve swerve swerve)[|]Cash out on some new shit (woah, look)[|][Verse 2: Big Sean][|]Bitch, I surround myself with all this loyalty[|]Swear to God I'm the one, my girl just might propose to me (I swear)[|]A clique full of CEO's (O's), none of us got a degree (no, no)[|]Made it from the underground, now they back tryna bury me (bury me)[|]I lean, I sway (woah), with Quay (woah), and Take (God)[|]I give and hardly take, you level up, I levitate[|]Bitch you a culture (what?), vulture (woah), poser (woah)[|]Hungry for exposure, I'm with my Migos soldiers, gone[|][Chorus: Travis Scott & Quavo][|]White color sand, yeah (yeah), frost in my hand, yeah[|]Lost it again, yeah, ghost, Danny Phantom (it's lit)[|]Dipped in a trance, yeah (alright), ten in the van, yeah[|]Mars make her leap, yeah, shh, not a squeak (straight up)[|]Drank color pink, dirty bags, wash it clean (clean, yeah)[|]Coupe got wings (coupe got)[|]Posted up with kings (coupe got wings)[|]On the top like toupee (on top)[|]Play no games, no 2K (no 2K)[|]Crap game in the booth flame (crap)[|]Pull out the coupe like Bruce Wayne (skrrt skrrt)[|][Verse 3: Offset][|]Pull up the curtains to the Mulsane (hey)[|]Pavé my set and clip Blu-ray (pavé)[|]Run to the bag like Hussein (bag)[|]When I lay my head down, got two K's (baow)[|]Ferrari in Miami Beach (Ferrrari)[|]I paid one twenty for rose Philippe (Philippe)[|]I took her soul for keeps, yeah (soul)[|]Back to back Rolls like Meech (Meech)[|]I check my balance, the cash I'ma double up (bag)[|]P-90, two-three with the monkey nuts (brrt)[|]When I look at my wrist it's a hockey puck (woo)[|]When I get with a bitch I'ma pipe her up (hey)[|]Pour that lean on that ice (lean)[|]Leaving my dreams covered in ice (dream)[|]Wedding band rings, ain't no wife[|]Tryna get the demons out of my sight (woo)[|][Verse 4: Takeoff][|]Nigga we ain't hiding we straight (nope)[|]I'm talking big plate with that steak (steak)[|]Niggas be watchin' out 'cause they scoping (watchin')[|]Geeked off of Adderall, they all focused (acid)[|]Sipping on Tylenol, having codeine withdrawls[|]A nigga must got to be joking (joking)[|]Don't want the pack, it ain't potent (uh)[|]Look at wrist, water came from the ocean (ice)[|]I'm laughing, never lacking (no)[|]Everlasting, flipping work like gymnastics (flippin' it)[|]Wrapping it up in the plastic (wrappin' it)[|]Smoking it up in the ashes (ashes)[|]Looking and watching which ass is gon' be the fattest (asses)[|]I pick the bitch up and smash it[|]2018 we don't pass, we trash it[|][Chorus: Travis Scott & Quavo][|]Yeah, white color sand, yeah (yeah), frost in my hand, yeah[|]Lost it again, yeah, ghost, Danny Phantom (it's lit)[|]Dipped in a trance, yeah (alright), ten in the van, yeah[|]Mars make her leap, yeah, shh, not a squeak (straight up)[|]Drank color pink, dirty bags, wash it clean (clean, yeah)[|]Coupe got wings (coupe got)[|]Posted up with kings (coupe got wings)[|]On the top like toupee (on top)[|]Play no games, no 2K (no 2K)[|]Crap game in the booth flame (crap)[|]Pull out the coupe like Bruce Wayne (skrrt skrrt)
Big On Big,Big on big[|]Big on big[|]Big on big[|]If you havin' paper, and I'm having paper[|]How you gon' big on big?[|]If you havin' neighbors and I'm having acres[|]How you gon' big on big?[|]If I got the Draco and you got the Sig[|]How you gon' big on big?[|]If I'm trapping that gas, you trapping that mid[|]How you gon' big on big?[|]If I pull out a dub and you pull out a ten[|]How you gon' big on big?[|]If your bitch is a five, my bitch is a ten[|]How you gon' big on big?[|]You driving a Jag, I'm pushing a Benz[|]How you gon big on big?[|]What you talking about, we done been did[|]How you gon big on big?[|]How you gon big on big?[|]How you gon' say you gon' driz[|]How you gon' one up the seal[|]How you gon' do what I did[|]Nigga don't know how it feel[|]How you gon' say you is real[|]Nigga lyin' sayin' he havin' act seal[|]But we both know that ain't real[|]Nigga bout lyin' quarter mill[|]He ain't touch it or know how it feel[|]Nigga talkin' bout they independent[|]Turned around and 360 the deal[|]Nigga walkin' round with thirties on them[|]But they know they ain't ready to kill[|]All my niggas havin' cookie bags[|]Vacuum sealed and ready to sell[|]M&M; in the mail, I done took a lot of l's[|]Hundred niggas with the shells, goin' big, well[|]Pullin' out V12, pickin' up a plate at Kelz[|]We the biggest shit poppin'[|]Wrist water no faucet[|]Bando to a mansion, you havin' condo status[|]Can't go big and braggin', havin' real big passion[|]Ever since I was a lil boy havin' huncho status[|]Can't compare to this, I'm taking all the risks[|]Know how to solve a problem, know how to sell a brick[|]You might be poppin' them bottles, I'm poppin' those bottles and models[|]You might be ridin' American, my whips is foreign throttles[|]You tryna go big on big, stop it[|]I put a big hole in your pocket[|]They say he ridin' around the city broke[|]That's cause he tryna keep up with the 'cho[|]Eyes closed, whippin' it blind fold[|]She get on that blow get bi-polar[|]Six cell phones and I ain't social[|]Still goin' big, like Magnolia[|]If you havin' paper, and I'm having paper[|]How you gon' big on big?[|]If you havin' neighbors and I'm having acres[|]How you gon' big on big?[|]If I got the Draco and you got the Sig[|]How you gon' big on big?[|]If I'm trapping that gas, you trapping that mid[|]How you gon' big on big?[|]If I pull out a dub and you pull out a ten[|]How you gon' big on big?[|]If your bitch is a five, my bitch is a ten[|]How you gon' big on big?[|]You driving a Jag, I'm pushing a Benz[|]How you gon big on big?[|]What you talking about, we done been did[|]How you gon big on big?[|]How you gon big on big?[|]How you gon', flex on the squad[|]When you know, (when you know) the bag is large[|]Where were you, when times was hard it's pitiful[|]How you gon' be there when we extra large[|]Four car garage, two bad broads[|]I don't flex or floss[|]I'm a rockstar, with no guitar[|]Lambo avatar, sippin' on some tar (Act)[|]I'm livin' above the bar[|]Wrist on froze, wrist on froze (ice)[|]Your lil hoe been my hoe (smash smash)[|]Green Lambo, piccolo (skrr skrr)[|]Diamonds drippin' on me, Nickelodeon (splash)[|]You goin' too big, you talkin' bout money you botherin' me[|](you makin' me sick)[|]I own all of my cars, jewelry, and I got property[|](I got some property)[|]Building these houses in places I'm playing Monopoly[|]Please do not talk to me[|]You don't do nothing, you obsolete[|]If you havin' paper, and I'm having paper[|]How you gon' big on big?[|]If you havin' neighbors and I'm having acres[|]How you gon' big on big?[|]If I got the Draco and you got the Sig[|]How you gon' big on big?[|]If I'm trapping that gas, you trapping that mid[|]How you gon' big on big?[|]If I pull out a dub and you pull out a ten[|]How you gon' big on big?[|]If your bitch is a five, my bitch is a ten[|]How you gon' big on big?[|]You driving a Jag, I'm pushing a Benz[|]How you gon big on big?[|]What you talking about, we done been did[|]How you gon big on big?[|]How you gon big on big?
