MotorSport,[Quavo:][|]Yeah, woo, yeah, skrrt[|]M-M-M-Murda[|]Motorsport, yeah, put that thing in sports (skrrt, skrrt)[|]Shawty bad (bad), pop her like a cork (pop it)[|]You a dork, never been a sport (dork, yeah)[|]Pull up, woo, woo, jumpin' out the court (jump)[|]Cotton candy (drink), my cup tastes like the fair (cotton)[|]Straight up there (where?), we didn't take the stairs (where?)[|]Faced my fears (fears), gave my mama tears (mama)[|]Shiftin' gears (shift), on the Nawf, get serious (serious)[|]Face all your fears, then get at me[|]Hit so many donuts on them backstreets[|]Sit so high in the nosebleeds (yeah)[|]Feel like I can fly, yeah[|]Xans, Perky, check (yeah), Bill Belichick[|]Take the air out the ball, just so I can flex[|]Take the air out the mall, walkin' with the sacks[|]Take the air out your broad (hey), now she can't go back[|]Xans, Perky, check (yeah), Bill Belichick[|]Take the air out the ball (yeah), just so I can flex[|]Take the air out the mall (hey), walk in with the sacks[|]Take the air out your broad (woo, woo, woo, E)[|][Offset:][|]Offset![|]Uh, the coupe came imported (hey)[|]This season's Off-White come in snorted (white)[|]Green Lamborghini a tortoise (Lambo)[|]No human being, I'm immortal (no)[|]Patek and A.P. full of water (Patek)[|]Hundred K, I spend on my señora (racks)[|]My pinky on margarine, butter (margarine)[|]And my ears got McDonald's nuggets (ayy)[|]Soon, as I land on the Lear (whew)[|]Piguets, they wet, tears ('guets)[|]488, hit the gears (488)[|]Suicide doors, Britney Spears[|]I'm boujee, so, bitch, don't get near (boujee)[|]Criss Angel, make dope disappear (voilà)[|]Hit the gas, it got flames out the rears (skrrt)[|]It's a race to the bag, get the mills (hey)[|][Cardi B:][|]Ride the dick like a BMX[|]No nigga wanna be my ex (no)[|]I love when he go on tour[|]'Cause he cums more, when I see him less[|]I get up set off[|]I turn Offset on[|]I told him the other day[|]Man, we should sell that porn[|]Yeah, Cardi B, I'm back, bitches[|]I don't wanna hear I'm actin' different[|]Same lips that be talkin' 'bout me[|]Is the same lips that be ass kissin'[|]These hoes ain't what they say they are[|]And their pussy stank, they catfishin'[|]Same hoes that was sendin' shots[|]They reachin' out like they back itchin'[|]Why would I hop in some beef (why?)[|]When I could just hop in a Porsche?[|]You heard she gon' do what from who?[|]That's not a reliable source, no[|]So tell me, have you seen her?[|]Let me wrap my weave up[|]I'm the trap Selena[|]¡Dame más gasolina! Skrrt![|][Quavo:][|]Motorsport, yeah, put that thing in sports (skrrt, skrrt)[|]Shawty bad (bad), pop her like a cork (pop it)[|]You a dork, never been a sport (dork, yeah)[|]Pull up, woo, woo, jumpin' out the court (jump)[|][Nicki Minaj:][|]Uh, yo, watch your man, then you should watch your mouth[|]Bitches is pressed, administer mouth to mouth[|]You see them stats, you know what I am about[|]I am the champ, I'm Iron Mike in a bout[|]Attention, I'ma need you to face front[|]You don't want smoke with me, this is a laced blunt[|]Rap's Jackie Chan, we ain't pullin' them fake stunts[|]My crown won't fit on your bum-ass lace fronts (uh)[|]You bitches catchin' a fade, shout out my nigga Lil Boosie[|]All of your friends'll be dead, you can get hit with that Uzi[|]I call him Ricky, he say he love me like Lucy[|]Get you a straw nigga, you know this pussy is juicy[|]This Givenchy is custom made, now you can't get it at Saks though[|]I don't work in no office, but they copyin' and that's facts though[|]I ain't tryna be violent, but if Nicki on it, it slaps, ho[|]Get you lined for that paper like a loose leaf when that strap blow[|]I'm with a couple bad bitches that'll rip the party[|]If Quavo the QB, I'm Nick Lombardi[|]Pull up in the space coupe, I done linked with Marty[|]I can actually afford to get a pink Bugatti[|]"Hey yo Nick, didn't you just do a hit with Gotti?"[|]That too, but my niggas send hits like Gotti[|]It's a wrap, like the things on the head of a Saudi[|]Bitch, you my son, go and sit on the potty (rrrr)[|][Takeoff:][|]Brand new Chanels (Chanels)[|]I scuffed 'em runnin' from 12 (12)[|]Ain't make no commitment with none of you bitches[|]'Cause money is treatin' me well (uh uh)[|]If Nicki should show me her titty[|]Right hand on the Bible, I swear I won't tell (swear)[|]If I get to play with that kitty[|]I wonder how many platinums we gon' sell (albums)[|]Pop a Perc and catch a feel (I pop one)[|]Now I cannot feel the wheel (woah)[|]My chest bad, give me chills[|]And the left hand on Richard Mille (ice)[|]Not the watch, but the price on the ice[|]If you don't know what that is (huh)[|]Motorsport, motorville[|]Abort the mission, that's a kill (pew, pew, brrr)[|][Quavo:][|]Motorsport, yeah, put that thing in sports (skrrt, skrrt)[|]Shawty bad (bad), pop her like a cork (pop it)[|]You a dork, never been a sport (dork, yeah)[|]Pull up, woo, woo, jumpin' out the court (jump)[|]Cotton candy (drink), my cup tastes like the fair (cotton)[|]Straight up there (where?), we didn't take the stairs (where?)[|]Faced my fears (fears), gave my mama tears (mama)[|]Shiftin' gears (shift), on the Nawf, get serious (serious)[|]Girl, yeah, yeah, I wish my grandma could see me (grandma)[|]Take away pain, ain't easy (pain)[|]That's why I fire up a bleezy (fire)[|]Niggas not cappin' this season
Stir Fry,Whoo, whoo, whoo, whoo[|]Whoo, whoo, whoo, whoo[|]Dance with my dogs in the night time (wroof)[|]Trap niggas with the chickens like Popeyes (Popeyes)[|]Money changing colors like tie-dye (tie-dye)[|]I am just tryna get it, I ain't trynna die (no)[|]She got a big ol onion booty, make the world cry (cry)[|]In the kitchen, wrist twisted like its stir-fry (whip it)[|]Hold them bands down (hey)[|]Hold your mans down (hey)[|]Who told you come around? (who?)[|]This that trap sound (sound)[|]Designer clothes, fashion shows[|]Trap house, made of gold[|]Control the bag now (control it)[|]No need to brag now[|]And put the mask down (mask)[|]We living fast now (fast)[|]Finest hoes, wrist froze[|]We can go, coast to coast[|]Keep watchin' me whip up, still be real in fame[|]Dance with my dogs in the night time, yeah (woo, woo, woo, woo, wroof)[|]In the kitchen, wrist twisted like its stir-fry (whip it)[|]In the kitchen, wrist twisted like its stir-fry (whip it)[|]In the kitchen, wrist twisted like its stir-fry (whip it)[|]In the kitchen, wrist twisted like its stir-fry (whip it)[|]Offset[|]Make her whip it, intermission, let the birds fly (brrr)[|]I get money, tunnel vision through my third eye (money)[|]In that skillet, watch me flip it like its Five Guys (flip it)[|]Look at my drip, check out the ceiling, look at the blue skys[|]I took a tech check (yeah)[|]Booties, they sit on lap (ice)[|]I don't regret shit, yeah, I am praying I don't got no debt[|]You crawl 'fore you walk, you can ball every week[|]For my dogs 'hind the wall, we gon' ball when you free (ball)[|]Stop watching me, democracy, you wanna copy me[|]Life's Monopoly, go cop me some land and property[|]AP froze (whoa)[|]Pink diamonds, whoa (whoa)[|]Whip up the soda, diamonds off the warder[|]Keep watchin' me whip up, still be real in fame[|]Dance with my dogs in the night time, yeah (wroof)[|]In the kitchen, wrist twisted like its stir-fry (whip it)[|]In the kitchen, wrist twisted like its stir-fry (whip it)[|]In the kitchen, wrist twisted like its stir-fry (whip it)[|]In the kitchen, wrist twisted like its stir-fry (wroof)[|]In the kitchen, wrist twisted like its stir-fry (whip it)[|]In the kitchen, wrist twisted like its stir-fry (whip it)[|]In the kitchen, wrist twisted like its stir-fry (whip it)[|]In the kitchen, wrist twisted like its stir-fry (whip it)[|]In the kitchen, curry chicken, callin' it stir-fry[|]Takeoff from the bird keeper, let the birds fly[|]5's tryna take my pride, you a dead guy[|]Of course I gotta keep a watch hawk in my bird eye[|]No cash, get dropped dead, fresh and I got dead guys[|]Don't discriminate, ball players come on all sides[|]Finger roll, post move up so we can roll[|]They mad that way we went, they think we used a cheat code[|]Why'd you keep lookin' at me, I feel like a nigga got static[|]It must be the Patek[|]Pockets blue cheese, I am in the kitchen[|]In the kitchen, wrist twisted like its stir-fry (whip it)[|]In the kitchen, wrist twisted like its stir-fry (whip it)[|]In the kitchen, wrist twisted like its stir-fry (whip it)[|]In the kitchen, wrist twisted like its stir-fry (whip it)[|]Keep watchin' me whip up, still be real in fame[|]Dance with my dogs in the night time, yeah (wroof)[|]In the kitchen, wrist twisted like its stir-fry (whip it)[|]In the kitchen, wrist twisted like its stir-fry (whip it)[|]In the kitchen, wrist twisted like its stir-fry (whip it)[|]In the kitchen, wrist twisted like its stir-fry (wroof)
Slippery,Pop a perky just to start up (pop it, pop it pop it)[|]Two cups of purple just to warm up (two cups, drank)[|]I heard your bitch she got that water[|](Splash, drip, drip, woo, splash)[|]Slippery, 'scuse me, please me (please)[|]Arm up, or believe me, believe me (believe me)[|]Get beat, cause I'm flexin' 'Rari's (skrt)[|]You can bet on me (skr, skr)[|]Hey, hey, hey, tater tot[|]Fuck niggas on my radar watch (watchin')[|]Crocodile hunter, turn 'em to some gator shots (urr)[|]Iced out watch (ice), ridin' round ten o' clock (ten)[|]Ridin' round, geeked up, damn, think it's three o' clock (three)[|]Four o' clock (four), five o' clock, six o' clock (five)[|]I'm gon pop, if I don't I'm back to the pot (whip)[|]I got rocks (rocks), big bales, big arms (bales)[|]Tommy gun, come out and play let's have fun (yeah)[|]Big scales (scales), fishscale, big weight (fish)[|]Iceberg (ice), ice tray, ice tray (woo)[|]Plug called (called), tried to front, I don't need it (brrt)[|]I don't need it (brrt)[|]Pockets strong, wrist anemic (strong)[|]Get freezy (freezy), young nigga pay your debt-is (debt-is)[|]Grandma (grandma) auntie Ab and auntie Neesa (Neese)[|]Uncle Bo, auntie Greta serve ya perkys (Greta)[|]Auntie Eva, she got a pound she might just serve it (serve)[|]Pop a perky just to start up [|](pop it, pop it pop it)[|]Two cups of purple just to warm up [|](two cups, drank)[|]I heard your bitch she got that water[|](Splash, drip, drip, woo, splash)[|]Slippery, excuse me, please me (please)[|]Arm up, or believe me, believe me (believe me)[|]Get beat, cause I'm flexin' 'Rari's (skrt)[|]You can bet on me (skr, skr)[|](Offset!)[|]Hey, hey, hey, slippery, she numbin' me, that tongue on me[|]Honestly (honest), she fuck with me, a wife to be (wife)[|]In Italy, bought her a fur, look like the wildebeest (rarr)[|]Just chill with me (chill)[|]It is no worry, it is a bill to me (it ain't nothin')[|]I pull up Diablo, I pull up with models[|]I gave her her first Philippe (Philippe)[|]We goin' full throttle, she swallowed the bottle[|]I'm all in her ovaries (ahh)[|]I gave her some dollars[|]I Gucci'd her collar now she can't get over me (hey)[|]She wanna dose of me (dose)[|]Just hop in the Ghost with me (Ghost)[|]Perky and molly, don't vote for nobody[|]These bitch ass niggas ain't solid (solid)[|]Run in your house and with pumps and the shotties[|]Your mom might be up inside it (bah)[|]Cars robotic, bad bitch with a body[|]But really don't care nothing about it (uh-uh)[|]Cappin' and poppin', I seen that lil Masi[|]I coulda pulled up and just shot ya ( brrt)[|]It's a jungle, I let off some fire (some fire)[|]Pop a perky just to start up [|](pop it, pop it pop it)[|]Two cups of purple just to warm up [|](two cups, drank)[|]I heard your bitch she got that water[|](Splash, drip, drip, woo, splash)[|]Slippery, excuse me, please me (please)[|]Arm up, or believe me, believe me (believe me)[|]Get beat, cause I'm flexin' 'Rari's (skrt)[|]You can bet on me (skr, skr)[|]I rock water, diamonds, I'm drippin' but not slippin'[|]I threw a quarter, (well damn) but no I'm not trippin'[|]Bugatti on Forgi's, and nawl, I'm not crippin'[|]I buy Ferrari's like Jordans[|]I'm Mike and y'all Pippen[|]Chillin', just me and my millions[|]Niggas, they all in they feelin's[|]My bitches, I spoil them like children[|]So persistent, if I want it, I go get it[|]I'm so slimy, grimy, sheisty but still shining[|]Rude and unkindly, cruel with no conscious[|]Drop the top on College, nigga I ain't with no nonsense[|]And I'm a murderer nigga but I don't promote violence[|]Dead shot (brrt), AK make your head rock (brrt)[|]Red dot, retro 8, Jordan they in stock[|]Lean on rocks (Act)[|]Perkys, mollies, xannies, rocks (roxies)[|]Oxycontin (oxyies)[|]Takeoff I'm your med doc (Takeoff!)[|]Leg lock (leg)[|]The key I got, unlock the box (box)[|]What's in that box, huh?[|]Don't tell em they might show the cops (shh)[|]Wrist watch (bite), abnormal so I flood the clock (ice)[|]Money flop, panties drop, that's when them titties pop (woo)[|]Free my partners (John Wicc)[|]'Til they free it's fuck the cops (fuck 'em)[|]They know I geek a lot[|]They don't know I keep a Glock (clueless)[|]Ain't been no drought (where)[|]They think I been sleep a lot[|]They think I'm dumb (dumb)[|]They don't know I see the plot (see it)[|]Fuck it I seize a knot[|]Pop a perky just to start up [|](pop it, pop it pop it)[|]Two cups of purple just to warm up [|](two cups, drank)[|]I heard your bitch she got that water[|](Splash, drip, drip, woo, splash)[|]Slippery, excuse me, please me (please)[|]Arm up, or believe me, believe me (believe me)[|]Get beat, cause I'm flexin' 'Rari's (skrt)[|]You can bet on me (skr, skr)[|]Hey, hey, hey
Narcos,[Chorus: Offset & Quavo][|]Trapping like a narco (narco)[|]Got dope like Pablo (Pablo)[|]Cut throat like Pablo (cut throat)[|]Chop trees with the Draco (Draco)[|]On the North, got the Ye, go (Diego)[|]Saying Hasta luego (luego)[|]We be in, reppin' kilos (ye)[|]Snub nose with potatoes[|]Straight out the jungle (yeah, yeah, yeah, yeah, yeah) (arrib-)[|]This real rap, no mumble (yeah, yeah, yeah, yeah, yeah) (arriba, arriba)[|]My skin black like mamba (yeah, yeah, yeah, yeah, yeah)[|]Got stash boxes in Honduras (yeah, yeah, yeah, yeah, yeah)[|]Straight out the jungle (oh yeah)[|][Verse 1: Quavo][|]Woo, bricks in the brick house (yeah)[|]Use to hit licks and go to ma house (licks, momma)[|]Straight out the jungle (yeah, yeah, yeah, yeah)[|]Young nigga don't know right now (ya)[|]Young nigga know too much now (woo)[|]Bow bow bow, that'll slow them down (yeah, yeah)[|]We pick up the hundos (hundos)[|]Then drop them off to Huncho (Huncho)[|]I came from the bando (bando, beep beep)[|]Here go to out the-[|][Chorus: Offset & Quavo][|]Trapping like a narco (narco)[|]Got dope like Pablo (Pablo)[|]Cut throat like Pablo (cut throat)[|]Chop trees with the Draco (Draco)[|]On the North, got the Ye, go (Diego)[|]Saying Hasta luego (luego)[|]We be in, reppin' kilos (ye)[|]Snub nose with potatoes[|]Straight out the jungle (yeah, yeah, yeah, yeah, yeah) (arrib-)[|]This real rap, no mumble (yeah, yeah, yeah, yeah, yeah) (arriba, arriba)[|]My skin black like mamba (yeah, yeah, yeah, yeah, yeah)[|]Got stash boxes in Honduras (yeah, yeah, yeah, yeah, yeah)[|]Straight out the jungle[|]Magnifico[|]Arriba, arriba[|][Verse 2: Offset][|]Hey, cold gang with the cocaine (coke)[|]The more money make more rain (rain)[|]Pourin' up a pint while I'm baggin' propane (baggin')[|]Point blank range give a nigga nose rings (yes)[|]Skip to my lou with a pack in the cat (cat)[|]Jiffy, Lube, where the bricks where they at? (Where)[|]Trippy, ooze, the Patek all wet (ooh)[|]The birds in the trap, they ain't leavin' out they nest (brr)[|]Get pie face, Seth like meth, yeah[|]Yup, runnin' with the pack got slapped (yeah)[|]Hands in the cookie jar, cut his finger off (ah)[|]Nigga bein' greedy, we gon' cut his tummy out (huh)[|]Hundred bricks on the roads, took a couple routes (bricks)[|]Plus momma's house heard with a finny count (ayy)[|]Uh, I ain't really with the razzle dazzle (nah)[|]Knock him off and then I throw him off the rope paddle (brr)[|]Go to Tijuana, put the kilo on the saddle (ooh)[|]Sack him, hit a nigga carbon pterodactyl (sack)[|]Pap him, choppa piped down like an apple (argh)[|]Mansion with the AK with the horses and the cattle[|][Chorus: Offset & Quavo][|]Trapping like a narco (narco)[|]Got dope like Pablo (Pablo)[|]Cut throat like Pablo (cut throat)[|]Chop trees with the Draco (Draco)[|]On the North, got the Ye, go (Diego)[|]Saying Hasta luego (luego)[|]We be in, reppin' kilos (ye)[|]Snub nose with potatoes[|]Straight out the jungle (yeah, yeah, yeah, yeah, yeah) (arrib-)[|]This real rap, no mumble (yeah, yeah, yeah, yeah, yeah) (arriba, arriba)[|]My skin black like mamba (yeah, yeah, yeah, yeah, yeah)[|]Got stash boxes in Honduras (yeah, yeah, yeah, yeah, yeah)[|]Straight out the jungle[|]Magnifico[|]Arriba, arriba[|][Verse 3: Takeoff][|]Take-Takeoff[|]No monkey in the jungle, block hot like a sauna (hah)[|]Bustin' on [?], tryna weave with anacondas (fire)[|]Jumpin' in the water, tryna sneak across the waterglass[|]See guards out, got me beat by a piranha (ouch)[|]I'll bag it, bag a money, know I gotta have it[|]Savage, but I'm still a gentleman in Cali (Cali)[|]Static, nigga turn to mean about the cabbage (uh)[|]Kill his whole family if he run off with your package (brr)[|]I just put a pack on the way to Bogota (pack)[|]Poke his eyes out, ain't no tellin' what he saw (poke 'em out)[|]I'ma wire his jaw, I don't know if he will talk (wire jaw)[|]Get the chainsaw and I'ma saw his legs off (saw)[|]They knew that we was gang but they sayin' that we a ring (gang)[|]Investigatin', takin' pictures of the whole team (DEA)[|]Undercover, tryna do a sting[|]10 mil' on a plane, going straight to Medellin[|][Chorus: Offset & Quavo][|]Trapping like a narco (narco)[|]Got dope like Pablo (Pablo)[|]Cut throat like Pablo (cut throat)[|]Chop trees with the Draco (Draco)[|]On the North, got the Ye, go (Diego)[|]Saying Hasta luego (luego)[|]We be in, reppin' kilos (ye)[|]Snub nose with potatoes[|]Straight out the jungle (yeah, yeah, yeah, yeah, yeah) (arrib-)[|]This real rap, no mumble (yeah, yeah, yeah, yeah, yeah) (arriba, arriba)[|]My skin black like mamba (yeah, yeah, yeah, yeah, yeah)[|]Got stash boxes in Honduras (yeah, yeah, yeah, yeah, yeah)[|]Straight out the jungle
Bad and Boujee,You know, young rich niggas[|]You know so we never really had no old money[|]We got a whole lotta new money though, hah[|](If Young Metro don't trust you I'm gon' shoot ya)[|]Hey![|]Raindrop, drop top (drop top)[|]Smokin' on cookie in the hotbox (cookie)[|]Fuckin' on your bitch she a thot, thot (thot)[|]Cookin' up dope in the crockpot (pot)[|]We came from nothin' to somethin' nigga (hey)[|]I don't trust nobody grip the trigger (nobody)[|]Call up the gang, and they come and get you (gang)[|]Cry me a river, give you a tissue (hey)[|]My bitch is bad and boujee (bad)[|]Cookin' up dope with an Uzi (blaow)[|]My niggas is savage, ruthless (savage)[|]We got 30's and 100 rounds too (grrah)[|]My bitch is bad and boujee (bad)[|]Cookin' up dope with an Uzi (dope)[|]My niggas is savage, ruthless (hey)[|]We got 30's and 100 rounds too (glah)[|]Offset, whoo, whoo, whoo, whoo, whoo![|]Rackings on rackings, got back-ends on back-ends[|]I'm ridin' around in a coupe (coupe)[|]I take your bitch right from you (You)[|]Bitch I'm a dog, roof (grr)[|]Beat the hoe walls loose (hey)[|]Hop in the frog, whoo (skrt)[|]I tell that bitch to come comfort me (comfort me)[|]I swear these niggas is under me (hey)[|]They hate and the devil keep jumpin' me (jumpin' me)[|]Bankrolls on me keep me company (cash)[|]Aye, we did the most[|]Yeah, pull up in Ghosts (whoo)[|]Yeah, my diamonds a choker (glah)[|]Holdin' the fire with no holster (blaow)[|]Rick the Ruler, diamonds cooler (cooler)[|]This a Rollie, not a Muller (hey)[|]Dabbin' on 'em like the usual (dab)[|]Magic with the brick, do voodoo (magic)[|]Courtside with a bad bitch (bitch)[|]Then I send the bitch through Uber (go)[|]I'm young and rich and plus I'm bougie (hey)[|]I'm not stupid so I keep the Uzi (rrah)[|]Rackings on rackings, got back-ends on back-ends[|]So my money makin' my back ache[|]You niggas got a low acc rate (acc)[|]We from the Nawf, yeah, dat way (nawf)[|]Fat Cookie blunt in the ashtray (cookie)[|]Two bitches, just national smash day (smash)[|]Hop in the Lamb, have a drag race (skrt)[|]I let them birds take a bath, bathe (brr)[|]Raindrop, drop top (drop top)[|]Smokin' on cookie in the hotbox (cookie)[|]Fuckin' on your bitch she a thot, thot (thot)[|]Cookin' up dope in the crockpot (pot)[|]We came from nothin' to somethin' nigga (hey)[|]I don't trust nobody grip the trigger (nobody)[|]Call up the gang, and they come and get you (gang)[|]Cry me a river, give you a tissue (hey)[|]My bitch is bad and boujee (bad)[|]Cookin' up dope with an Uzi (blaow)[|]My niggas is savage, ruthless (savage)[|]We got 30's and 100 rounds too (grrah)[|]My bitch is bad and boujee (bad)[|]Cookin' up dope with an Uzi (dope)[|]My niggas is savage, ruthless (hey)[|]We got 30's and 100 rounds too (glah)[|]Pour a four, I'm droppin' muddy[|]Outer space, Kid Cudi (drank)[|]Introduce me to your bitch as wifey and we know she sluttin'[|]Broke a brick down, nutted butted, now that nigga duckin'[|]Don't move too fast I might shoot you (huh?)[|]Draco bad and boujee (draco)[|]I'm always hangin' with shooters (brrah)[|]Might be posted somewhere secluded (private)[|]Still be playin' with pots and pans, call me Quavo Ratatouille[|]Run with that sack, call me Boobie (run with it)[|]When I'm on stage show me boobies (ay)[|]Ice on my neck, I'm the coolest (ice)[|]Hop out the suicide with the Uzi (pew-pew-pew)[|]I pull up, I pull up, I pull up[|]I hop out with all of the drugs and the good luck (skrrt)[|]I'm cookin', I'm cookin', I'm whippin'[|]I'm whippin' into a rock up, let it lock up (lock up)[|]I gave her 10 racks[|]I told her go shoppin' and spend it all at the pop up (ten)[|]These bitches they fuck and suck dick[|]And they bustin' for Instagram, get your Klout up[|]Uh, yeah, dat way, float on the track like a Segway (go)[|]Yeah, dat way, I used to trap by the Subway (trappin')[|]Yeah, dat way, young nigga trap with the AK (rrrah)[|]Yeah, dat way, big dyke ho get it though, Macy Gray (hey)[|]Raindrop, drop tops (drop top)[|]Smokin' on cookie in the hotbox (cookie)[|]Fuckin' on your bitch she a thot, thot (thot)[|]Cookin' up dope in the crockpot (pot)[|]We came from nothin' to somethin' nigga (hey)[|]I don't trust nobody grip the trigger (nobody)[|]Call up the gang, and they come and get you (gang)[|]Cry me a river, give you a tissue (hey)[|]My bitch is bad and boujee (bad)[|]Cookin' up dope with an Uzi (blaow)[|]My niggas is savage, ruthless (savage)[|]We got 30's and 100 rounds too (grrah)[|]My bitch is bad and boujee (bad)[|]Cookin' up dope with an Uzi (dope)[|]My niggas is savage, ruthless (hey)[|]We got 30's and 100 rounds too (glah)[|]Yeah, yeah, yeah, yeah, yeah[|]My bitch she bad to the bone, ay[|]Wait, these niggas watchin'[|]I swear to God they be my clones[|]Yeah, hey, huh[|]Switchin' my hoes like my flows (what?)[|]Switchin' my flows like my clothes (like what?)[|]Keep on shootin' that gun, don't reload[|]Ooh, ooh, now she want fuck with my crew[|]Cause the money come all out the roof[|]Drive the Rari, that bitch got no roof (skrt)[|]Wait, what kind of Rari? 458 (damn)[|]All of these niggas, they hate (they hate)[|]Try to hide, shoot through the gate[|]Look, go to strip club, make it rain, yeah[|]So much money, they use rakes[|]Count 100 thousand in your face (in your face)[|]Yeah, then put 300 right in the safe[|]Met her today, ooh[|]She talk to me like she knew me (yeah)[|]Go to sleep in a jacuzzi, yeah[|]Wakin' up right to a two-piece (yeah)[|]Countin' that paper like loose leaf (yeah)[|]Gettin' that chicken with blue cheese (yeah)[|]Boy, you so fake like my collar, you snakin'[|]I swear to God that be that Gucci (aye)[|]And you know we winnin' (winnin')[|]Yeah, we is not losin'[|]Try to play your song, it ain't move me (what?)[|]Saw your girl once, now she choosin' (yeah)[|]Raindrop, drop top (drop top)[|]Smokin' on cookie in the hotbox (cookie)[|]Fuckin' on your bitch she a thot, thot (thot)[|]Cookin' up dope in the crockpot (pot)[|]We came from nothin' to somethin' nigga (hey)[|]I don't trust nobody grip the trigger (nobody)[|]Call up the gang, and they come and get you (gang)[|]Cry me a river, give you a tissue (hey)[|]My bitch is bad and boujee (bad)[|]Cookin' up dope with an Uzi (blaow)[|]My niggas is savage, ruthless (savage)[|]We got 30's and 100 rounds too (grrah)[|]My bitch is bad and boujee (bad)[|]Cookin' up dope with an Uzi (dope)[|]My niggas is savage, ruthless (hey)[|]We got 30's and 100 rounds too (glah)
