Pipe It Up,Pipe it up, pipe it up, pipe it up, pipe it up, pipe it up, pipe it up, pipe it up, pipe it up[|]I walk in the club just to pipe it up[|]I stand on this stage and I pipe it up[|]Get a regular ho tell her pipe it up[|]Go buy a bando then I pipe it up[|]Pipe it up, pipe it up, pipe it up[|]I walk in the club just to pipe it up[|]She was a basic bitch til I piped her up[|]I'm just doing my dab, I called it the pipe it up[|]They know that I'm having blue Benjamin's[|]They know I'm on top of the pyramid[|]They know I'ma go down in Guinness[|]All this dab a nigga drippin'[|]Piped up in the city[|]Piped up with yo bitches[|]Piped up in Givenchy[|]Piped up new edition[|]When a nigga start talking shit, gotta pipe up the ammunition[|]Your bitch walkin' around piped up[|]When she see me, she blowin' kisses[|]Feelin' like Aladdin, Quavo the genie[|]I grant your ho three wishes[|]You know I do magic, Quavo Houdini[|]I touch the pack and get it missin'[|]Pipe it up, pipe it up, pipe it up, pipe it up, pipe it up, pipe it up, pipe it up, pipe it up[|]I walk in this club just to pipe it up[|]I stand on this stage and I pipe it up[|]Go get a regular ho tell her pipe it up[|]Go buy a bando then I pipe it up[|]Broke niggas still saying "turn it up!"[|]All my young rich niggas screaming out "pipe it up!"[|]Benjamins old they extinct like a dinosaur[|]Look at yo diamonds, yo diamonds ain't bright enough[|]I send the work to get used in a catapult[|]Play with the dope in the snow like a hockey puck[|]Pipe it up, pipe it up, no Roddy Piper[|]They biting the flow nigga but the Migos got the title[|]So now niggas dabbing, don't know how it happen[|]I been touchdown on you niggas ask Madden[|]Don't forget bitch I'm the dab daddy[|]In stores now YRN fabric[|]Pipe it up, bitch it's gon' be the new anthem[|]I come through swervin in a black Panarama[|]Pull out the camo when you see me Christian Louboutin, hopping out that's an animal[|]Now remember, fore we made this song, nobody said pipe it up[|]Next thing we dropping, we gon' fuck em up, have everybody screaming pipe it up[|]Pipe it up in the club while I'm on drugs[|]A nigga fucking up the furniture[|]Shoot a money ball like Steve Kerr[|]Pipe it up, I get them pints on reserve[|]Pipe it up, pipe it up, pipe it up, pipe it up, pipe it up, pipe it up, pipe it up, pipe it up[|]I walk in this club just to pipe it up[|]I stand on this stage and I pipe it up[|]Go get a regular ho tell her pipe it up[|]Go buy a bando then I pipe it up
Coppers And Robbers,ZayMigo, ZayTiggy, ZayMigo[|]I put the bitch on the boat by the shore[|]100 thousand for my diamond Chuck Norris[|]I fucked your bitch, when she call I ignore her[|]Sold out shows went Atlanta, did Dora[|]On the jet ski with my Rollie in Florida[|]If I lose it, fuck it, buy some more water[|]Come back with the chopper like the game Mordor[|]I'm ahead of time, I bought a portal[|]I watch a brick cross over the border[|]I took her phone cause she a recorder[|]Quavo Capone, I give you tutorial[|]I'm the greatest you've witnessed, this shit is historical[|]Me and Nast talkin' mils[|]Shoulda played for the Bills[|]Still trappin', servin' wings[|]Buffalos on my team[|]Put the dope on the beam[|]That's the honest shit I've ever seen[|]Because the scale tell the truth[|]And the money counter too[|]Big chopper, that's a whopper[|]I tried to buy a helicopter[|]But instead I bought a Benz[|]Then disect the engine like doctors[|]I heard he was a crime stopper[|]I heard he was a crime stopper[|]He growed up to be a copper[|]I growed up to be a robber[|]Coppers and robbers, coppers and robbers[|]Coppers and robbers[|]You wanna play? You wanna play?[|]Coppers and robbers, coppers and robbers[|]You wanna play? You wanna play?[|]Coppers and robbers[|]What you gon' do when you look on your camera,[|]them young niggas comin' in with the bananas?[|]They heard you been ridin' around in the Phantom, they watchin',[|]they know that you got it[|]I put my ho on the mission, she fucked him, she watchin' his pocket[|]Where is my ski? I'm gon' have to kill 'em, I must have forgot it[|]Go get the F&N;, cock it, screw it on, I kill you in silence[|]Wait, I thought he was straight, so why he keep hoopin' and hollerin'?[|]I was rappin' and robbin' while you niggas was callin' TIP (?)[|]Hit the lick for a Tec and a carbon[|]Write his name in with the permanent markers[|]I pull out the Glock and I aim at your carcass[|]Offset for president, vote me in office[|]I be movin' the dope from Dakota to Boston[|]I maneuver through niggas, you talk, they gon' off you[|]How you gangster when you graduated from law school?[|]When the police pull up you the one that they talk to[|]Watch out for your partner, he work with the law too[|]Fuck it, knock him off, I hate that I lost you[|]When I beat the nigga, tried to bring out a lawsuit[|]That's the type of shit a copper gon' do[|]Fend for your life like a hostage gon' do[|]I'm pimpin' your bitch in Vegas prostitutin'[|]Robbin' you niggas, fuck it, then I'm shootin'[|]If I rob then you won't ask it then call up Kid Nuget[|]Qua' rock that nigga, he thought it was bookie[|]Head for Somalian, cook up some cookies[|]Coppers and robbers, coppers and robbers[|]Coppers and robbers[|]You wanna play? You wanna play?[|]Coppers and robbers, coppers and robbers[|]You wanna play? You wanna play?[|]Coppers and robbers[|]Coppers, robbers, mobsters, lobsters[|]Audi and Wraith, no Charger[|]Private jet land in Pearl Harbor[|]Comin' up I was a robber[|]If it was worth the wrapper we did rob ya[|]Can't fuck with these niggas,[|]they fakin', hatin', writin' statements in permanent markers[|]Money come back like it's karma[|]Diamonds, they bitin', piranhas[|]Make that bitch work, Rihanna[|]Don't talk Zans but that drum look like conga[|]Run with that work, don't fumble[|]Run with it Forrest, don't fumble[|]Rob a nigga like I'm Curtis Snow[|]But move like I'm Barrack Obama[|]I know a couple when I see a couple from robbin' nigga, let's be honest[|]Takin' the adventurous trips, Jumanji, stashin' money in the dungeon[|]The difference between us fourth down, I'm goin' for it and you puntin'[|]After I fuck her the first round, tell that bitch not to touch me[|]Nigga's face look disgustin', come out cookie blunt musty[|]Bad bitch but she busty, she gon' take the charge for me[|]Kick in the door nigga, run it, make a move and leave ya ugly[|]What they sayin'? The cops comin', pussy nigga called the cops on me[|]Coppers and robbers, coppers and robbers[|]Coppers and robbers[|]You wanna play? You wanna play?[|]Coppers and robbers, coppers and robbers[|]You wanna play? You wanna play?[|]Coppers and robbers
Hannah Montana Twerk Remix,Hannah Montana, Hannah Montana, Hannah Montana, Hannah Montana[|]Hannah Montana, Hannah Montana, Hannah Montana[|]I got molly, I got white[|]I got molly, I got white[|]I been trapping, trapping, trapping, trapping all damn night[|]Hannah Montana I'm selling them bricks out the phantom[|]Got Hannah Montana I'm drinking the lean out the phantom[|]Glaw, Glaw, Glaw, fuck nigga got anna[|]Got your bitch, she white, Hannah Montana in a Panamara[|]She a college girl, but her wrist Katrina[|]In the kitchen, and she baking like Anita[|]Hit the club, diamonds shining like I'm drinking Magarita[|]I'm in London with the plug, getting the same car as the Beatles[|]Got bricks in the Audi, the Hannah Montana, the molly go crazy[|]Got Lizzy Mcguire, Got Linsey Lohan and I can't forget about Katie[|]I keep the white like the 80s, I keep the white like I'm Shady[|]Put the white rims on the Mercedes, young nigga feel like Pat Swayze[|]Hannah Montana, Hanna Montana, Hanna Montana, Hanna Montana[|]Hannah Montana, Hanna Montana, Hanna Montana[|]I got molly, I got white[|]I got molly, I got white[|]I been trapping, trapping, trapping, trapping all damn night[|]Got your main bitch on the handle, she dropping and popping no castles[|]I'm smoking on gas like tobacco, I'm drinking on lean taste like Snap[|]In the vip rolling a cord, passing out mollies to foreigns[|]They popping them like they some skittles, 2 bitches one me, Malcolm in the middle[|]Hop off up in the new Bugatti, cameras flashing paparazzi[|]She popping that castle, no Nazi[|]I'm twisting the rock like I'm Rocsi[|]She sweating like she ran a mile, she soaking wet she need a towel[|]She sucking her lip, biting down[|]She moaning and making them sounds[|]She came while she sucking me now[|]I'm looking at her like damn[|]Hannah making them go bananas[|]She fucking and sucking on camera[|]Pop a handle, she got stamina[|]My jag, still a Panorama[|]I'm beating the pussy like Michael, I call her Dirty Diana[|]Hannah Montana, Hannah Montana, Hannah Montana, Hannah Montana[|]Hannah Montana, Hannah Montana, Hannah Montana[|]I got molly, I got white[|]I got molly, I got white[|]I been trapping, trapping, trapping, trapping all damn night
WOA,Big, body, Benz, damn[|]Cookies, perc-ys, mollies, Xans[|]Frostbite, spotlight, cheat code, G-code[|]Diamonds, gold, neck, woah[|]Big, body, Benz, damn[|]Cookies, perc-ys, mollies, Xans[|]Frostbite, spotlight, cheat code, G-code[|]Diamonds, gold, neck, woah[|]Pipe up this bitch[|]If she is basic I pipe up your bitch[|]Make it dark in this bitch[|]Don't worry cause I got some light on my wrist[|]Want to talk about dabbin'[|]The difference between us and them, we created that shit[|]Stackin' money ever since[|]If it ain't about money it don't make sense[|]Dope in the troop and it's two percent tint[|]Dope in the coochie, young pimp in this bitch[|]Keep it 100, I'm sick of this bitch[|]Never ate breakfast but eat out the grits[|]Hold that bitch down but she can't get the stick[|]Taking a trip, I'ma give her the dick[|]Chew it up, eat it up like it's a Twix[|]Most of these niggas not, they counterfeit[|]Go see your jeweler my nigga, you tripping[|]Your diamonds so little that they got me squinting[|]I forgot to mention you tryna get a verse from me[|]Then I'm gonna have to charge you a ten[|]Then I go 24 karat my kitchen[|]Fell asleep on drank at the house party with Diddy[|]Who the fuck said we ain't plugged in the city[|]Never mind, niggas done turned into crickets[|]Big, body, Benz, damn[|]Cookies, perc-ys, mollies, Xans[|]Frostbite, spotlight, cheat code, G-code[|]Diamonds, gold, neck, woah[|]Big, body, Benz, damn[|]Cookies, perc-ys, mollies, Xans[|]Frostbite, spotlight, cheat code, G-code[|]Diamonds, gold, neck, woah[|]Pistols, hammers, AKs, bananas[|]Dirty, Diana, on molly, dandruff[|]This my propaganda, riding 'round Atlanta[|]I see a hundred cameras, doing shows in Alabama[|]I'm not your average rapper[|]Come to my trap, I'll tax ya[|]My diamonds came from Africa, like Michael Blackson[|]I spent 10k in Magic, two bitches fucked my fashion[|]They think because I'm rapping, Houdini won't do magic[|]Working the water, Atlantic[|]Money stretched out to Kansas[|]Big body panoramic[|]I told your bitch to get the dancer[|]Shoot a nigga, hit the canvas[|]Get off my grass like I'm Stanley[|]I'm higher than a chimpanzee[|]Ranked number one, my standings[|]Big, body, Benz, damn[|]Cookies, perc-ys, mollies, Xans[|]Frostbite, spotlight, cheat code, G-code[|]Diamonds, gold, neck, woah[|]Big, body, Benz, damn[|]Cookies, perc-ys, mollies, Xans[|]Frostbite, spotlight, cheat code, G-code[|]Diamonds, gold, neck, woah[|]Look at my diamonds, they wink and say peek-a-boo[|]I shock the block like I'm Pikachu[|]I shot the Glock, tried to kill a few[|]I put that dope in her dookie chute[|]We fuck these bitches, we switch-a-roo[|]I had to beat it like Michael do[|]I get the Sprite and I spike a deuce[|]I create flames when I'm in the booth[|]Wide, body, I'm bout to buy me an island[|]Dab, stylish, these not on the shelf, you can't find 'em[|]Ice, blind 'em, if I'm eyeing it told you I'm buying it[|]We together, we never divided[|]Like a feather I'm flier than pilots[|]Chew my dab up just like it is Trident[|]Kept it real with you niggas, we tried it[|]Got to hit hard and move silent[|]If it's bout the money then I'm riding[|]If you broke, need a job, I can hire you[|]Offset, your dab is expiring[|]Your pockets ain't straight, need alignment[|]The bando is my type of environment
Emoji a Chain,[Intro: Future][|]If Young Metro don't trust you I'ma shoot you[|]Hey[|][Pre-Chorus: Offset][|]I, I, count the guap (count, count)[|]Set up shop (ooh, ooh), fuck the cops (fuck 12)[|]We ain't worried (not at all)[|]Diamonds (diamonds) on my wrist look like McFlurry's (oh Lord) (woo, woo, woo, woo)[|]And these, thotties ain't got manners, slurpin' (oh Lord)[|][Chorus: Offset][|]Ice out the gang (gang), make an Emoji a chain (hey, ooh, ooh)[|]Ice out the gang (gang), make an Emoji a chain (woo)[|]Put on the Patek, then change up the weather (hey)[|]The shit turning into the rain (rain)[|]Put on the Patek, then change up the weather (hey, woo, woo, woo)[|]The shit turning into the rain[|]Ice out the gang (gang), make an Emoji a chain (hey, ooh, ooh)[|]Ice out the gang (gang), make an Emoji a chain (woo)[|]Put on the Patek, then change up the weather (hey)[|]The shit turning into the rain (rain)[|]Put on the Patek, then change up the weather (hey)[|]The shit turning into the rain[|][Verse 1: Offset][|]Niggas out here ain't got stain (yeah)[|]Makin' this money, been ballin' on niggas (cash)[|]They think I've been soundin' too lame (ball)[|]Pull up and
Migo Dreams,Started with a dollar and dream[|]From riding Impala with them things[|]To driving Ferraris with them wings, nigga[|]Young rich niggas, Migo, Meek Milly[|]Slide in the pussy like a surfboard[|]Killing these niggas get a hearse for 'em[|]Fuck you niggas even sellin work for[|]You next to tell put your chirp on[|]Be the main reason pussy niggas gettin' murked for[|]Little nigga, who you work for?[|]Cause I came for the bosses I ain't for no losses[|]You playin', it's dirt for 'em[|]And I came from the first floor[|]Gangbanging hoes like a turf war[|]Then hit the road for my first tour[|]My level went up to the third floor[|]And I swerved on these hating niggas[|]MIA with some Haitian niggas[|]Bad bitches keep takin' pictures[|]I pulled up in that Wraith nigga like whoa![|](Let me talk, Meek Mill)[|]I bet you didn't know that my niggas make millions (bet you didn't know)[|]It's sad to say some of my niggas convicted to prison (sad to say)[|]When you at the top you don't want to look down, you don't want to look down[|]In a submarine underwater, you don't know how I'm feeling right now[|]All of my life, I only wanted nothing but Franklin[|]Touchdown on a fuck nigga[|]Make him tuck in his shell like he Franklin[|]You and my niggas are not the same[|]I jumped out the Lamb' like Bruce Wayne[|]The ten-piece of chicken is on the way[|]I told 'em Carlito to andale[|]You see them new niggas in the back of the club[|]Just look at them plottin' in conversations[|]I know they don't know![|]I sent the Migos to come back to the bando for translation[|](On) camera like Quavo Spike Lee[|]Heroin black, look like Willie B[|]If you do the coke, you gon' buy some skis[|]If you in our trap, you gon' buy some ki's[|]Young Takeoff, I am a professional[|]Vegetarian, only eat vegetables[|]I got some kush you can roll up[|]And I got some kush you can eat that is edible[|]Stretching the work like I'm Mr. Incredible[|]You ain't never seen no work as flexible[|]And I turn on the stove, and I'm whipping the brick[|]For that pay my, nigga turn to Predator[|]I bet you didn't know I was twenty-two[|]Win the judge ten times, what a miracle[|]Me and my son identical, seventeen years old[|]I had him I didn't know what to do[|]I had to put food on the plate![|]Asking the Lord, "give a nigga some faith"[|]Now when I wake up I look at my label[|]My foot on the pedal not touching the brake[|]No chess but, nigga, I got me a check!
All Ass,Purps on the beat[|]Yeah, beat the pot, beat the pot, beat the pot, oh[|]Bad bitches walkin' out with bags at the store (bad)[|]Stripper girl shakin', all ass on the pole (all ass aye, all ass aye)[|]Yeah, beat the pot, beat the pot, beat the pot, oh[|]Bad bitches walkin' out with bags at the store (bad)[|]Stripper girl shakin', all ass on the pole (all ass aye, all ass aye)[|]Yeah, I'm throwin' a bag (bag)[|]It bought her a bag (bag)[|]Last bitch I fucked, she wasn't goin' out sad (goin' out sad)[|]Can't play a player for sure, can't play a player, no (no)[|]Throw the money to the top (top)[|]It's fallin' off the top ropes (yee)[|]Yeah (yee)[|]I bet I put all my bitches on though (yee)[|]Yeah (yee)[|]Aye (yeeee)[|]She'll be fuckin' til the sun come up (uh uh uh)[|]Hey yeah[|]If you want to ball, let's get it (woohoo)[|]Hey yeah[|]I make you rich with a fifty (cash)[|]Hey yeah[|]No lemonade it's simply, just me and my bitch (aye)[|]If she don't get dick, she gon' have a fit (yeah)[|]Her daddy the plug (aye)[|]She fuck with the bricks, she with the shit (yeah)[|]He buy a salon to clean the money, he feed the bitch[|]Now he on the run, they seized the house, they seized the whips (yee)[|]Now she on the run, she took the money, he need the bitch[|]Beat the pot, beat the pot, beat the pot, oh[|]Bad bitches walkin' out with bags at the store (bad)[|]Stripper girl shakin', all ass on the pole (all ass aye, all ass aye)[|]Yeah, beat the pot, beat the pot, beat the pot, oh[|]Bad bitches walkin' out with bags at the store (bad)[|]Stripper girl shakin', all ass on the pole (all ass aye, all ass aye)[|]Yeah[|]All ass aye[|]Fifty cash bags, on a bad day (yeah)[|]I'm on a fast pace, I wanted the fast way (skr)[|]They copied the last wave, I cut 'em like blank space (aye)[|]Fuckin' a thot in my mansion, fuckin' a thot on my bedroom[|]Been lookin' like a Kardashian (Kardashian)[|]We hopped in the coupe and we smashin'[|]Sippin' on my drink, I watch that ass go slow motion (slow)[|]Walkin' with that bag, look at my diamonds like the ocean, huh[|]Geekin' out, she geekin' out, she geekin' on the dough[|]Ten different bitches, eeny meeny miny moe[|]Trappin' out the North, trappin' out the bando (North)[|]No, you need you a brick then I get the dough[|]Beat the pot, beat the pot, beat the pot, oh[|]Bad bitches walkin' out with bags at the store (bad)[|]Stripper girl shakin', all ass on the pole (all ass aye, all ass aye)[|]Yeah, beat the pot, beat the pot, beat the pot, oh[|]Bad bitches walkin' out with bags at the store (bad)[|]Stripper girl shakin', all ass on the pole (all ass aye, all ass aye)[|]Yeah[|]My wrists glass (glass)[|]My neck is glass (glass)[|]Last jeweler just spent sixty cash (cash)[|]Last bitch I had, she bought a Jag' (Jag')[|]They come in empty handed she kept her bag (yee)[|]Bag, all ass aye (yee, ass)[|]I can't get my nut off I'mma spaz bae (yee, spaz)[|]No credit, no debit, the cash way (yee, cash)[|]No stomach, no waist pretty face, the ass way (yee yee)[|]Beat the pot, beat the pot, beat the pot, oh[|]Bad bitches walkin' out with bags at the store (bad)[|]Stripper girl shakin', all ass on the pole (all ass aye, all ass aye)[|]Yeah, beat the pot, beat the pot, beat the pot, oh[|]Bad bitches walkin' out with bags at the store (bad)[|]Stripper girl shakin', all ass on the pole (all ass aye, all ass aye)[|]Yeah[|]All ass aye, all ass aye[|]All ass aye, all ass aye[|]All ass aye, all ass aye[|]Stripper girl shakin', all ass on the[|]Stripper girl shakin', all ass on the pole[|]Stripper girl shakin', all ass on the[|]Stripper girl shakin', all ass on the pole
Fucked Up,
Migo Pablo,[Intro][|]Damn DJ Plugg, you just killed this[|][Verse 1: Offset][|]I get the dope and I make it do magic (dope)[|]I fucked the thot and she straight out of Magic (thot)[|]You work with the fed boy, I hear all that static[|]I used to sleep on the pissy ass mattress[|]Now I sleep on a bad bitch and she plastic (bad)[|]Throw me the brick and you know I'ma catch it (hey)[|]Dick on the stick, nigga go in a casket (brrp)[|]Poppin' that shit, he been poppin' that shit (hold up)[|]I just paid a lil' 40 to go and go get it (pop it, pop it, pop it)[|]They diggin' that shit, how I'm livin' and shit[|]I've been gettin' money like I'm oil [?][|]You ain't take nothin' but a quarter, nigga (huh?)[|]We get the bricks over borders, nigga (borders)[|]I took a bitch to the mansion[|]I kicked the bitch out because she tried to record a nigga (yah)[|][Verse 2: Hoodrich Pablo Juan][|]I got more water than Florida, nigga[|]Diamonds dancing, doing jumping jacks[|]I flip it, double back, make it do acrobats[|]Bitch for every letter in the alphabet[|]Bust down the Rollie, can't see where the time's at[|]Cut with the sack like I should have played lineback[|]Drunk me a 4 in the 20 ounce pineapple[|][?] with my neck, I think I hear a [?][|]Serving the junkies I grew up a bastard[|]Smoking moonrocks, I'm going to NASA[|]Bands on me like I'm having a battle[|][?] the cookie, it don't even matter[|]Get to poppin' pills, you would think I have cancer[|]In the foreign gettin' road head from a dancer[|]I'm in designer made from a [?][|]I come in this bitch lit like a candle[|][Verse 3: Quavo][|]Too many bricks, gotta sort 'em (bricks)[|]Nigga, come and place your order (brrp)[|]Look at my wrist, it's water (water)[|]Your favorite top model a snorter (wooh)[|]Cost on my ears, a quarter (ears)[|]Fuck how you feel, abort 'em (fuck it)[|]I'm in the field, Portis (field)[|]Empty the shell, tortoise (rah)[|]Give me the bail, ornament (bail)[|]Name a lil' bitch I ain't goin' to get (bitch)[|]Police tryna steal like the Hornets ([?])[|]Send me ten bricks and have fun with it (ten)[|]If it ain't clean, I don't want it (clean)[|]Drop me a ten for opponents (ten)[|]You get a mule or a donkey (mule)[|]Just give me the extras, I want it (wooh)[|]I'm with your broad and all[|]I'm taking her phone, denying your calls (brr)[|]I'm with my dogs and all[|]We pulling up on you and tie-dyeing the walls (whoa)[|]I got the 9, the uzi, the big bazooka, it's just for a cause (wooh)[|]Look at my wrist, the Patek, the 1970 disco ball (ice)
Look At My Dab,Bitch dab, bitch dab[|]Bitch dab, bitch dab[|]Bitch dab, bitch dab[|]Bitch dab, bitch dab[|]Bitch dab, bitch dab[|]Dab, dab, dab, dab, dab, dab[|]Look at my dab, dab[|]Look at my dab, bitch dab[|]Look at my dab, bitch dab[|]Look at my dab, bitch dab[|]Look at my dab, bitch dab[|]Look at my dab, bitch dab[|]Look at my dab, bitch dab[|]Look at my dab, bitch dab[|]Get in there, get in there[|]Get in there, get in there, bitch dab[|]Get in there, get in there, bitch dab[|]Get in there, get in there, bitch dab[|]Get in there, get in there, bitch dab[|]Get in there, get in there, bitch dab[|]Get in there, get in there, bitch dab[|]Look at my dab[|]Look at my dab, everybody sayin' dab[|]Trap niggas on the map, trap niggas like to dab[|]Trap niggas in the bowl, trap niggas on the stove[|]Trap niggas worldwide, play with the pie with no eyes[|]Dabbin' goin' in the dictionary, birds sangin' just like Mary Mary[|]The bricks got wings like the tooth fairy, pinky ring yellow canary[|]Touch down on the pack and I run it like Barry[|]Migo like Ed, Edd and Eddy[|]You mad 'bout your homeboy, that's petty[|]Spray the chopper like confetti[|]Look at my dab, got me feelin' like I'm Fab[|]Look at my dab, spreadin' dab across the map[|]I'm dabbin' when I walk up in the trap[|]I look at the pot, I'm like "get in there!"[|]I play with the water need swimwear[|]Look at my dab, get in there![|]Look at my dab, dab[|]Look at my dab, bitch dab[|]Look at my dab, bitch dab[|]Look at my dab, bitch dab[|]Look at my dab, bitch dab[|]Look at my dab, bitch dab[|]Look at my dab, bitch dab[|]Look at my dab, bitch dab[|]Get in there, get in there[|]Get in there, get in there, bitch dab[|]Get in there, get in there, bitch dab[|]Get in there, get in there, bitch dab[|]Get in there, get in there, bitch dab[|]Get in there, get in there, bitch dab[|]Get in there, get in there, bitch dab[|]Look at my dab[|]Get in there, get in there[|]Got me dabbin', Yung Rich Nation, yeah[|]Lookin' like I'm not from around here[|]Young nigga dabbin' out the atmosphere[|]You niggas still sayin' swag[|]My niggas switched it up we call it dab[|]Step out with a light up I call it jab[|]Michael Jordan I'm perfecting my craft[|]Money counter, count it up with my hands[|]Young nigga, I can show you how to do math[|]Sippin' and drinkin', I pour me some muddy[|]My nigga not tryin' to remember my past[|]Don't come to my hood if you ain't got a pass[|]Eat up the dab like linguini and crab[|]Mr. McMahon, I fire you and your staff[|]Watchin' you niggas dabbin' made me laugh[|]Dabbin' is a way of fashion, touchdown like I'm Takeoff McFadden[|]Call a play like I'm Takeoff John Madden[|]She get a platinum plaque from all this dabbin'[|]You niggas should get a Grammy, the way you actin'[|]Enough of that swag I put it in a casket[|]Look at my dab, yo bitch droppin' her panties[|]I feel fantastic, immaculate dabbin'[|]Stay off my grass, call me Takeoff Stanley[|]Look at my dab, dab[|]Look at my dab, bitch dab[|]Look at my dab, bitch dab[|]Look at my dab, bitch dab[|]Look at my dab, bitch dab[|]Look at my dab, bitch dab[|]Look at my dab, bitch dab[|]Look at my dab, bitch dab[|]Get in there, get in there[|]Get in there, get in there, bitch dab[|]Get in there, get in there, bitch dab[|]Get in there, get in there, bitch dab[|]Get in there, get in there, bitch dab[|]Get in there, get in there, bitch dab[|]Get in there, get in there, bitch dab[|]Look at my dab[|]So now niggas dabbin'[|]Before it was swaggin'[|]Nigga thinkin' that it's just a dance[|]When dabbin' is a way of fashion[|]See I'm tryin' to teach y'all the rules and regulations[|]Cause there's a lot of niggas out here perpetrating[|]No temptations, Migos sensation[|]Seen a lot of faces, why not make a Young Rich Nation
Brokanese,
