MuhFuckn Tired,Yeah, young rich niggas[|]Back to back, two times[|]Hahaha[|]Hit a nigga with the throwaway[|]Bitch I came from another place[|]Unfortunately we couldn't beat the case[|]Fuck it we outta jail anyway[|]You want the Migo gang? You got to pay[|]Kickin' in doors for the 10k, 14k, anything[|]Young nigga cashin' out for the change[|]I already dreamed that I had the fame[|]Red and white coupe like a candy cane[|]Pop a perc, it feel like Bruce Wayne[|]Chop a brick like I'm Tsung Shang[|]Bitch I'm dabbin' in my own lane[|]Chokeslam a nigga, Quavo Kane[|]I hate a nigga tryna cook plain[|]Cause my money taller than a great dane[|]We gave the world dab fever check[|]My receipt is thousand dollar sneakers[|]Stop and get a play from cheetah[|]Quavo Derek Jeter, keep a street sweeper[|]I'm a salt water alligator eater[|]I play with water, you can check the meter[|]Cookie bag, that's my choice of reefer[|]Migo gang, aka grim reapers[|]Try the squad, nigga shots fired[|]Thugger daughter motherfuckin' tired (my niece)[|]Baby bottles, ain't no babies cryin' (drank)[|]Hit 'em if he cross the gun line[|]You holdin' yours? I'ma bust mine[|]He lookin' wrong, call it sus time[|]Free my niggas, give 'em phone time[|]Skin a nigga like a pork rind[|]We get to the money in short time[|]Watch us make it back 10 times[|]My wrist spinnin', I'm so fuckin' tired[|]That my favorite line, I'm motherfuckin' tired[|]Chop a brick like a samurai[|]We the niggas make the birds fly[|]Then I fucked the bitch five times[|]Then I took her out cause I'm fuckin' tired[|]Takeoff!![|]Just fucked a model bitch five times[|]I just ate a burger from Five Guys[|]I'm smokin' on cookies from High Times[|]You smokin' with [?] outside[|]Migo gang, we have them mob ties[|]Put a fuck nigga on Fox 5[|]Pretty little bitch with her mouth wide[|]She see me pull up in that, frog eyes[|]Your bitch is 30 on the beat[|]Keep a 30 by my side[|]My bitches on fleek, Louboutin they feet[|]Ain't no question my niggas gon' ride[|]Ain't talkin' bout Drexler[|]When they come to that dope, nigga, I bet it's gon' glide[|]Ain't talkin' bout Dexter[|]Cook in the laboratory, Fendi frames on my eyes[|]Remember my pockets win the lottery[|]So every check gotta pay my tithes[|]Nigga tellin' lies just to cut time[|]My nigga you see 'em televised[|]No matter how hard I try[|]When I put music out I'm still gon' get criticized[|]Nigga fuckin' round with squad[|]Think they wanna get decapitized[|]Try the squad, nigga shots fired[|]Thugger daughter motherfuckin' tired (my niece)[|]Baby bottles, ain't no babies cryin' (drank)[|]Hit 'em if he cross the gun line[|]You holdin' yours? I'ma bust mine[|]He lookin' wrong, call it sus time[|]Free my niggas, give 'em phone time[|]Skin a nigga like a pork rind[|]We get to the money in short time[|]Watch us make it back 10 times[|]My wrist spinnin', I'm so fuckin' tired[|]That my favorite line I'm motherfuckin' tired[|]Chop a brick like a samurai[|]We the niggas make the birds fly[|]Then I fucked the bitch five times[|]Then I took her out cause I'm fuckin' tired[|]I'm tired... I'm tired[|]These niggas flexin'[|]They talk about diamonds, they do not got VS inside 'em[|]I hit a lick, we divided it[|]Porsche with the gator inside of it[|]I'm on three Percs and I'm out of it[|]She gonna suck me up privately[|]I was young when the trap game adopted me[|]Grabbed the stick and shot his abdomen[|]Young nigga I am an arson[|]I got the pump in the cut with the carbon[|]My wrist cost a motherfuckin' 'Rari[|]I am a boss, I pull strings like a guitarist[|]You out of season, you need Lawries[|]Pull up in Beamers but trap out a Taurus[|]Look at the brick on my wrist look like Mick[|]When I got famous I darkened my tint[|]She took a mile when I gave her an inch[|]Won't sell my soul for some cash or a Bent[|]Hop in the plane and we land in Berlin[|]Christian Dior my bitch and her friend[|](?) when I was in the pen[|]Prayin' to God that I don't go again[|]Try the squad, nigga shots fired[|]Thugger daughter motherfuckin' tired (my niece)[|]Baby bottles, ain't no babies cryin' (drank)[|]Hit 'em if he cross the gun line[|]You holdin' yours? I'ma bust mine[|]He lookin' wrong, call it sus time[|]Free my niggas, give 'em phone time[|]Skin a nigga like a pork rind[|]We get to the money in short time[|]Watch us make it back 10 times[|]My wrist spinnin', I'm so fuckin' tired[|]That my favorite line I'm motherfuckin' tired[|]Chop a brick like a samurai[|]We the niggas make the birds fly[|]Then I fucked the bitch five times[|]Then I took her out cause I'm fuckin' tired
New Atlanta,Yo, yo, yo, yo, yo[|]I told y'all niggas a long time ago[|]Come fuck with my city, nah mean[|]Rich Homies, Migos, Young Thug, and me motherfucker[|](Welcome to Atlanta baby) You never been to Atlanta[|]Welcome to new Atlanta, Phantoms on-top of Phantoms (Get that new Atlanta baby)[|]Hannah Montana boot up in Atlanta[|]New Atlanta, we don't need security, walking around with that hammer[|]Break out the cameras (Camera baby, porno movie, fuck your camera babe[|]Don't get your bitch ass killed in New Atlanta baby)[|]We don't fuck with cameras out here I'm for real[|]Fuck the police, we won't tell, we keepin' it trill (In new Atlanta baby)[|]Crossover spaghetti junction[|]Northside Migo bando bunkin'[|]Lil' momma she foreign, she not from this country[|]Fly to Atlanta, we land in the morning[|]Droppin' my top on the avenue![|]Young nigga, you stay with your mama, call you Bartholomew[|]Come to Atlanta, we breakin' the rules[|]Do you remember my teacher say we wouldn't make it[|]I gotta thank y'all, Atlanta made us famous[|]Hustle where we invented swag, live in Atlanta, we might have some haters[|]The new Atlanta like the old Lakers[|]I'm a young rich nigga, whippin' the chemicals[|]Middle of the summer wearin' chinchilla's[|]Up in the city Atlanta with your bitch[|]She poppin' the pussy, no pimple[|]It's been a long time coming, Migos, Thug, Rich Homie[|]No we don't fuck with no phonies[|]You niggas been cloning then watching like Sony (You copy me)[|]Momma said I was a born star, came out the pussy with a spatula[|]Selling dope like Pablo Escobar[|]I'm hot, they lookin' for me switchin' cars[|]Bentley Mulsanne I just blew out the brain of the Audi, alright with the paper temp plate[|]Takeoff and Thug, Offset, Quavo, Quan, new Atlanta, we the heavyweight[|](Welcome to Atlanta baby) You never been to Atlanta[|]Welcome to new Atlanta, Phantoms on-top of Phantoms (Get that new Atlanta baby)[|]Hannah Montana boot up in Atlanta[|]New Atlanta, we don't need security, walking around with that hammer[|]Break out the cameras (Camera baby, porno movie, fuck your camera babe[|]Don't get your bitch ass killed in New Atlanta baby)[|]We don't fuck with cameras out here I'm for real[|]Fuck the police, we won't tell, we keepin' it trill (In new Atlanta baby)[|]I had the desire, we startin' empires[|]You niggas retired, Givenchy attire[|]I'm trappin', they think I live in The Wire[|]I had to flood out my new Audemars[|]Drop in the Ghost, scaring niggas like Michael Myers[|]Fuckin' your bitch pass her 'round like a flyer[|]All the little kids lookin' at me, admired[|]I pull up in 'Raris, I forgi my tires[|]I'm dropping in foreigns, might tropicana[|]Just in New Atlanta, pullin' up the Phantoms[|]For you niggas that monkey we got bananas[|]Throw a temper tantrum when I'm on the channel[|]We finessin' that kind up in Atlanta[|]Put a price on your head like a Bandana[|]Dipset, like Juelz Santana[|]I'm dropping the top on my panoramic[|](Welcome to Atlanta baby) You never been to Atlanta[|]Welcome to new Atlanta, Phantoms on-top of Phantoms (Get that new Atlanta baby)[|]Hannah Montana boot up in Atlanta[|]New Atlanta, we don't need security, walking around with that hammer[|]Break out the cameras (Camera baby, porno movie, fuck your camera babe[|]Don't get your bitch ass killed in New Atlanta baby)[|]We don't fuck with cameras out here I'm for real[|]Fuck the police, we won't tell, we keepin' it trill (In new Atlanta baby)[|]Motherfuckers hatin' and shit[|]Motherfuckers still movin' out here and shit[|]It's still love in this motherfucker[|]And niggas think this shit gonna stop[|]It ain't never gonna stop[|]It's just gonna keep going, Rich Homie, tell 'em where you're from[|]A-T-L-A-N-T-A, GA that where I'm from[|]East Atlanta, that's where I stay, aka the slums[|]I got trained to slime without a gun[|](Migos and Quan roll up another one[|]Doctors don't know what we are)[|]Magic still poppin' on Mondays, ain't no more 20 grams[|]New Atlanta, we stuntin', I keep me like 20 bands[|](Shawty Lo lifestyle I'm the man, got your main ho here in my hand[|]I ain't Future but I have free bands, I can't help who I am)[|]God, I can't help who I is or where I'm from[|]Welcome to Atlanta, where you better watch your tongue[|](Hey, I did dirt for this water, I feel like a pond[|]I'm from? Homie Quan, tell 'em where you're from)[|](Welcome to Atlanta baby) You never been to Atlanta[|]Welcome to new Atlanta, Phantoms on-top of Phantoms (Get that new Atlanta baby)[|]Hannah Montana boot up in Atlanta[|]New Atlanta, we don't need security, walking around with that hammer[|]Break out the cameras (Camera baby, porno movie, fuck your camera babe[|]Don't get your bitch ass killed in New Atlanta baby)[|]We don't fuck with cameras out here I'm for real[|]Fuck the police, we won't tell, we keepin' it trill (In new Atlanta baby)
No Pad, No Pencil,No pad no pencil[|]bitch ass fuck boys[|]BTF BTF BTF[|]BAYtown
Now,Now nigga[|]Nigga now[|]Nigga now[|]Nigga now, now, now[|]Now, now[|]This shit sound like now[|]Hey fuck boy won't you talk that shit now?[|]Gucci, I'm so turned up it make you look turnt down[|]Now I turn your smile to a frown[|]I'm the king there with a crown[|]Keep your eyes to the ground[|]Now you must be from out of town[|]Cause everybody round here know that Wop don't fuck around[|]You was rich back then but I'm rich right now[|]You was the shit back then, I'm the shit right now[|]Took your bitch back then, with your bitch right now[|]Get every R&B; chick on my dick right now[|]Now this shit sound like now[|]While y'all all played out but I'm hot right now[|]Gucci[|]Run the pack out right now[|]Run the pack out right now[|]Run the pack out right now[|]Run the pack out right now[|]Run the pack out right now[|]Run the pack out right now[|]Run the pack out right now[|]Run the pack out right now[|]We can bring the racks out now[|]We can bring the racks out now[|]We can bring the racks out now[|]We can bring the racks out now[|]We can bring the racks out now[|]We can bring the racks out now[|]Pull up with rings on[|]I'm puttin' my team on[|]I wanna fuck her but she can't take no racks home[|]Migos and Gucci we back home[|]My pockets stay green like geckoes[|]What if your wrist get tired Quavo?[|]Then I'ma whip with my elbow[|]Only one that fuck with me now[|]Why the fuck you come around?[|]I screwed the little tip on the silencer so a nigga can shoot with no sound[|]I take your bitch to the island so she can know that you won't come around[|]I fell asleep in her pussy while you keep textin' and callin' her now[|]I'ma put dab in this style and you lil niggas should know that by now[|]I'm tryna sell you the swag, you lil niggas should order it now[|]Smokin' a pound of gas now[|]Keep it goin', a sack now[|]It's all a nigga had now[|]So let a nigga brag now[|]Run the pack out right now[|]Run the pack out right now[|]Run the pack out right now[|]Run the pack out right now[|]Run the pack out right now[|]Run the pack out right now[|]Run the pack out right now[|]Run the pack out right now[|]We can bring the racks out now[|]We can bring the racks out now[|]We can bring the racks out now[|]We can bring the racks out now[|]We can bring the racks out now[|]We can bring the racks out now[|]I bust a nigga back then, I'll bust a nigga now[|]At first we were trappin' the ounce[|]Now we got bricks in the couch[|]50k in the pouch, J's in the lot in and out[|]My diamond hit my nigga, ouch[|]I put this pistol in your mouth[|]Servin', swervin'[|]Lamborghini hit the curb and[|]Niggas freeze up when they nervous[|]And I'm servin' clean, detergent[|]I got babies and I nurse 'em[|]Dirty little bitches they worsh' 'em[|]I'm on a mission to murk 'em[|]Eat 'em alive and I burp 'em[|]Ain't no Thanksgivin' nigga but we still in the trap with the turkeys[|]You used to be at the top, I watch, and now I look down at you hurtin'[|]Back in the day I was broke but now I got money, I'm flexin' on purpose[|]In the Maybach with the curtain with my feet up while I'm sippin' the sherbet[|]Run the pack out right now[|]Run the pack out right now[|]Run the pack out right now[|]Run the pack out right now[|]Run the pack out right now[|]Run the pack out right now[|]Run the pack out right now[|]Run the pack out right now[|]We can bring the racks out now[|]We can bring the racks out now[|]We can bring the racks out now[|]We can bring the racks out now[|]We can bring the racks out now[|]We can bring the racks out now[|]We can bring the racks out now[|]Top drop down, make a nigga look around[|]All my niggas havin' the packs and the racks[|]Can't forget the strap, nigga get gunned down[|]Bah-bah, gun sound, run now[|]Bulletproof vest on, still man down[|]If a nigga broke, don't come round[|]Drinkin' Actavis out the double seal right now[|]Come get that dope if you want it[|]Diamonds cold on me, pnemounia[|]Walkin' with 50 racks on me[|]I wish you would run up on me[|]Play with money like you're play-dough[|]Put some on your head like a halo[|]They talkin' but it's okay though[|]No OVO and we Drake 'em[|]Run the pack out right now[|]Run the pack out right now[|]Run the pack out right now[|]Run the pack out right now[|]Run the pack out right now[|]Run the pack out right now[|]Run the pack out right now[|]Run the pack out right now[|]We can bring the racks out now[|]We can bring the racks out now[|]We can bring the racks out now[|]We can bring the racks out now[|]We can bring the racks out now[|]We can bring the racks out now
Origin,
Ounces,Migos! Metro![|]I mean all I ever wanted to be[|]Y'all know what we wanted to be[|]Uh, rich![|]All I ever wanted was some motherfuckin' guala (money)[|]Bando used to smell like some stinkin' enchiladas (bando)[|]The streets is a jungle, got to watch for the koalas (snoopers)[|]All I ever wanted was to get rid of them ounces, ounces[|]Ounces, ounces, ounces[|]Ounces, ounces, ounces[|]Ounces, ounces, ounces[|]Whole lot of ounces! (whole lot)[|]Ounces, ounces, ounces[|]Ounces, ounces, ounces[|]All I ever wanted was to get rid of them ounces[|]Walk around with large amounts of guala on me[|]I'm walking around with a pocket rocket, don't run up on me lonely[|]Bought my first Audi with the fish scale guts[|]Now I got the bitches, wanna fuck, they wanna cuddle up[|]Wanna come to the bando, knock two times then twist the handle[|]Got everything in stock, whatever you need, just ask me[|]I'm selling that kush to Asher, real money, got a whole bag of Ashley[|]Money taller than mountains, drinking lean out of damn water fountains[|]She so bad gave me erection or erode, whatever you call it[|]Bitch, me and my team been balling[|]Bet your label keep motherfucking calling[|]Woke up to a bitch this morning, got 16 new text message[|]10 of em' saying "go get to the guap", other 6 saying "Migos up next"[|]G-g-g-g-gone![|]All I ever wanted was some motherfuckin' guala (money)[|]Bando used to smell like some stinkin' enchiladas (bando)[|]The streets is a jungle, got to watch for the koalas (snoopers)[|]All I ever wanted was to get rid of them ounces, ounces[|]Ounces, ounces, ounces[|]Ounces, ounces, ounces[|]Ounces, ounces, ounces[|]Whole lot of ounces! (whole lot)[|]Ounces, ounces, ounces[|]Ounces, ounces, ounces[|]All I ever wanted was to get rid of them ounces[|]When I was a kid all I wanted was a hundred dollar bill[|]Now I'm 19, young nigga want 100 mil[|]Selling whole things, want an ounce? Can't bust the seal[|]Wanna be a trapper? Never serve a nigga where you live[|]In the Bando counting chips no poker, weighing bales of Okra[|]I got lots of O's, put my name right next to Al Capone[|]I'm a Wizard, Antwan Jamison[|]My plug ain't Kangaroo Jack, but he Australian[|]And he got crack sacks in the knapsack[|]Critics say I'm a product of my environment[|]Selling that dope to economists, menace to society[|]On the top of the mountain, you under me[|]Young nigga, I'm trapping and grinding[|]No scale for the workers, I'm eying it[|]You niggas still nickel and diming[|]Remix the dope and you niggas still buying it[|]All I ever wanted was some motherfuckin' guala (money)[|]Bando used to smell like some stinkin' enchiladas (bando)[|]The streets is a jungle, got to watch for the koalas (snoopers)[|]All I ever wanted was to get rid of them ounces, ounces[|]Ounces, ounces, ounces[|]Ounces, ounces, ounces[|]Ounces, ounces, ounces[|]Whole lot of ounces! (whole lot)[|]Ounces, ounces, ounces[|]Ounces, ounces, ounces[|]All I ever wanted was to get rid of them ounces[|]Fuck the rap game cause these rap niggas really ain't shit[|]I hop in the Audi, I hop in the Bentley[|]Fuck it I'm smashing that bitch[|]Young rich nigga with the Rollie wrist[|]Trapping and capping, I'm selling the birdie[|]You fuck niggas really ain't serving[|]Selling the bricks to the plug up in Berlin[|]Put the dope in the water, hit it with the egg beater[|]Sipping lean, yeah I'm good, I'm tequila[|]My neck is so sick, got the measles[|]This for my my niggas that trap in the Regal[|]Ounces, ounces, ounces, molly Santana's tall as a mountain[|]Put the molly on top of her tongue[|]She sucking and fucking, she ain't got no manners[|]Back to the basics, I'm counting these faces[|]My pockets inflating off trapping and baiting[|]You niggas fugazy, my niggas, they strapped like the Navy[|]I'm the mayor, matter fact, I'm the president[|]Sipping on Actavis, like it's my medicine[|]Throwing the bird with accuracy, all of you niggas is amateur[|]Pull up in Phantoms, but trap out of Challengers[|]All I ever wanted was some motherfuckin' guala (money)[|]Bando used to smell like some stinkin' enchiladas (bando)[|]The streets is a jungle, got to watch for the koalas (snoopers)[|]All I ever wanted was to get rid of them ounces, ounces[|]Ounces, ounces, ounces[|]Ounces, ounces, ounces[|]Ounces, ounces, ounces[|]Whole lot of ounces! (whole lot)[|]Ounces, ounces, ounces[|]Ounces, ounces, ounces[|]All I ever wanted was to get rid of them ounces
Out Yo Way [Explicit],I wanna say you always going out your way[|]Cancel all your plans, you will understand[|]You probably got your hands full, whatever goal you pursue[|]All this pain, we can live through it, it's called success[|]You always going out your way[|]You always dropping off your flav[|]You always going out your way[|]You never ask me to repay, no[|]You always going out your way, yeah yeah[|]You always going out your way, yeah[|]Yeah yeah[|]I won't ask the bitch unless she going to get it[|]It might take a minute, but she'll be sure to get it[|]Just to pass the test, I won't act the best[|]I got Actavis, there's nothing I can't ask the bitch, no[|]Got one missed, no missed calls, hell nah, nah[|]She got a man, can't get involved, nah nah[|]She still going all ways every time I call[|]We gonna ball today, we gonna ball tomorrow[|]I put this weight on like I put a cape on[|]Now that this fame came, I can see the hate on you[|]Mama told me stay strong, grandma told me stay on[|]Now she looking down, throwing blessings[|]You always going out your way[|]You always dropping off your flav[|]You always going out your way[|]You never ask me to repay, no[|]You always going out your way, yeah yeah[|]You always going out your way, yeah[|]Yeah yeah[|]Go out your way and come out[|]Go out your way to mom's house (Mama!)[|]You go out your way, so out your way[|]You going out your way to come back around[|]You go out your way and keep cool[|]You go out your way and break rules[|]You go out your way, so out your way[|]You're going out your way, you can't lose[|]Make a trip to Cancun, spaceship trips to the moon[|]Never likes to tell the truth[|]Head full of hair, but the cat with a groom[|]Plan a trip to Peru, charter jet, me and you[|]You going out your way, way out your way[|]So I had to do this for you[|]Jackpot, hit the right spot, so she had to get a tattoo[|]It's some dirt and hurt, but ain't perfect[|]If she going our way, come through[|]Hold me down, either good or bad[|]Never switch, or act brand new[|]You go out your way and wasn't told to[|]So I made this song just for you[|]You always going out your way[|]You always dropping off your flav[|]You always going out your way[|]You never ask me to repay, no[|]You always going out your way, yeah yeah[|]You always going out your way, yeah[|]Yeah yeah[|]I put my heart and my soul in it[|]Get to the money, then double it[|]All of these bitches, they loving me[|]But you had my back from the other me[|]She bending over, back for me[|]Made a deal that you wouldn't cross, lie to me[|]It was so many people that doubted me[|]Shit talk, shit talk, bullets starting to let off[|]Jack Frost, Jack Frost, wrist cost a whole house[|]Blast off, blast off, my career gon' blast off[|]We don't need y'all, want y'all, we don't have to ask y'all[|]I been fucking on the nats, nigga all day[|]Ride through the city, yeah the ball way[|]We was trappin', cappin' all through the hallway[|]Everybody said that we would fall away[|]Nobody thought that we would go up[|]But we blew up, blew up, blew up[|]Fucking on a thot on the tour bus[|]Going out your way for the two of us[|]You always going out your way[|]You always dropping off your flav[|]You always going out your way[|]You never ask me to repay, no[|]You always going out your way, yeah yeah[|]You always going out your way, yeah[|]Yeah yeah
