Bulletproof,Living like a bulletproof, bang-bang-bang-bang-bang.[|]Living like a bulletproof, bang-bang-bang-bang-bang.[|]Living like a bulletproof, bang-bang-bang-bang-bang.[|]Game fucked up, streets ain't got loyalty[|]Real dope boy and I spit real nigga poetry[|]Nigga talkin' foul loud about what they gonna do to me[|]Bought all my cars white so when you see me, bitch, you know it's me.[|]You know I'm living, nigga but I'm cruising down College[|]With my pistol in my pocket lil bad bitch in college[|]I'm getting head in my droping, feeling like I'm bulletproof[|]Told my nigga catch a body gone, get yourself a coupe or two.[|]Free the nigga Meech and free my nigga boosie too[|]Tonight I'm in the strip club and (?)[|]I'm sick of rap niggas, and my strapped niggas[|]Got an AK and a .38 in my trap nigga.[|]Living like a bulletproof, bang-bang-bang-bang-bang.[|]Living like a bulletproof, bang-bang-bang-bang-bang.[|]I'm feelin some kind of way, ready to leave here today[|]You cross the line with me, pussy, I shoot you square in your face.[|]I keep these niggas in line, I put these hoes in they place[|]Brilliant new look, they got it, that boi just caught him a case.[|]Million cash for the boomer, I got dat sack on the way[|]Don't need to talk to no lawyer, boy, hoe, I'm not here today.[|]You think I come here to play, you watch your head beat and that[|]I'm in the streets every day and I've got a hell of a grant.[|]I will lost in the money, these streets won't dare to hunt it[|]I put this rap shit on hold, you've got my niggers a bundle.[|]You nigger's six feet and under, 'cause they dare play with the king.[|]Than in this case I'm enormous, see, I stood up for the team.[|]Never rent on my homes, niggers know I'm their homie[|]You're feeling bulletproof, nigger, swear to God you don't want.[|]Living like a bulletproof, bang-bang-bang-bang-bang.[|]Living like a bulletproof, bang-bang-bang-bang-bang.
Women Lie,Women lie, men lie[|]Women lie, men lie[|]Women lie, men lie[|]Numbers don't lie[|]Women lie, men lie[|]Women lie, men lie[|]Women lie, men lie[|]Numbers don't lie[|]Women lie, men lie[|]Women lie, men lie[|]Women lie, men lie[|]Numbers don't lie[|]Women lie, men lie[|]Women lie, men lie[|]Women lie, men lie[|]Numbers don't lie[|]Women lie, men lie[|]Women lie, men lie[|]Women lie, men lie[|]Numbers don't lie[|]Women lie, men lie[|]Women lie, men lie[|]Women lie, men lie[|]Numbers don't lie[|]Hey, step up in the party and them bad bitches be on me[|]I be sippin' on Patron, when I'm jumpin' out Ferrari's[|]I be rocking Gucci, sometimes Louis, I'm retarded[|]And I'm real fine, shawty, with the shades by Bacaray[|]Hand on my scrop, I got my mind on my money[|]'Cause if my mind on dine, he ain't taking nothing from me[|]Headed on these choppers too, headed on these choppers too[|]Headed on the hood and around 'cause this how much the choppers shop[|]Ballin' is my hobby, damn, homie goin' shoppin'[|]Got a 5 star with me and a milli in the lobby[|]Took her to the room, she hit me with that line[|]She ain't that type of girl so I told her stop lying[|]Women lie, men lie[|]Women lie, men lie[|]Women lie, men lie[|]Numbers don't lie[|]Women lie, men lie[|]Women lie, men lie[|]Women lie, men lie[|]Numbers don't lie[|]Women lie, men lie[|]Women lie, men lie[|]Women lie, men lie[|]Numbers don't lie[|]Women lie, men lie[|]Women lie, men lie[|]Women lie, men lie[|]Numbers don't lie[|]Young money, yeah, okay[|]I ain't gotta lie, cross my heart hope to die[|]The numbers don't lie, G5 over sky[|]I fucked her pussy good, make her cry if I tried[|]I'm tired of being sick and I'm sick of being tired[|]Tired of these niggas and tired of these bitches[|]Shit, let 'em lie as long as they ain't snitching[|]Ha, ha, and men lie about women[|]And shit, women lie about plenty[|]Huh, they lying on me[|]I'm in the bed with 2 fine bitches lying on me[|]So that would make 3 and numbers don't lie[|]And money don't lie and neither do I, bitch[|]Women lie, men lie[|]Women lie, men lie[|]Women lie, men lie[|]Numbers don't lie[|]Women lie, men lie[|]Women lie, men lie[|]Women lie, men lie[|]Numbers don't lie[|]Women lie, men lie[|]Women lie, men lie[|]Women lie, men lie[|]Numbers don't lie[|]Women lie, men lie[|]Women lie, men lie[|]Women lie, men lie[|]Numbers don't lie[|]I'm trying to count to a billion, my bitch Brazilian[|]Hop in that Lam, push the button, lose the ceiling[|]Sun out, no raindrops, posting the same spot[|]Right here in North, North Memphis's where I came from[|]Hundred on the neck, I ain't never had shit[|]The streets gave me family, Barry White cut the check[|]Ain't no secret in the streets, niggas know I gotten it[|]Got swagger through the roof, I was born with just to fit[|]Zip code on my wrist, phone number in the bank[|]In my 10 till 6, where my 305 paint[|]I got my 357 and my 501s[|]And a Lear 55 with my Air Force Ones, no lie[|]Women lie, men lie[|]Women lie, men lie[|]Women lie, men lie[|]Numbers don't lie[|]Women lie, men lie[|]Women lie, men lie[|]Women lie, men lie[|]Say what you want, but the numbers don't lie
Live From The Kitchen,"Live From The Kitchen"[|]Yeah[|]Ay, ay we finally here nigga, you know what I'm sayin[|]Live from the kitchen[|]I wanna introduce ya'll to my band[|]One them name mr. pirex, mr. pot, mr. baking soda,[|]Know wha I mean, ha[|]It go live from the kitchen[|]Li-li-live from the kitchen, its me an my bands[|]Live from the kitchen, its me an my bands[|]Baking soda, test tube, pot, and the pan[|]Live from the kitchen, well over do[|]Ten mixtapes state I got a porsche sedan coupe,[|]Yeah that bitch got four doors,[|]I got four hoes on my screwed up click shit[|]Got me tippin on four fours[|]Yeah them knocks ran in my spot[|]Them bitches kicked down both doors[|]Confiscated both my choppers an took pitures of both stoves[|]Gang tags been on my ass, yeah they raided both my shows[|]Say I'm wearin too much white, I told em I represent dat blow[|]From the kitchen, li-li-live from the kitchen[|]It just me an my bands, shit get for real[|]Niggas start playin, I dont need a hundred niggas[|]It just me an my man bap[|]Two deep in that rega, red beam on that eagle[|]You can die about it, but you fight bout it[|]Niga ye ain't goin witt me neither[|]Live from the kitchen it just a statement[|]Got that kush shit by the bells[|]An bitch I'm live from the basement[|]Got that purp in I can taste it[|]My time don't you waste it[|]Niggas think they can start some beef[|]An then come back an erase it[|]I got benjamin on my faces, I got lawyers fightin my cases[|]You know me vs war bugs bunnys in my braclet[|]Bitch I'm live from the jeweler, I am, just bought a rolla[|]An pin . is you a dealer or a user[|]Wrist abuser, baby momma had it great[|]She like street niggas, she say I amuse her[|]Live from the kitchen, li-li-live from the kitchen[|]Fuckin bitches on tha dishes,[|]Bent her over on tha counter,[|]Right in front the money counter, (chee)[|]Kept her layin angainst tha fridgerator[|]Incase I get some anal[|]Thats a old word, I got old birds[|]I got old breads an these bitches small heads[|]I don't trust niggas, I say they all feds (they is)[|]We at war wit niggas, an I want em all dead![|]Live from the kitchen, li-li-live from the kitchen[|]It just me an my bands, pots, pans, pots an pans[|]Li-live from the kitchen, it just me an my band[|]When the beat break down let tha money machine roll[|]I been on tha road doin nothin but cash shows[|]It juss, li-i, it just me an my bands[|]Live from tha kitchen, it just me an my man-zilla[|]What it do young nigga, we got our money right[|]Plus you got tha green light killa[|]At tha kitchen table playin dominoes[|]With some munich niggas, an some shiizty hoes, bitch[|]They smoke hella blunts, they play wit they nose[|]They get super high, then they take off they clothes[|]These hoes gun freaky I make em touch they toes[|]Ask'd her where she want it at, an she say both holes[|]Nah bitch I just want some mouth[|]Gimme some head right here on tha couch[|]I'm goin north bitch you goin south[|]I'm Y-O-G-O-T-T-I-. bitch you know what I'm bout[|]Gotti! from tha kitchen,[|]Li-li-live from the kitchen, it just me an my bands[|]I am, me an my bands, I am, me an my bands, I am[|]Live from the kitchen it just me an my bands, I am[|]...beep, its all there... beep, (li-li-live from the kitchen, li-li-live from the kitchen me an my bands, me an my bands)
Shawty Violating,Wup that hoe [x13][|][Chorus x2: Yo Gotti][|]Wup that hoe, Wup that hoe (she fucked yo baby daddy)[|]Wup that hoe, wup that hoe (shit I aint mad at ya)[|]Wup that hoe, wup that hoe (shawty violating)[|]Wup that hoe, wup that hoe (shawty been hating)[|][Verse 1:][|]There were two hoes, Yo Gotti, one couple hearin[|]Who be hollering look at that hoe fucking her friend[|]Knowing 'bout the beef and shit I gone tuck my eyesPop my collar, hit my boy and let these hoes fight[|]Float like a butterfly, sting like a bee[|]Shawty got a right like she Laila Ali[|]Thats just my baby mama[|]And her best friend[|]Coming out they stilettos to do these hoes in[|]U fucked the wrong nigga[|]Caught the wrong bitch[|]Hit the wrong club, and got yo ass kicked[|]I fuck wit hood hoes[|]Them hoes stay jacking[|]Look at shawty weave[|]I'm like dammmmnnnn what happened[|][Chorus: x2][|]Wup that hoe [x13][|][Verse 2: Lil' Chat][|]The hoe done fucked my baby daddy[|]Now the hoe is out here braggin'[|]When I see the hoe, through the door her ass Im gone be draggin'[|]Bitch I be ya mad[|]What you did hoe is nothing[|]But I gotta beat yo ass cuz you think you did something[|]I aint fucked up bout no nigga[|]Niggas coming by the dozen[|]I be with da shit, my paper is thick, like niggas kill they cousin[|]Talkin shit now I cant go[|]Throw dem thangs on dat hoe[|]See you buckin in da club before you know you on da floor[|]I be strapped like jab in the back[|]Beat dem killers thats gone attack[|]Hoe you know its gone be on when you talking about fucking off with Lil' Chat[|]Bust these bitches with a bottle[|]Naw I'll bust you with my popper[|]Hoe you really don't want no problem cuz my 38 will resolve them[|]Hoe you fresh straight out the mall[|]Brand new set, get staright, get dirt[|]Shit its gonna help you get blazed up cuz you'll get smoked just like some perk[|]I don't play no games with these bitches[|]Lil' Chat straight gone let you know[|]If you disrespect my gangsta[|]Imma staright up wup you hoe! (straight up wup you hoe)[|][Chorus: x2][|][Verse 3:][|]My main girl trippin', she think Im fucking off[|]Ask me 'bout some bitches, I had to play it off[|]Told me if she catch me then she gone cut a shine[|]Found a couple rubbers but I told her they weren't mine[|]She checked my phone, she watched my home, she searched my clothes[|]She asked me 'bout[|]Where I'm at and who I'm with[|]She tryna figure pimpin out[|]She cursed me out said I'm a dog[|]She sitting here crying and saying I'm wrong[|]Calling my phone all through the night and ask me when I'm coming home[|]Rule number 1, if shawty from the projects[|]Niggas takin' care of, you hoes better respect that[|]Nigga got her pregnant, you hoes better respect that[|]Where I'm from hoes get guns and leave hoes wet[|][Chorus: x2][|]Wup that hoe, wup that hoe ['til fade out]
Respect That You Earn,I call it thirst drop, Shawty, oh![|]And you know, they [?][|]For me personal that feels like [?] to respect[|]I ain't wrong for thinking that as I am wrong for thinking this![|]On me to buy you a [?] but is you worthy?[|]Nah, I ain't perfect![|]And I just followed you on Instagram[|]Are you really into women and that you get around?[|]Now I ain't judging, I'm just asking if that's fair to say[|]But either way, it's my opinion, you Know Give Or Take![|]I told this model chick,[|]The girls look up to you and the things you do[|]Every nigga you work with, you're screw,[|]So you know When She grow Up You Know What She Gone do, she like[|]You don't know me, you don't pay my bills[|]You don't know my struggle,[|]Like that shit real, but it is what it is.[|]But I know you know, I know what's real[|]I know your worth, I know that purse[|]Ten bandz, Shawty![|]You can't pay your bills, you're [?][|]I will give you the respect that you earn, that you earn[|]What you make you do, that's what I'm gonna do to you![|]And I'm gonna give you the respect that you earn, that you earn[|]Oh, what you make you do, that's what I'm gonna do to you![|]Give you the respect you earn, that you earn![|]Uh, I kiss on your neck[|]Do you wanna get out of this?[|]Would you feel disrespected[|]Ever said you're fly as shit?[|]Wow, have I called you my bitch[|]When I'm with my partners eating?[|]As a badge of honor or just be like no other,[|]Don't call me out at my momma's given.[|]Name sacred, she whispers mine when I'm in her thighs[|]And I leave her inner feelings, cause I never leave her dry![|]Some [?] lying to her is elevate[|]She know this [?] but I still give her time.[|]I try follow her, everybody want her thing,[|]Worried about none if she gonna work that body![|]And I wanna follow her, though my eyes still on her [?][|]I'm still [?] call her first trap Shawty![|]I will give you the respect that you earn, that you earn[|]What you make you do, that's what I'm gonna do to you![|]Girl, I'm gonna give you the respect that you earn, that you earn[|]Oh, what you make you do, that's what I'm gonna do to you![|]Give you the respect you earn, that you earn![|]She lives for the night life, but that's alright[|]But she wants to be treated like somebody's wife.[|]But you can't be table hopping in a club trying to drink free[|]Girl, come up to my table trying to stand next to me![|]Oh no, oh no, oh no[|]Girl, I'm gonna give you the respect that you earn, that you earn[|]What you make you do, that's what I'm gonna do to you![|]Girl, I'm gonna give you the respect that you earn, that you earn[|]What you make you do, that's what I'm gonna do to you![|]Girl, I'm gonna give you the respect that you earn, that you earn[|]What you make you do, that's what I'm gonna do to you![|]And I'm gonna give you the respect that you earn, that you earn[|]What you make you do, that's what I'm gonna do to you![|]Give you the respect you earn!
Juice,It's another one[|]I got that juice[|]New AP[|]She got that juice (ju-juice)[|]She got that squeeze (squeeze, squeeze, squeeze)[|]She got that whip (whip)[|]I'm on them skis[|]I got that drip (drip)[|]I'm overseas (seas)[|]D-R-I-P-P-I-N-G[|]I got that VVS I-C-E[|]Oh, feels like a cooler[|]Juice, blame it on my jeweler[|]I got stones on my neck (ooh)[|]Blood on me set (ooh)[|]Water on my wrist (drip)[|]Put glitter on my bitch (ju-juice)[|]My ex was a waitress[|]So I gave that hoe a tip (ooh)[|]My ex fucked a lame[|]Now she workin' double shifts (no juice)[|]Our money ain't the same[|]You a lame, and it clear (ooh)[|]I did ten mil in last month, not a year (juice)[|]I gave fifty racks in the club to a pimp (ju-juice)[|]I blew two mil on my dog for a pill[|]I got that juice[|]New AP[|]She got that juice (ju-juice)[|]She got that squeeze (squeeze, squeeze, squeeze)[|]She got that whip (whip)[|]I'm on them skis[|]I got that drip (drip)[|]I'm overseas (seas)[|]D-R-I-P-P-I-N-G[|]I got that VVS I-C-E[|]Ooh, feels like a cooler[|]Juice, blame it on my jeweler[|]Aye[|]Bright banana poured fresh off the runway[|]Monkey-ass niggas, I think y'all all bapes[|]If I see you won't speak, I'm on my Cardi B[|]Shorty got that night-night, put your ass to sleep[|]And my label say i got the juice (juice)[|]Hol' up, aye yo, Gotti, who as hot as you?[|]You'll avoid talkin' money, know there's too much juice[|]You may see me with security, but know I'm the one shootin'[|]I been a boss all my life, I made a millionaire or two[|]And you might see me in a coupe with the disappearing roof[|]I had packs, I got plaques, you get texts for the juice[|]If you ex, you get sex, I made sex with your boo[|]I got that juice[|]New AP[|]She got that juice (ju-juice)[|]She got that squeeze (squeeze, squeeze, squeeze)[|]She got that whip (whip)[|]I'm on them skis[|]I got that drip (drip)[|]I'm overseas (seas)[|]D-R-I-P-P-I-N-G[|]I got that VVS I-C-E[|]Ooh, feels like a cooler[|]Juice, blame it on my jeweler
81,Only if a nigga knew like[|]It's amazin' what 365 days can do for you[|]This time last year niggas was like[|]Talkin' 'bout cuttin' budgets and shit[|]I dropped the biggest record of my career, yeah[|]Nigga business partner with JAY Z[|]Shout out to Ty Ty, wassup nigga?[|]Emory, what it do?[|]You see 'em[|]Gotta pick 'em wisely[|]Gotta choose 'em carefully[|]Got niggas I know that weren't there for me[|]Got bitches I know that don't care for me[|]Could of went on tour with your favorite rapper and declined[|]Why? I'm tryna break CMG[|]So fuck that, I'm doin' mine[|]They see I'm mad, see they call in the streets, call me back[|]Say they miss the old Gotti, old Jeezy, old Boosie, that was real rap[|]In New York with 3 bangers[|]Did Jimmy Fallon with Meaghan Trainor[|]I guess the sets won't taint him[|]Guess the money can't change him[|]Decisions[|]Homie on probation[|]Took him up to Roc Nation[|]Let him meet Jay, told him be patient[|]Decisions, and lil homie really got it[|]Trying to tell him wait his turn[|]He ain't learn, lil homie caught a body[|]9 times 9 is 81[|]I'm an 80's baby born in '81[|]From a family full of hustlers, youngest son[|]They say get that money, show 'em how it's done[|]9 times 9 is 81[|]I'm an 80's baby born in '81[|]From a family full of hustlers, youngest son[|]They say get that money, show 'em how it's done[|]How it's done, got it, got it how it's done[|]You would make that shit look easy, how it's done[|]Gotti you make that shit look easy, how it's done[|]Gotti you make that shit look easy, how it's done[|]Biggest deal of my career[|]I feel the pressure, gotta follow up[|]Same time I can feel the feds[|]Gettin' closer, lockin' niggas up[|]Decisions[|]Closer partners, they in prison[|]Never want to be the biggest[|]I just want to be the realest[|]I pay 6 figures a year for a hitter[|]Knockers, see your goon, he my nigga[|]He got the city divided[|]Bring it together, I tried it[|]Fuck them lil niggas, I tried it[|]Fuck them lil niggas, I tried it[|]I am the king, your highness[|]You want a problem, well find it[|]I was too busy gettin' too many million[|]Like now the perfect timin'[|]Let them lil niggas in[|]They what they do to bitch[|]I don't be trippin' at all[|]Whatever come with it, I'm with it[|]Lil nigga, I swear I'm good for it all[|]9 times 9 is 81[|]I'm an 80's baby born in '81[|]From a family full of hustlers, youngest son[|]They say get that money, show 'em him how it done[|]9 times 9 is 81[|]I'm an 80's baby born in '81[|]From a family full of hustlers, youngest son[|]They say get that money, show 'em him how it done[|]How it's done, got it, got it how it's done[|]You would make that shit look easy, how it's done[|]Gotti you make that shit look easy, how it's done[|]Gotti you make that shit look easy, how it's done[|]1 million, 2 million, 3[|]CM9 strictly for the streets[|]I'm tryna get a twin piece[|]First class nigga, I'm a millionaire[|]First class nigga, I'm a millionaire[|]I'm tryna be the first trap billionaire[|]I'm tryna be the first trap billionaire
Blow Your Ass Off,They say it look good in the caskit. want it you can have it,[|]What the f*ck you got a gun,[|]For if you won't blast it,[|]Yo gotti nigga, mister, mister A.R 15 ...,[|]Mister, mister turn your good day into a bad dream,[|].represent this written .,[|]I'm a dope boy ., I'm a whole brick quoter .,[|]Mister 18 5, mister mix it with a soda, mister shoot that muthafuckin chopper through your rover .,[|]Im just layed back chilling, like im on purple,[|]F*ck around make a rap nigga commit murder,[|]On my watch and my chain, just know that they suicide,[|]You won't gon and try it, just know that they suicide.[|]'cause I'ma blow your ass off,[|]Blow your ass off,[|]Right there where you stand, Hop in the colors, And blast off[|]Ima let the humar speak, F*ck all that loud talk.,[|]... See how that help him walk[|]Chorus:[|]I'm blow your ass off, blow your ass off, I am,[|]Blow your ass off, I am, blow your ass off, I am,[|]'m blow your ass off, blow your ass off,[|]Blow his ass off, blow his ass off, his ass off,[|]Blow your ass off, blow your ass off,[|]Blow your ass off, blow your ass off,[|]Blow your ass off, blow your ass off,[|]Pussy nigger would.[|]These niggas think I'm slippin, what the f*ck wrong with'em,[|]How you straight .like a .poison like a .get 'em,[|]I'm on my ...,[|]I know these niggers are after me,[|]Why they keep attacking me, they can't make ...and knock me now,[|]Why I can't stop me now,[|]Why can't I. I'm gonna stop myself,[|]I'm gonna need yourself,[|]Do real funny murder ...,[|]I've been ...I don't really want to .,[|]You know I f*ck rocking .show to .,[|]I rather risk my life hanging in a truck,[|]Risk for another . still purple with the ...[|]Chorus:[|]I'm gonna blow your ass off, I am,[|]Blow his ass off, blow his ass off,[|]Blow his ass off, blow his ass off,[|]P*ssy nigger would.[|]I'm gonna blow your ass off, I am,[|]Blow his ass off, blow his ass off,[|]Blow his ass off, blow his ass off,[|]I'm a p*ssy nigger wood.[|]Black .in the club like you wanna ...nigga,[|]Your mama can get it... I do it nigger,[|]Inside you close your eyes for sugar nigga,[|]Open fashion straight do it, nigger,[|]...'cause it's too explicite,[|]I can't lie I ...watch the news with my crew just to mention.,[|]It'a hand ., b*tch boy ...,[|]It's so . as soon as I see the ., ...,[|]My nigger ... let me see ...,[|]I'm doing bad, but I'm doin' worse ...[|][Chorus:]
We Gonna Be Alright,Don't cry mama, he'll be back, we're gon' be alright...[|]Man, I miss my brother, I swear to god, I'm still mad at myself that I couldn't take the charge, I remember like yesterday, phone ringing up off the hook, pandemonium in the north, what happened to juk? shhhhhit, I don't know, guess the same old bullshit, Fed's said DP got caught with half a brick, that damn near stopped my heart, cause me and knowing my brother I'm thinking this shit hard, but luckilly it was soft and fortunately he was straight, we're findin' to take it to trial, but went on sign for eight, mama we're gon' be straight, li'l sister we're gon' be cool, I know that my brother strong, so I did what I had to do[|][Chorus:][|]Mama we're gon' be aiiiiight,[|]He gon' be okay,[|]Shit, I didn't know but I was walkin' on faith,[|]Li'l sister we're gon' be aiiight, he gon' be okay,[|]Got me a brick and started moving that weight[|]His sister taking it bad, mama trying to be strong, couple calendar years, I never shedded a tear, wrote him a couple letters to tell him I'm doin' better, told him I took his Chevy and put the shit back together, told him I'm gettin' money, I counted a hundred g's, told me to slow it down, play the shit low-key, told me to make it happen, focus more on rappin', cause fuckin' round in these streets that anything can happen, told me I had heart, plus he knew I was smart, the only thing that'd break his heart is if I fuck around and catch a charge, told me to watch my sister and never let mama suffer, and do what I had to do to overcome the struggles[|][Chorus x2][|]Finally made parol, they think he gon' change his life, I axed him what he gon' do, he said he's gon' walk light, it wasn't a year later, he smokin' behind tint, half an ounce of the reddy rock, mane they got his ass again, judge gave him a bond, now he out on the run with that fuck the world attitude, still totin' a gun, still havin' his fun, we clubbin' it on the weekend, had conversations bout going to turn himself in, wanted to raise his son, gon' get the shit behind him, plus he knew it's only so long before they find him, lawyer was talking good, say he gon' get three, when the prosecuter quit yellin' they gave my brother eleven, my mama damn near fainter, my brother didn't want to accept it, the hardest part for me, I couldn't do nothing to help it, rap shit paid off, now we all on tv, my brother say he good, he finally feel free[|][Chorus x2]
