Save It for Me,Lord we come to you asking you for the strength and the guidance to[|]be man enough to protect our children till the day that we die Amen[|]Devotion to that higher ground is day by day slowly fading it's like[|]we can't hear the sound so I gotta reiterate it he sending all over[|]the world now we need to start makin' changes the light is covered up[|]by the clouds and my life's constantly raining but when I think about[|]the things you've done for me and how you made me see,[|]truthfully I ain't gon' do you wrong no[|]don't let no one of us go because I know ([|]) nobody's gonna save me (save me) gonna save me(save me) from[|]the sins I've done (sins I've done) nobody's gonna save me (save me)[|]gonna save me (save me) cause it's all my fault (it's all my fault)[|]nobody's gonna save me (save me) gonna save me (save me) from the[|]belief I've lost nobody's gonna save me (save me) gonna save me[|](gonna save me) so I'm prayin' to you God (prayin' to you God) ([|]2) It's not safe to say it's over now we're here and I see[|]little bodies laying on the ground it coulda been your baby is[|]someone gonna help us out they need some food to eat but there'll be[|]brighter days when we'll be saved the Lord will send blessings but[|]when I think about the things you've done for me and how you made me[|]see, truthfully I ain't gon do you wrong[|]no don't let no one of us go because I know ([|]) nobody's gonna save me (gonna save me) gonna save me (gonna[|]save me) from the sins I've done (done) nobody's gonna save me[|](nobody's gonna save me) gonna save me (yeaaah) cause it's all my[|]fault (fault) nobody's gonna save me (save me) gonna save me (save[|]me) from the belief I've lost (oohooooohoooh) nobody's gonna save me[|](save me) gonna save me (save me) so I'm prayin to you God (prayin to[|]you God) [David Banner] Every step that we take from this day on lord[|]we both hope that it's one in your direction (save me) so take this[|]song (save me) as a token of our affection[|](oohooooohoooh) we both apologize, and love (save me)
For The Hood,Yeah[|]I'm Yo Gotti[|]Ha[|]This here for the hood[|]This here for the hood[|]All around the globe, every hood, nigga[|]This here for the hood[|]Now I do it for the hood[|]Now I do if for the hood[|]I'm like, all these shows and all of these hoes[|]All of this money and all of these clothes, for the hood[|]Now I do it for the hood[|]I do it for the hood, I do it for my town[|]I do it for the South, North Memphis to the Mound[|]I do it for the A, Westside Bankhead[|]East Atlanta, Zone 6, dope boys break bread[|]I do it for Alabama, them niggas in the 'Ham[|]I do it for Mobile, because they be going ham[|]I do it for the Lou', I do if for the Chi[|]Across the water in the north, Club Peno, eastside[|]And this is how I ride, my rims on glide[|]Six inch lips, twenty six inch tires[|]I do it for Detroit, because they be going hard[|]I do it for the 'Nap, 40 F and Boulevard[|]We get it in as soft, we turn it into hard[|]This how we kick it, in the kitchen with a Pyrex and a pot[|]One down to my vatos, because they be showing love[|]It's been seven years and counting, so I do it for my block[|]This here for the hood[|]Now I do it for the hood[|]Now I do if for the hood[|]I'm like, all these shows and all of these hoes[|]All of this money and all of these clothes, for the hood[|]Now I do it for the hood[|]No security how I roll, my niggas blowing dro[|]Hoped a lobby full of hoes, to every Gotti show[|]I do it for Miami, Dade County, Opa-Locka[|]I do it for the goons who be riding with them choppers[|]I do it for L.A. and all the niggas who be banging[|]I do it for VA, and all them niggas who be swinging[|]I do it for N.O., I do it for PA[|]I do it for the dro, I done it for the yay[|]A horse on my hood, so this is not a HEMI[|]Middle finger to the FEDS, if you want me come and get me[|]I do it for the Lonestar State, Houston Tex[|]I done it for my young niggas thugging in the 'Crest[|]This here for the hood[|]Now I do it for the hood[|]Now I do if for the hood[|]I'm like, all these shows and all of these hoes[|]All of this money and all of these clothes, for the hood[|]Now I do it for the hood[|]This here for the hood[|]Now I do it for the hood[|]It's Gucci![|]Yeah[|]Zone 6 my hood[|]With the nerve my turf, baby[|]Fall off with a bougie nigga, three, four, my young stupid niggas[|]Twelve six, two different pistols, Westside bitches fucking with us[|]Bankhead niggas smoking with us[|]Simpson Rd., they drinking with us[|]Eastside, Westside, Northside, Southside, off-side[|]They be linking with us[|]Fifty minutes balling out, but I didn't have a problem[|]Stupid watch and crazy, robbers have respect for robbers[|]You might get robbed on the spot, feet up in the parking lot[|]Hit the leave by two o' clock, no one's in my parking spot[|]ABG duct taping them, Outsiders act safe and then[|]Club packed, ain't no space in there[|]Fuck around, eat your face in there[|]ers got that gas in there[|]So what's inside your Swisher fool?[|]Don't touch, no harassing them[|]Because Zone 6 hold your pistol too[|]This here for the hood[|]Now I do it for the hood[|]Now I do if for the hood[|]I'm like, all these shows and all of these hoes[|]All of this money and all of these clothes, for the hood[|]Now I do it for the hood
Gangsta Of The Year,
Gangsta Party,
General,Woah, woah, woah[|]I'm a general, little nigga I'm a general[|]I can fuck a sack up cause the money plentiful[|]I'm a general, little nigga I'm a general[|]I can fuck a sack up cause the money plentiful[|]I'm a general, little nigga I'm a general[|]I'm a general, little nigga I'm a general[|]I'm a general, little nigga I'm a general[|]I'm a general, little nigga I'm a general[|]Takin' care of the hood, you a general[|]I be talkin' real shit in general[|]Got a lot of keys like the janitor[|]Cleanin' out them keys got me an Aventador[|]Playin' with the keys like a piano[|]Shout out to my thick bitch in Atlanta[|]She a boss bitch, yeah she a boss bitch[|]I be downing pounds like I'm on Crossfit[|]Medusa heads, they're Versace[|]I'm rich from sellin' dope so I cannot be illuminati[|]My nigga 18 and he just caught him a body[|]First I made his bond then I bought him a Maserati[|]Congrats[|]I'm a general, little nigga I'm a general[|]I can fuck a sack up cause the money plentiful[|]I'm a general, little nigga I'm a general[|]I can fuck a sack up cause the money plentiful[|]I'm a general, little nigga I'm a general[|]I'm a general, little nigga I'm a general[|]I'm a general, little nigga I'm a general[|]I'm a general, little nigga I'm a general[|]Tat my name cross her hand and salute me[|]Got them mollys and them xans, that's a two piece[|]I got my main bitch ridin' like a Goonie[|]I got that duffle bag on me and it's Louie[|]I'm bout to do the whole dash out here grindin', grindin'[|]I got three mil all in jewelry, go ask Avianne[|]Ain't no brag in bossin', I caught the wave on 'em[|]You don't want no problems, we gon' lay on you[|]Step in the kitchen, it's woo[|]Strap with that carbon, it's woo[|]Sippin' that lean like Goose, I'm full of them drugs[|]I get dirty-dirty money, it's covered in blood[|]If you can't fuck no pop star you a scrub[|]Freebandz[|]I'm a general, little nigga I'm a general[|]I'm a general, little nigga I'm a general[|]I'm a general, little nigga I'm a general[|]I'm a general, little nigga I'm a general[|]Salute me or you shoot me when you see me cuz[|]Purple Heart for all your soldiers, they know what it was[|]They know what it is, yeah they know what it is[|]They know chop-chop-chop-chop, they know this shit real[|]Takin' care of your kids - you a general[|]Fuck nigga, I don't do subliminals[|]Fuck nigga, I don't do no interviews[|]Bout no beef, bout no issues[|]Catch you slippin', get up witcha[|]I'm a general, yeah I'm a general[|]Stars and stripes, you know how it go[|]You can't get no bricks from me 'less you want 10 or more[|]I'm a general, little nigga I'm a general[|]I can fuck a sack up cause the money plentiful[|]I'm a general, little nigga I'm a general[|]I can fuck a sack up cause the money plentiful[|]I'm a general, little nigga I'm a general[|]I'm a general, little nigga I'm a general[|]I'm a general, little nigga I'm a general[|]I'm a general, little nigga I'm a general
Get Down,
Ghetto America,Dear Ghetto America,[|]A letter from the hood I'm from,[|]From every nigga in the trap, every nigga in the slums,[|]Dear Ghetto America,[|]Someone tell the president,[|]My hood like Afghanistan, bombs deal and we pay the rent.[|]Dear Ghetto America,[|]Tell Iraq I got that oil, got that purple, got that yellow Nigga what you're paying for?[|]Dear Ghetto America,[|]Invested in my private stock Cocaine Music Group, CMG, all white blocks,[|]Dear Ghetto America,[|]Work but I don't punch no clock[|]Work but I don't punch no clock[|]Work but I don't punch no clock[|]Dear Ghetto America,[|]You want me to drop dead, But instead me & Gotti came thru in that drop head,[|]Dear Ghetto America,[|]Want me downtown doin' time but instead yay, I'm went to inny and did mine,[|]Dear Ghetto America,[|]Lock me up for residue, won't give jobs to felons well that's every nigga in my crew.[|]Dear Ghetto America, Land of the thugs (Dogs), Land of the thugs (Dogs), Land of the drugs.[|]Dear Ghetto America, In God we Trust and Powder,[|]Knockin' down to tall thick bitches twin towers,[|]Dear Ghetto America, Dear Ghetto America. (Yo Gotti: I pledge allegiance, nigga)[|]Dear Ghetto America, (Yo Gotti: right hand to God) Dear Ghetto America.[|](Yo Gotti: Other hand on the strap ya feel me)[|]I pledge allegiance to the block that turned my life around,[|]Streets been hard as shit for politics, ya it's going down.[|]Today I pay my taxes so I'm feeling like I took a loss,[|]Government want half on that ass yeah, break 'em off.[|]Dear Ghetto America, trying to make the Forbes' list, Label me to democrat, wanna be republican.[|]I feel like Obama so much pressure on a nigga now, You accidentally shot your home boy, so you're a killer now, Fuck nigga be killing me, two shots to my enemy, Always be your damn self, never be a wanna-be.[|]Coming through traffic back to back like a monarchy, But errthang white Instead of black in the more ways, Feelin' presidential in the Phantom bitch, I'm JFK, Ronald Reagan campaign, shipping in a-lot- of-Yay, I'm Mr. Bill Clinton getting head in the oval room, Dear Ghetto America, Yo Gotti for office soon.[|]Dear Ghetto America, Land of the thugs (Dogs), Land of the thugs (Dogs) Land of the drugs,[|]Dear Ghetto America, In God we Trust and Powder,[|]Knockin' down to tall thick bitches Twin Towers, Dear Ghetto America, Dear Ghetto America, Dear Ghetto America.
Go Girl,Go girl, a go girl[|]Top notch store[|]She go go live[|]She go go silly yo[|]I tell her bring it back[|]She go go get it[|]She a go girl, a go girl[|]All night putting on a show girl[|]She go go live[|]She go go silly yo[|]I tell her bring it back[|]She go go get it[|]I got this girl thats so addictive[|]She call and say she miss me[|]I tell her I'ma visit next time I'm in her city[|]I turn ya World to Gotti world, shawty bring ya ticket[|]Jimmy Choo and Red Bottoms, shawty we can kick it[|]I take her on trips, her boyfriend be trippin'[|]Takes off on the menu, tryna hear it[|]Tattoos and piercings, Gucci shoes[|]Kiss just as fresh as she be, she serious[|]All I do is ball and all she f-ck is winners[|]To take her to the mall she don't wanna go to dinner[|]She a go girl and I'm tryna get wit her[|]Have her looking right I had to follow her on Twitter[|]She a go girl...[|]Go girl, a go girl[|]Top notch store[|]She go go live[|]She go go silly yo[|]I tell her bring it back[|]She go go get it[|]She a go girl, a go girl[|]All night putting on a show girl[|]She go go live[|]She go go silly yo[|]I tell her bring it back[|]She go go get it[|]Go go, keep on going[|]I'll be somewhere throwing money, blowing on that potent[|]Money in my bank account, pockets hella swollen[|]And a model girlfriend so for them cameras we be posing[|]We just go go, anywhere we wanna[|]Got a weed connect from Tennessee to California[|]Twenty grand in Paris, blowing on that Mary[|]Yo' bitch on my Johnson cause I'm ballin' like I'm Larry[|]And I play my part. I'm out here with the bosses[|]And she know this from the start, get 30K to show[|]That mean we both be going hard[|]Don't smoke it, roll the weed up[|]If she broke she'll get her g's up[|]If she slow she up to speed cause she a[|]Go girl, a go girl[|]Top notch store[|]She go go live[|]She go go silly yo[|]I tell her bring it back[|]She go go get it[|]She a go girl, a go girl[|]All night putting on a show girl[|]She go go live[|]She go go silly yo[|]I tell her bring it back[|]She go go get it[|]Okay now woah there, keep going throwin that big booty thong[|]She wear her heart on her sleeve[|]Now she just Comme des Garcon'ing[|]I wake up and show you what this Cockle doodle do in the morning[|]I swear that pussy so good good, I wish I could clone it[|]Okay, go girl, go girl[|]My new bitch, ya old girl[|]She buss it open for me like a show girl[|]Call me king than tell me that its your world[|]Her body Jamaica but the vagina is Asian[|]I swear thats hour glass shaped and that just remind me time wasting[|]Okay, fuck around I might taste it[|]And if I throw it back at her than she probably gon chase it[|]Cause she a go girl...[|]Go girl, a go girl[|]Top notch store[|]She go go live[|]She go go silly yo[|]I tell her bring it back[|]She go go get it[|]She a go girl, a go girl[|]All night putting on a show girl[|]She go go live[|]She go go silly yo[|]I tell her bring it back[|]She go go get it
Go Gotti Go,[Hook][|]It all started out at a I&E; fest[|]When Grip told Gotti to bump his best[|]He said 'Go Go Gotti, Go Go Go Gotti[|]Go Go Gotti, Go Go Go Gotti'[|]Go Gotti go[|]That's all I know[|]It started out[|]In a small project, where i was turning it out[|]Credit for Grip[|]He never tripped, he kept it real[|]Had the bankroll and the knowledge, and I had the skill[|]I was twelve years old, Grip was fourteen[|]Grip was gettin' work, I was servin' fiends[|]I been a wigsplitter, slash money-go-getter[|]Ever since I was a itty-bitty lil nigga[|]Thank I was the wisest youngster out there hustlin'[|]Twelve year old kid on the block cuffin'[|]Packs in my ass and rocks under my tongue[|]Gotti ain't doing drugs cause Gotti ain't gettin' sprung[|]Rappin' came eazy[|]It was a gift, that I got from Jeezy[|]I told you once, and you didn't believe me[|]Now with the help of Grip, it cost to see me[|]I'm a thug and drugs is what I live by[|]So if I speak it I mean it, cause I don't liz-ie[|]When I turned fifteen, I had ten G's[|]Me and Grip colaborated and bought a key[|]And for a hobby, you know I was rappin'[|]But never thought that this CD shit would happen[|]I dropped my first album, they went crazy[|]And at random I was fuckin' these nigga's ladies[|]Don't play no games, and please don't criticize me[|]Who had a hundred G's, my age, beside me?[|]I went to school with platinum chains, and platinum grills[|]A sports car, a big truck on twenty wheels[|]You won't believe the shit, that I done been through[|]The cats I roll wit, and who I'm kin to, I'm kin to[|]Hook until end
Gold Medal,It's award season again[|]I mean we gon' keep winning and taking all these trophies home[|]I don't see no real contenders[|]Nigga I should win a trophy[|]Platinum wrist with the cola[|]I should get a gold medal[|]Can't nobody cook it better[|]I show you how to whip the yola[|]I show you how to whip the yola[|]I show you how to whip the yola[|]I show you how to whip the yola[|]I show you how to get some extras[|]Nigga I can bless you[|]Two bricks and a half, I got the kitchen under pressure[|]Take it out the water, rough white that's the texture[|]This shit just like a drive-thru, when you pull up may I help you?[|]Eyes on the camera, guns on the counter[|]Guerrillas with them choppas and they all got them bananas[|]Ran out of rubber bands then fucked up all the counters[|]Fucking count it half a hand, give me the pack and I'm a down him[|]It jumping out the gym, call it trap-oline yayo[|]How you a dope boy when you never seen yayo?[|]Ever since I was a kid boy I use to dream yayo[|]It's me and Snootie Wild and they call us team yayo[|]On the stove with the egg beater, whipping Jason Jeter[|]I can show you how to mix the yellow water make it ether[|]Longway Lulu got your [?] bricks we break em down to deuces[|]Cinnamon buns on the hand guns empty goin' [?][|]Send the pack to Memphis and we workin' out the bitches[|][?] and red, crash mans [?] got it in the trenches[|]Workin' my wrist whippin' up my credentials[|][?] it be white like the dentures[|]Pocket monster cruisn' in the [?][|]Blood on blood, this side get fucked[|]The money count, I just keep countin'[|][?] and Yo Gotti gon' count it[|]200 bands and we dab in Cavalli[|]Mother fucker tell them send a deposit[|]So don't show we pull up in Bentley's and Masi's[|][?] we be tippin' the pilot[|]G5 with a beat in the pocket
Gotti This, Gotti That,
Hard to Believe,Hook: It's hard to believe (It's hard to believe)[|]I made it through the years (I made it through the years)[|]I guess that I'm blessed (I guess that I'm blessed)[|]Cause I didn't get popped (or I didn't get killed)[|](Yo Gotti)[|]It's hard to except[|]The cards I was dealt[|]The life that I chose[|]?[|]A life full of crime[|]A bag full of dimes[|]A hood full of jealous ass niggas wanting mine[|]But now I lay me down to sleep[|]I pray the lord my soul to keep[|]And if I die before i wake,[|]I pray the Lord my soul to take[|]I seen it, all this ana fall, never thought I'd make it out[|]Broad-daylight, I seen my homeboy get takin' out[|]They shot at me[|]They got at me[|]Never could they get at me[|]I gotta thank the Lord from shielding me from all my enemies[|]Ran mo' blocks than fugitives[|]Sold mo' dope than Cubians[|]Kept my mind on dollar signs and never was abusing them[|]I think I got the feeling jone[|]I'm seeing millions jone[|]Come into my residence[|]But that's irrelevant[|]2000 was on jone[|]2000 is gone jone[|]2000 and 1 is here, I'm still droppin' songs jone[|](Hook)[|](Denaro)[|]Don't shit exist in this galaxy, that's like Denaro[|]Ain't facin' shit, but tragedy from out of my baro[|]Witnessed too much shit at a age like mine[|]Beef off in the streets got me on stages wit nines[|]My nig Gotti get the mic, and yo I'm watchin' the crowd[|]I see a nigga start to reachin' and let that heater go pow[|]Took too many losses, felt sad feelings out here[|]My nig lost his mom and dad, I lost my lil' one this year[|]We be exposed to a lot of shit our eyes shouldn't see[|]But I'm composed of a lot of shit y'all niggas couldn't be[|]Cause I'm a real nigga, meaning I'm limited dog[|]Fake shit done played out like SEGA Genesis dog[|]They used to call me Ghost, cause I had a nigga that spook[|]Just a young nigga, strapped up and ready to shoot[|]I played it smart this year[|]Life was hard this year[|]I kept my lawyer fully paid and beat my charge this year, nigga[|](Hook)[|](V-Dog)[|]It's hard to believe I made it nigga, but I made it nigga, yeah I'm here[|]You thought that I wouldn't make it nigga, but tell me who you hear[|]It wouldn't my time to go, so I ain't gone nowhere[|]I'm still bumpin, keepin' you jumpin, while I'm smokin' my square[|]I be V slash D uh O G nigga, I'm just like a nigga, holdin' my pants when I[|]pose nigga[|]Still fuckin' hoes nigga[|]Doing my shows nigga[|]And listening to you niggas say this bitch is cold nigga[|]I'm out of control nigga[|]I can't be stopped bitch[|]I made it through the years with out gettin popped or killed[|]I said I'm out of control nigga, I can't be stopped bitch[|]I made it through the years with out gettin' popped or killed[|](Hook)
Harder,[feat. Rick Ross][|][Verse 1:][|]Ok the beat go hard but I go harder[|]I can die a drug dealer but I'm smarter[|]Pair of forgiato rims I could of brought a charger[|]But dem bitches make the lambo look a little more harder[|]King of my city north memphis we're like holla[|]Blood gang crips too we gon eat regardless[|]See me on the news yeah I beat em charges[|]All they do is runnin gunnin and a dodgin[|]Blood shed my niggas in the fed my nigga Gucci die[|]I can't let nuthin slide[|]Ridgecrest where I resign Ridgecrest what I provide[|]Young nigga with them choppas 'cause I know they gonna ride[|]Fuck if I die today I went to church I pay my tax[|]I leave my son a couple million dollars so I did alright[|]Hard ain't no nigga in this streets that built like me sold bricks like me[|]Mexico took trips like me[|]Texaco ain't nothin but gas if I was u nigga down my past[|]I break bread so no fuck me nigga I'm a real nigga and I was built to last[|][Hook:][|]Hard hard I'm hard hard hard I'm hard[|]Hard hard I'm hard[|]In the kitchen I whip it harder[|]Top drop ridin harder[|]Hard hard I'm hard hard hard I'm hard[|]In the kitchen I Whip it harder[|]Real nigga I live harder[|]Hard hard I'm hard[|][Verse 2:][|]The streets go hard but I go harder[|]I know what didn't meant mo money mo fuckin problems[|]I know young money like I'm dwayne carter[|]Remember my life a real nigga if I die tomorrow[|]I'm harder met a bitch in the mazda[|]Put the bitch in the range rover[|]Cause she suck dick till tomorrow[|]Head 4 24 hours 24 brick or powder[|]24s on my platnmium neek 50k on the chandelier[|]Nozzle like a castle bitch white like alaska[|]Got instrumentals sold all white on my mercedes shit nasa[|]Pulled off in that 'rari took off like I'm nasa[|]Nigga playin dem games with me she'll fuck you if you answer[|]She smarter better get she harder better yet you pussy[|]Then why them bitches charge ya[|][Hook][|][Verse 3: Rick Ross][|]Strip moneys strip moneys got on my wall[|]I'm going so hard I know I got more than dough[|]Got the beamer the bentley triple-black mercedes-benz[|]Got me 5 mill in cash time to get it again[|]From reebok to surrock came a long way from the blocks[|]Baby girl I don't wed cause shit I've driven it rocks[|]Licking shots that you pussies my stock fresh shot through the roof[|]As I shoot for the stars I'm shootin buying a coup[|]I know I won't live forever but stocking up like I will[|]I know you niggas ain't real but I fuck you like u is[|]48 laws 36 hoes 57 nets all black tip-toein[|]26 inch rims chrome mac 11 doing right so hard but I pray I get to heaven[|][Hook]
I Don't Like (freestyle),A fuck nigger, that's the shit I don't like[|]Phantom drop here, I want it all white.[|]I'm an astronaut, I'm taking off the night.[|]And if I fuck your bitch I'm in a long pipe.[|]My bitch, she got a bitch, so my bitch tight.[|]My niggers got two choppers, they come with a knife.[|]Gun fight, on sight, police says niggers, call it blue light.[|]Mutal me in out, bitch, I feel great,[|]They think I'm MMG, 'cause I sell mate.[|]They mean I got my money by my damn cell,[|]Fuck a lebel, imma sell my damn self.[|]Hey niggers, fake bitches, that's the shit I don't like[|]Fake jewelry, fake clothes, that's the shit that ain't right.[|]Design 'em, they sway, nigger, grab 'em, disobey, nigger,[|]That's the shit I don't like, so bitch, you ain't even got to ask a nigger.[|]I'm lonely, don't fade it, I'm blessed, bitch, I made it.[|]Pop a bottle, congrats, hoe, play with me, I'll strike, hoe,[|]Front door, they ballet, champagne and rose,[|]King up, sneaked up, the marley got the whole going crazy.[|]A fat nigger, that's the shit I don't like,[|]A snitched nigger, that's the shit I don't like,[|]A bitch nigger, that's the shit I don't like,[|]Sneach design, that's the shit I don't like,[|]Don't like, don't like,[|]A snitched nigger, that's the shit I don't like,[|]Don't like, don't like,[|]A bitch nigger, that's the shit I don't like.
I Feel Like,Boosie Badazz (Boosie Badazz)[|]I am[|]Aye we the richest, realest niggas in this shit[|]That's what the world say[|]I feel like the realest nigga in the world[|]I feel like tonight I want to fuck your girl[|]I feel like the richest, realest nigga in it (I am)[|]Free my dogs I swear to God it been a minute[|]Yo, it's Boosie and Gotti[|]Niggas know we go retarded for money we fuck up the check[|]Chain after chain, and cars whip after whip[|]We kill goon after goon and by text after text[|]Got a lot of money, got a lot of hoes[|]Got a lot of problems, Got a lot of issues[|]Seen a lot of dope[|]I was in the hood, when you was in the hood[|]You was in the hood, when I was in the hood, with the same bros[|]Get money with killas, my shooters got rollies, we killing in style[|]Boy my house like a mall and my closet is [?] and my shoes racks an aisle[|]And my bitch probably look like Chanel[|]Ten thousand square feet, my house big as hell[|]I was so sick of running from the twelve[|]They fucking up kitchens and running through scales[|]Million dollars out of bando, trap wizards like a Gandalf[|]Street nigga in a Lambo, I got big choppa like I'm mandalf[|]Fuck the plug, yea I ran off[|]Fuck your bitch, yea that's a hand off[|]Real nigga, this a stand off[|]Free Meek nigga[|]I'm the realest nigga in it, just ask bout me[|]Worldwide call me badazz[|]Girl fine with a fat ass[|]If I love ya I give you my last[|]Real nigga[|]A lot of niggas hating cause the plate got bigger[|]World is mine, hating non nigga[|]You know what I done been through[|]Free BG free Free MU[|]There can't be no sequel too[|]Boozie and this gangsta music[|]At home I got a gangsta bitch, all we watch is gangster movies[|]Shit I feel like I'm the richest in the world[|]Cause I come from where you gone if you got a couple of birds[|]Foreign cars up in my four garages, real nigga[|]Still sending niggas money orders, real nigga[|]Lost a couple of hittaz[|]Roll one for em, smoke one for em[|]And I got they daughters and they sons, that's why
I Got Them,
