Look In Da Mirror Remix,Six in the mornin' I'ma call Wale[|]Tell J. Cole to meet us down in the A[|]And bring Wiz Khalifa 'cause the green look pure[|]We some real niggas, we just lookin' in the mirror[|]I'm on fire, whole hood blazin'[|]Hustle game incredible, ice game amazin'[|]Look in the mirror, look in the mirror[|]Look in the mirror, look in the mirror[|]Look like a chandelier, look in the mirror[|]Ice super clear, you lookin' in the mirror[|]Who you heard see, when you look in the mirror[|]If you a real nigga you lookin' in the mirror[|]D.C. all up in this bitch, 'bout time I got my respect[|]And now these hoes are on my line like Sally Mae on college deck[|]Gotti here I'm in this shit, hey J. Cole come here this shit[|]I bet you hear that white music but I don't mean top 40 hits[|]Talk to the mirror and I don't need a cure[|]And when I'm done with this muthafucker[|]It'll need a urn shoppin' I'll be in Paris[|]You plottin', don't even worry[|]You walk in my closet your favorite style is some beaten birds[|]You out where? We don't ever see ya[|]My niggas out here they spot me like Chippy D.[|]And I'm probably smokin' reefer till I got that emphysema[|]How else can I emphasise I'll only let the mirror see ya[|]It go microphone check, one, two, yola[|]Two chains, two guns, he bipolar[|]Two baby mama's, three kids, two Rovers[|]That's too many problems, too late to think over[|]The cars off the showroom, clothes off the mannequin[|]Hoes off the centerfold, I be going ham at ten[|]One bitch from Howard, another bitch from Grambling[|]College girl goin' wild and Gotti be the camera man[|]Bird talk feather man, Louis jacket, leatherman[|]Fresh to death that bullshit irrelevant[|]Man in the mirror if I can't get my shot again[|]My bitch like a Coke bottle, yo' bitch like a Pepsi can[|]I'm on fire, whole hood blazin'[|]Hustle game incredible, ice game amazin'[|]Look in the mirror, look in the mirror[|]Look in the mirror, look in the mirror[|]Look like a chandelier, look in the mirror[|]Ice super clear, you lookin' in the mirror[|]Who you heard see, when you look in the mirror?[|]If you a real nigga you lookin' in the mirror[|]Mirror, mirror on the wall, bitch I was born to ball[|]While y'all took the summer off, my money did a somersault[|]Backflips, cartwheels, Carolina Tar Heel[|]Ain't no nigga touchin' my style it got a forcefield[|]Magneto, blew up like a torpedo[|]The view from my condo be makin' hoes say neato[|]Game strong like the arm on Marino[|]I stack Cheetos and Doritos like casinos[|]Fresh to death like I'm buried in a tuxedo[|]At times I look in the mirror to boost my fuckin' ego[|]I say it's yo' world, Cole World to be exact[|]With a flow that's so thorough[|]No sir, you can't reenact, nigga[|]Hundred fifty on my chain, ballin' but it's not a game[|]High that's why they call us planes[|]All the bitches know my name[|]I take 'em home fuck her, get high and never call again[|]And my niggas all the same, now that's what you call a game[|]Hundred thousand dollars and that's on champagne[|]Bitches choose and they excuses my new car's to blame[|]Wanna dump her nigga, fuck a nigga, with a lot of fame[|]Don't want nothing from a nigga he all kinds of lame[|]Try doin' what I'm doin' but it's out of range[|]Niggas takin' shots, don't know how to aim[|]Don't know 'bout you but I see a real nigga[|]When I'm lookin' in the mirror with some diamonds in my ear[|]Motherfucker[|]I'm on fire, whole hood blazin'[|]Hustle game incredible, ice game amazin'[|]Look in the mirror, look in the mirror[|]Look in the mirror, look in the mirror[|]Look like a chandelier, look in the mirror[|]Ice super clear, you lookin' in the mirror[|]Who you heard see, when you look in the mirror?[|]If you a real nigga you lookin' in the mirror
Luv Deez Hoes,I love deez hoes[|]I love deez hoes[|]Oh, I love deez hoes[|]Oh, I love deez hoes[|]I love deez hoes[|]Oh, I love deez hoes[|]I said I love these hoes[|]I love these hoes[|]Oh, I love deez hoes[|]When that ass is fat and the head on point[|]I love deez hoes[|]When the bitch wake up go to work make dough[|]I love deez hoes[|]When the bitch hit the club bring a friend home with her[|]I love deez hoes, I love deez hoes[|]She fell in love with a gangsta, she a gangsta hoe[|]Oh, I love deez hoes[|]Love deez hoes[|]I love deez hoes[|]Oh, I love deez hoes[|]Love deez hoes[|]I love deez hoes[|]Okay, my bitch is a winner[|]Met the bitch in December[|]Real name was Keisha[|]Nickname was Criminal[|]Got a red bitch named July[|]Head fine, fireworks[|]Pussy special, head amazing[|]Looking for her, high alert[|]I'm a street nigga, one hunnid[|]And I love all of my bitches[|]I'mma get money, go hard[|]And ball all out with my bitches[|]I love thick hoes, light hoes[|]Black bitches, white hoes[|]Mixed bitches, ratchet hoes[|]Bougie bitches can't fuck with those[|]I like true freaks, chi hoes[|]I get money but don't buy hoes[|]That ass fat, gap wide[|]She can't stand straight she look pigeon toed[|]I fucked Tonya sister, Meeka cousin[|]Her best friend and her roommate[|]With y'all BFF y'all can tag team[|]And we call that shit a double date[|]When that ass is fat and the head on point[|]I love deez hoes[|]When the bitch wake up go to work make dough[|]I love deez hoes[|]When the bitch hit the club bring a friend home with her[|]I love deez hoes, I love deez hoes[|]She fell in love with a gangsta, she a gangsta hoe[|]Oh, I love deez hoes[|]Love deez hoes[|]I love deez hoes[|]Oh, I love deez hoes[|]Love deez hoes[|]I love deez hoes[|]I love bad bitches is the problem[|]She gon' suck my dick until tomorrow[|]Spondivits eating calamari[|]I pay all the bills baby momma ain't worried[|]I'll fuck you bitch in a movie[|]Hardcore all on her booty[|]Rolex all on the old wrist[|]Her skirt going up on a Tuesday[|]Bitch just started in a chevy[|]Tryna do it big till I'm wealthy[|]Got a bookbag full of money[|]In the dealership take a selfie[|]All I used to whip was a Mazda[|]I used to have to pray for a thousand[|]Just bought a four floor house[|]Just to use the bitch for a closet[|]Love all them hoes then I move on[|]See my old neighborhood when the news on[|]Leave the club and head straight to the fucking crib[|]Till I fuck her on the futon[|]Oh, I love deez hoes[|]Love deez hoes[|]I love deez hoes[|]Oh, I love deez hoes[|]Love deez hoes[|]I love deez hoes[|]I fell in love, first sight[|]Virgin pussy, super tight[|]She kinda insecure so she hold me tight[|]Attitude and one I kinda like[|]She be talking shit, like to fight[|]Last nigga ain't treat her right[|]So the last nigga ain't in her life[|]She listen to me so I give advice[|]I said, "you look good, that don't make you bad"[|]What's your greatest goal?[|]Who you fucked in the past?[|]What your future is?[|]What your plans are?[|]And most important now what you stand for?[|]A real nigga what you need to be planning for[|]Get money what you need a man for?[|]These lame ass niggas understand bruh[|]That ain't yo bitch if you paying her[|]A real nigga what you need to be planning for[|]Get money what you need a man for?[|]These lame ass niggas understand bruh[|]That ain't yo bitch if you paying her[|]Oh, I love deez hoes[|]Love deez hoes[|]I love deez hoes[|]Oh, I love deez hoes[|]Love deez hoes[|]I love deez hoes
Move,
MrTell It,
Never Changed,Never changed, I never changed[|]I never changed, I never[|]Sun and the rain, nigga I never changed[|]We talkin' change, chains, or change nigga what's up[|]I never changed[|]I know about all three[|]With the money and the fame, through the sun and the rain[|]Nigga I never changed[|]They tell me that it's all a game[|]Camera in my face, young nigga it's still the same[|]I never changed, I never, I never changed[|]I never changed, I never changed, I never changed[|]I seen OGs turned to haters[|]Lost respect I had for 'em off of paper[|]If money change niggas, why I still 100?[|]I ain't runnin' from no problem, if you want it run it[|]Dr. Dre beats, street shits in my headphones[|]Nigga if you a rat you dead wrong[|]And your momma should be ashamed of the ground you walk on[|]The phone tap, watch the devices you talk on[|]Ride foreign, think about the times I walked home[|]We talkin' change on change[|]Cause I been gettin' money, I got this shit out the game[|]Six figure nigga sit in, bricks for the fit in[|]Money under the soul of the joints, crackin' my jizz-eans[|]Born hustle, genetic, yea shit in my gizz-enes[|]With these eyes here, you can only imagine what I've seen[|]Baby momma turned enemy, home boy befriending me[|]Own cousin upped that strap on me full of that Hennessy, damn[|]I still wake up with them cold sweats[|]Real street nigga, did more and spoke less[|]Oh yea, pull up, haters looking so stressed[|]I get money, don't boast and don't flex[|]Been there and done that, streets I come from that[|]Been gone for a minute nigga, don't call it a comeback[|]A lot of niggas doubted me, hated and had it out for me[|]Grandpa would be proud of me, pray to God for my balcony[|]Fuck all the competitors you characters ain't scarin' us[|]I see you plottin' homeboy but I'm way ahead of ya[|]I got my cheddar up, haters don't know how to take it[|]Well I don't know how to fake it, sick like fuckin' doctor patients[|]Used to clock out the vacant, stash the Glock by the basement[|]Still get them pounds in, I need to watch what I be sayin'[|]Cause niggas snitchin', pointin' fingers it was them[|]Officer the only pounds I move are in the gym[|]You feel me?
Off da Pole,
Off Da Top (3am),It's 3am West Coast time nigga[|]We at Fat Burger[|]Hood nigga rich shit gourmet burgers[|]Know what I'm talkin' 'bout?[|]She pussy poppin, pocket watchin', they call her a thot[|]Bad credit, cash it out, fresh up off the lot[|]No back and forth, yippin', yappin', niggas gettin' shot[|]10 million, 20 acres, that's the new spot[|]Flooded out my crib and told my dealer you the illest[|]Renegotiate my contract, told my label I ain'tt feel it[|]Fell out with my partner, he mixed friendship with our business[|]Broke up with my bitch 'cause she was too much in her feelings[|]I may fuck her friend, fuck it, I may fuck her friend[|]Between me and you, I always wanted to fuck her friend[|]If I kill a hater, Lord you gotta forgive my sins[|]That's one fuck nigga you ain't gotta worry about again[|]I'm forever thuggin', I ain't never changed[|]In plain colors but forever bangin'[|]Blowin' money but I'm maintainin'[|]Blowin' money but I'm maintainin'[|]I got a gamblin' problem but money can't really solve it[|]Tryna help all the real niggas, hate to see a nigga starvin'[|]Hate to see nigga robbin' they own people, shit, that's loyal[|]Bitch tryna give me the pussy for a Birkin bag, I can't afford you[|]I grew listenin' to 2pac and that Biggie, Jay-Z and that Nas[|]No gimmick rappers, these niggas had bars[|]Back when record labels turnin' real niggas into stars[|]Sendin' niggas to Mars, nowadays the game done got hard[|]You get shot that make you hot[|]But where I'm from that make you start[|]Before I be a pussy, I'd rather rapper had the balls[|]I throw me some guns, get myself a charge[|]Never see me do that, I came too far to look back[|]I did too much to get help, 20 mil in one year[|]100 grand in one night, 50k on one flight[|]I've been trappin' my whole life[|]Ain't no secret, I be thuggin', ain't no secret, I be hustlin'[|]Pickin' loyalty over money, money orders to my homies[|]Groupie bitches be all on me, leave your phones at the door[|]You won't put me on no blog, once I fuck, you gotta go[|]3am ain't nothin' open but IHOP[|]And a bitch legs, and my trap spot[|]I said 3am, I'm trappin' at the IHOP[|]And I'm connected to the plug like a hotspot[|]I'm a grower, we don't do droughts[|]Birds in the sky, we call them iClouds[|]You know the birds fly down south[|]I took your bitch to eat at Mr. Chow's[|]I met the plug at Benihanahs[|]On hibachi grills, eatin' rice and talkin' numbers[|]I don't do no middle men and I don't trust no runners[|]I'ma pay on time and I won't never take you under[|]I'm an OG dope boy[|]I ain't nothin' like these youngins[|]I don't take the dope I'm sellin'[|]I won't ever do no tellin'[|]Overnight my pack yeah, we call that FedEx[|]I ship in the 18 wheeler and I ain't talkin' UPS
On Da Grind,(Talking: Yo Gotti)[|]I'm a North Memphis Survivor... Survivor[|]I'm a North Memphis Survivor... I'm a young nigga, money and power[|]I'm a North Memphis Survivor... Survivor[|]I'm a North memphis Survivor... I'm a young nigga, money and power[|](Yo Gotti)[|]I was a young nigga thugging now, moms bugging now[|]Getting the Third Degree, for bringin drugs in the house[|]Getting my ass in, but my mama had to spoil it[|]Ran across my work, flushed my shit down the toilet[|]Fucked me up bad, but I tried to ignore it[|]Couldn't though, why? cuz I owed the nigga for it[|]125 grams eight one yo-la, 50 doller power tell blue motorola[|]Broke up my tube and my scale, I got no luck[|]Hold up, mama even threw away the soda[|]I remember this shit like it was yesterday[|]Falling in the house late, seent the look on mama's face[|]I knew something was wrong, by the smile and the smirk[|]You know the look you get when your mama really hurt[|]She shook her head, I dropped mine, ya'll already know[|]Boy you selling dope, get your shit you got to go[|](Chorus repeat- X2)[|]I'm on the motherfucking grind[|]You think this easy, you out your motherfucking mind[|]You could see the shit I'm doing, if you was blind[|]Straight up, I'm just trying to get mine[|](Yo Gotti)[|]What am I to do now, where am I to go?[|]And how the fuck I'm gonna pay this nigga for his do?[|]Been looking for me, got a nigga kind of scared[|]And all the other niggaz looking up side my head[|]They said he came through, layin low with his beeper[|]Two, Three cars Two, Three Desert Eagles[|]Got me a fresh quarter ounce and a beeper[|]Fuck it, I'm a grind till my bank get steeper[|]72 hours had 28 elither[|]Know what I'm talking about that uncut ether[|]Junkies lookin whoin, goose neckin and browsing[|]Word got around, I sold up the Public Housing[|](Chorus)[|](Yo Gotti)[|]One week later had 4 and a split[|]Called up the nigga, told him told him come get his shit[|]I'm a real nigga, I just ran into some problems[|]All the time you think a nigga tried to slick rob ya[|]Thinking about my mama and them, I'm ready to go home[|]I'm fifteen years old, out here on my own[|]Mama let me back in, mama real strict[|]After school, straight home, no phone, no shit[|]Now doom in my room, I assume I was broke and it's true[|]So what the fuck a nigga gone do[|]Called grip, I heard he just got back off a trip with that shit[|]Man fuck it, I'm getting back with my click[|](Chorus repeat-X2)
One Day U Comin' Home,
One on One,Make sure you put the autotune on[|]Yeah, yeah[|]Murda on the beat so it's not nice[|]If I could talk to god like a real nigga one on one, I'd tell him[|]Need my homeboys back, and a couple niggas that's jailin'[|]Couple niggas convicted felons[|]I like the church but I don't trust the reverend[|]Soul been absent in my presence[|]And am I wrong if I bring my weapon?[|]Yeah, I said my prayers, I got my blessings[|]I'm still stressing so I'm finessing[|]Ain't holding back, these my confessions[|]If I could talk to god like a real nigga one on one, I'd ask him[|]I see my career goin' to the next level but my mind goin' backwards[|]I can't shake the street shit, still on the beef shit[|]Every time I try to do the right thing niggas think I'm on some sweet shit[|]Then I had to get them choppers out again[|]I tried to retire Lord[|]Forgive me for my sins, once and once again[|]Somebody got to die, Lord[|]I'm like why Lord?[|]They think I'm blood, they think I'm vice Lord[|]I'm overthinking shit 'cause I'm paranoid like my homeboys[|]Is they right Lord? Is they foul Lord?[|]Real shit I'll take 'em out Lord[|]If I could talk to god one on one like a real nigga I'd say[|]Lord will you please keep me far away from the fake?[|]Lord, can you teach me? please show me the way[|]Lord, can you teach me? please show me the way, yeah[|]Lil Dora seen me with a strap, ask me, daddy, what is that?[|]Lil son asked me 'bout Cecil, told him he ain't coming back[|]My bitch came in, asked me why we had to buy a bulletproof[|]Told 'em gangster baby, one thing about it is I ain't bulletproof[|]Never hire security 'cause I don't know what they gon' do or not[|]Wondering is they gon' shoot or not[|]Interview like how many niggas you done shot?[|]Old lady in the neighborhood said I'm the devil, she a damn liar[|]See me bustin' that fire, tryna protect the guys from the other side[|]Man I love these lil niggas like these my brothers[|]If any niggas come and touch 'em, I swear to god it'll crush 'em[|]I can't let that happen, 'fore I ever started rappin'[|]All that shit I be talking about, I was doin' that shit in the hood[|]With all the niggas I be talkin' 'bout[|]If I could talk to god like a real nigga, ask him please give me back Cecil[|]Please give me Big G and Poochy, then Pinot[|]Shit hurt Lord, I ain't over 'em[|]When the tears come it be pourin'[|]I know this rap shit my blessin' when I ain't in the hood shit be gettin' borin'[|]I'm so used to hustlin', I'm so used to thuggin', I don't know how to ignore it[|]Grab all my chains, hop in the Lambo and just floor it, vroom[|]If I could talk to god one on one like a real nigga I'd say[|]Lord will you please keep me far away from the fake?[|]Lord, can you teach me? please show me the way[|]Lord, can you teach me? please show me the way, yeah[|]I used to pray to god to get a million dollars and a Bentley truck[|]When I was dead broke I didn't have a dollar and I didn't give a fuck[|]I done ran off on the plug twice, he ain't pickin' up[|]When we run into 'em when we put it to 'em like give it up[|]Run it, my nigga, we so one hundred my nigga, it's only a few of us[|]Talkin' to god, just tryna decide if life really meant for the two of us[|]'cause niggas is shady, I tuck the three-eighty[|]You thought I was slippin', I tore him up[|]Snap on that nigga, no warm up[|]I got the A and I pour it up[|]Touchin' your city, no tour bus[|]Diamonds they drippin' like water[|]Have it your way like it's Burger King[|]Nigga can I take your order?[|]We sellin' work like it's Medellin[|]I'm turnin' three in the four-door[|]Watch for the D's and the tourists[|]Prayin' we never get caught up, god bless[|]If I could talk to god one on one like a real nigga I'd say[|]Lord will you please keep me far away from the fake?[|]Lord, can you teach me? please show me the way[|]Lord, can you teach me? please show me the way, yeah
Ooouuu (Freestyle),[Intro][|]They just called a nigga out of retirement[|]I'm a product of my environment[|]All I heard was gunshots and sirens[|]All I heard was gunshots and sirens[|]Ooouuu, Ooouuu, Ooouuu[|][Verse 1][|]Fresh up off a tour, I'm in grind mode[|]Walk in new Chanels, where you find those?[|]And I can count a million with my eyes closed[|]And quit postin that bitch nigga to my hoes[|]Niggas own they jewelry and they lease it[|]Niggas getting too high, they out here tweaking[|]And I still get head from a chubby chick[|]And every now and then I hit an ugly bitch[|][Hook][|]Ooouuu, Ooouuu[|]I just keep this shit real, uh[|]And I still get head from a chubby chick[|]And every now and then I hit an ugly bitch[|][Verse 2][|]Spent 250 out in Paris[|]That's your bitch? I hope you don't get married[|]Don't ask me but I know why[|]We just flew your bitch out to Dubai[|]Not just me but the squad though[|]On the real, your bitch be going hard though, Ooouuu[|]Young millionaires, that's the squad goes[|]And we ain't into rumors or who start those, Ooouuu[|]And yo Youngsta, where them choppers at?[|]Since everybody beefing on the internet[|]We gon' go shoot up the Apple store[|]So we don't gotta see the beef no more, Ooouuu[|]We just got a seven, that's a chopper[|]I got a number of killers on the roster[|]I got a number of dealers in the family[|]And I'ma catch a body 'fore a Grammy[|][Hook][|]Ooouuu, Ooouuu[|]Faker, faker, faker[|]I got a number of dealers in the family[|]And I'ma catch a body 'fore a Grammy[|][Verse 3][|]He be on his cycle, he a ho for real[|]He just out here rapping, touched no dope for real[|]Why would I beef with one of you locals, I got global skills[|]The ones that listen to me don't even know you steal[|]I'm from the trap but I be with Ye and Jay now[|]I might drop my album any day now[|]Feds might come and get me any day now[|]But I'm prepared mentally to go and lay it down, Ooouuu[|]I'm a hater cause I hate these rappers[|]Faker than a gold candy wrapper[|]But you be rapping, no I don't yo[|]I just talk for niggas in the ghetto[|]100,000 in my school house[|]Niggas had it rough, I had a smooth draft[|]And every time they dropped, I broke the shoes out[|]I ain't doing no more joints, I brought the Loubs out[|][Hook][|]Ooouuu, Ooouuu, aye[|][Verse 4][|]I went platinum with no features[|]Whole team mean it ain't no leaches[|]And you ain't in the game, you in the bleachers[|]You cheering for a nigga, where your pom-poms?[|]LA Reid gave me that check and I went dumb-dumb[|]Went and signed a lot of gangsters where I'm from-from[|]Oh, I got these haters sick, where your Tum-Tums[|]If he ain't talking money, he ain't saying nothing[|][Outro][|]Ooouuu, Ooouuu, Ooouuu, Ooouuu[|]Beep, beep, beep, beep[|]I am
Pay the Price,Yeah[|]Bills due on the kitchen table[|]Mama walked past em cause she ain't able[|]Watching mama's family sister tryna watch cartoons muthafucka came through and clipped the cable[|]Get a job that's the usual[|]Mama had a job that ain't do enough[|]Mama hired me I'm sacking groceries up[|]90 days later I was posting up[|]Quarter pound of weed 250 strong[|]Staying out late bringing profit home[|]It's me and Big G tryna stack it up[|]Shit ain't been the same since my nigga gone[|]I looked up to niggas like Hookshot[|]Niggas like Lil Pat and Woo Woo[|]I was on the block as a young boy[|]Watching them hustle it was like school[|]I hustled with the greats, ate with the vultures and the snakes[|]My days turned to nights my nights turned to days[|]Streets got me paid[|]And I know Ima pay the price for it[|]I know it[|]One day Ima pay the price for it[|]I know it[|]I know it[|]I know it[|]First time I seen 10 bands[|]First time I seen 100 grand[|]First time I seen 1 mill[|]I knew shit was about to get real[|]Homeboys start acting different[|]Shit changed I ain't even tripping[|]Same nigga used to ride for em one time I was on the front line for em[|]I was a hitta for a dopeboy[|]Play crazy yeah you know boy[|]Im in the hood with the doors up[|]Nigga I ain't never froze up[|]Bad bitches chose up[|]They like me or the lifestyle[|]Nigga I don't really give a fuck[|]But Ima burn the head in a meanwhile[|]I hustled with the greats, ate with the vultures and the snakes[|]My days turned to nights my nights turned to days[|]Streets got me paid[|]And I know Ima pay the price for it[|]I know it[|]One day Ima pay the price for it[|]I know it[|]I know it[|]I know it[|]Shit different you ain't even notice it[|]All the hustlers I ain't even quote it[|]New Wraith I ain't even rode it[|]Nick got a strap he ain't even load it[|]Shit real growing up in the projects[|]Tryna stay real in the process[|]Seen a pump knock out a nigga intestines[|]Young boy standing there tryna digest it[|]Where all the real niggas at that's my question[|]Never got indicted that's my blessing[|]When I put it on the Gram that's the motivate you[|]Inspiration nigga that's not flexing[|]New Lambs, new Raris[|]Little homie fighting charges[|]Make bond get em lawyers[|]Green dot so they can call you[|]I hustled with the greats, ate with the vultures and the snakes[|]My days turned to nights my nights turned to days[|]Streets got me paid[|]And I know Ima pay the price for it[|]I know it[|]One day Ima pay the price for it[|]I know it[|]I know it[|]I know it
