Rack It Up,I tell all my hoes,[|]Rake it up[|]Break it down[|]Back it up[|]Fuck it up[|]back it up[|]rake it up[|]back it up[|]I tell all my hoes,[|]Rake it up[|]Break it down[|]Back it up[|]Fuck it up x3[|]Rake It up[|]I made love to a stripper,[|]first i had to tip her[|]20 thousand ones[|]she said I'm that nigga[|]I said I'm that nigga bitch I already know it[|]i come with bad weather[|]they say I'm a storm[|]VVS in my charm thats a rockafella chain[|]I was sending bricks to harlem back when jay was still with dame,[|]Im a __ champ,[|]She gon fuck it up,[|]she don't need makeup,[|]she gon rake it up,[|]she said pay for the pussy[|]I tell all my hoes,[|]Rake it up[|]Break it down[|]Back it up[|]Fuck it up x3[|]Rake It up[|]Nicki:[|]Brought out the pink lamborghini,[|]Just to race with Chyna,[|]Brought the wraith to China,[|]Just to race in China,[|]Lil' bad Trini Bitch[|]But she mix with China,[|]Real Thick Vagina,[|]Smuggle bricks for China,[|]I tell all my niggas,[|]cut the check, (cut the check)[|]buss it out, (buss it out)[|]throw the goofy down. PAUSE[|]Imma do splits on it, do it splits on it[|]Imma bad bitch imma throw fits on it[|]Imma bust it opennnnnnn[|]Imma go stupid[|]I dont date honey[|]Cookie on sunami[|]All these niggas wife me once they get this good punani[|]I think he need a Bonnie
I Got Dat Sack,Bitch I'm Sacked up[|]Bitch I'm Racked up[|]Bitch I'm Stacked up[|]I Rock Louis, Gucci, Prada[|]Niggas know I shop at Saks[|]Yellow bone super fine,[|]know I'm hittin' that from the back[|]If you see me in the club[|]niggas know I got that strap[|]security tried to search a nigga[|]but we comin' thru the back[|]see the sparklers in the air?[|]you know them bottles on the way[|]CMG takin over mane[|]that's all the DJ play[|]right on, right on in the club with my white on[|]shawty got something tight on[|]and if that's your bitch then you might have to fight homes[|]gripping on her ass, niggas say im disrespectful[|]i pulled up in that lamb, niggas say i disrepected 'em[|]If I'm wanted then I'm running fast, know they gotta catch me[|]Niggas shot at me and missed[|]oll the lord lord blessed him[|]i sell dope, i fuck hoes and make songs 'bout the shit[|]i rob niggas for they work and don't feel wrong 'bout the shit[|]you a pussy ass nigga, you dont belong with no bricks[|]i pop pills, i feel good, i mix patron with the shit[|]In the club goin' hard, Niggas know I got them racks[|]In the kitchen whippin' hard, Niggas know I got that sack[|]In this bitch goin hard, Niggas know I got them racks[|]In the kitchen whippin' hard, Niggas know I got that sack[|]Niggas standin' on the couches, throwin' signs on the club[|]V.I.P. Bitch i dont wait in line at the club[|]It's a photoshoot, fed takin pictures in this bitch[|]I'm a nice guy, buyin bitches liquor in this bitch[|]got my fam with me, plus my nigga zilla in this bitch[|]I Don't Give a Fuck im back on my Ridgecrest shit[|]Yellin "Thug Life", Niggas on that Tupac shit[|]Minnesotta twins bitch I'm on my two glock shit[|]You niggas screwed up, put you on ya news box shit[|]body found by the river, feed it cement bricks[|]Eww she nasty, she just had a semen dish[|]she suck the skin off the dick you should've seen this bitch[|]They say I'm nasty, I think I'ma queen this bitch[|]Shawty suck it so good, think ima queen this bitch[|]SIKE! She not the type to be a wife[|]she get her pass, for the night[|]In the club goin' hard, Niggas know I got them racks[|]In the kitchen whippin' hard, Niggas know I got that sack[|]In this bitch goin hard, Niggas know I got them racks[|]In the kitchen whippin' hard, Niggas know I got that sack
Errybody,everybody[|]This sh*t here for everybody , everybody[|]I said this shit here for everybody, everybody[|]Everybody, everybody[|]Everybody wanna be a dope boy[|]Everybody wanna be a coke boy[|]Everybody got a chopper, everybody getting money[|]Everybody say they from the hood[|]Everybody real but they not boy[|]Everybody say that shes a bad bitch[|]Everybody on Instagram looking like they mad rich[|]But they not[|]Everybody say they started from the bottom now they at the top[|]Go![|]Everybody say they got a hater[|]Everybody got paper, guess aint nobody broke[|]But who am me to talk about the next nigga out here flexing when I did it before[|]And who is you to take about this nigga[|]Would you see a nigga hit it with the top-down?[|]Well you sound like a hater on the front line?[|]Imma hit the block for you one more time[|]Everybody got something to say[|]Everybody wanna hate if you ask me, every bitch gay[|]In the club dancing on a friend trying to pretend[|]We aint know you go both ways[|]Every nigga Think that shit cool, Dont you be fool[|]You should bring your friend home witcha[|]Tell you eat her pussy you cant be mad[|]Cause you shouldn't gave me the wrong picture[|]Everybody wanna be a dope boy[|]Everybody wanna be a coke boy[|]Everybody got a chopper, everybody getting money[|]Everybody say they from the hood[|]Everybody real, but they not boy[|]Every bitch say that she a bad bitch[|]Everybody on Instagram looking like they mad rich[|]But theyre not[|]Everybody say they started from the bottom now they at the top[|]Everybody fucking everybody bitch[|]Everybody with the shit[|]There is life[|]And every nigga try to fuck the next nigga bitch not knowing his bitch is the next nigga bitch[|]Hoes gun roll in this check on my wrist[|]Im about to blow a check in your bitch[|]Truth be told I don't even drink,[|]But I'm trynna turn up for a bitch[|]I know alotta nobodys trynna to be somebody[|]Plug on the way thats a new bugatti[|]Nigga thats everybody[|]Know a lot of nobodies but I won't say names[|]Nobody is matching my chain[|]Everybody wanna be a dope boy[|]Everybody wanna be a coke boy[|]Everybody got a chopper, everybody getting money[|]Everybody say they from the hood[|]Everybody is real[|]Everybody say that shes a bad bitch[|]Everybody on Instagram looking like theyre rich[|]But theyre not[|]Everybody say they started from the bottom now they at the top[|]Everybody is shit here for everybody, everybody[|]I said this shit here for everybody, everybody[|]Everybody, everybody[|]Everybody going to the mall[|]Niggaz got a 100 dollar ladder[|]Hermes belt on some DG jeans[|]Child support looking high, know where to find them[|]Couple of niggaz ballin in the club, poppin bottle bamboo[|]But if a nigga wants to know the truth[|]Still owe the rented that coupe and the watch aint real[|]Nigga watch it , it aint real[|]But shes a different person on the gram[|]Meet her in person you like where all the purses[|]Shorty , you aint got nail[|]everybody smoking on kush, smoking remy[|]Everybody wanna be a dope boy[|]Everybody wanna be a coke boy[|]Everybody got a chopper, everybody getting money[|]Everybody is real[|]Everybody say that shes a bad bitch[|]Everybody on Instagram looking like theyre rich[|]But theyre not[|]Everybody say they started from the bottom and then they hit the top[|]Everybody, everybody[|]I got money, I put on everybody, everybody[|]Keep coming here cause I trust nobody,nobody[|]Imma put that little ride right here[|]Everybody wanna be a dope boy[|]Everybody wanna be a coke boy[|]Everybody got a chopper, everybody getting money[|]Everybody is real[|]Everybody say that shes a bad bitch[|]Everybody on Instagram looking like theyre rich[|]But theyre not[|]Everybody say they started from the bottom and then they hit the top[|]I say the shit here for everybody, everybody
Rake It Up,Ear Drummers[|]Aw, this the strip club anthem, nigga, what's up?[|]Young Money[|]Yeah, me and Mike WiLL pull up to AOD back to back[|]Them AMG 63's[|]Mike WiLL Made-It, nigga[|]I tell all my hoes: rake it up[|]Break it down, bag it up[|]Fuck it up, fuck it up, back it up, back it up[|]Rake it up, rake it up, back it up, back it up[|]I tell all my hoes: rake it up (what?)[|]Break it down, bag it up (bag it up)[|]Fuck it up, fuck it up, fuck it up, fuck it up (fuck it up)[|]Fuck it up, fuck it up, rake it up, rake it up (fuck it up, rake it up)[|]I made love to a stripper (stripper), first I had to tip her (phrrr)[|]20 thousand ones, (woo) she said I'm that nigga (I am)[|]I said I'm that nigga, bitch, I already know it (I know it)[|]I come with bad weather, (ksh) they say I'm a storm (ayy)[|]VVS in my chum, that's a Roc-A-Fella chain[|]I was sendin' bricks to Harlem back when Jay was still with Dame[|]I'm a Phillipe Chow, (what?) I got a Patek on (okay)[|]Got a stripper with me, she pick up the check, home (phrrr)[|]She gon' fuck it up, fuck it up, she don't need makeup (makeup)[|]She gon' rake it up, rake it up until a nigga pay up (pay up)[|]She said pay for the pussy, pay for the pussy (pay), wait for the pussy, wait for the pussy (wait)[|]Ask God to forgive me (why) 'cause I pray for the pussy, pray for the pussy[|]I tell all my hoes: rake it up[|]Break it down, bag it up[|]Fuck it up, fuck it up, back it up, back it up[|]Rake it up, rake it up, back it up, back it up[|]I tell all my hoes: rake it up (what?)[|]Break it down, bag it up[|]Fuck it up, fuck it up, fuck it up, fuck it up (fuck it up)[|]Fuck it up, fuck it up, rake it up, rake it up (fuck it up, rake it up)[|]Yo, yo[|]Brought out the pink Lamborghini just to race with Chyna[|]Brought the Wraith to China just to race in China[|]Lil' bad Trini bitch but she mixed with China[|]Real thick vagina, smuggle bricks to China (woo)[|]I tell all my niggas, (yo) cut the check (cut the check)[|]Buss it down, turn your goofy down, (down) pound[|]I'ma do splits on it, yes, splits on it, (splits) I'm a bad bitch, I'ma throw fits on it (fits)[|]I'ma bust it open, I'ma go stupid and be a ditz on it (ditz)[|]I don't date honey, (no?) cookie on tsunami (oh)[|]All my niggas wife me once they get that good punani (oh)[|]I think he need a Bonnie, I might just let him find me[|]Never trust a big butt and a smile, word to Ronnie[|]Re-rep Queens like Supreme, ask Webb and Nitti[|]Ask Bimmy and Joe, nigga run me my dough[|]Wr-wrist game is freezin' like it wait in the cold[|]Nickname is Nicki but my name ain't Nicole (grrr)[|]I tell all my hoes: rake it up[|]Break it down, bag it up[|]Fuck it up, fuck it up, back it up, back it up[|]Rake it up, rake it up, back it up, back it up[|]I tell all my hoes: rake it up (what?)[|]Break it down, bag it up[|]Fuck it up, fuck it up, fuck it up, fuck it up (fuck it up)[|]Fuck it up, fuck it up, rake it up, rake it up (fuck it up, rake it up)[|]Well, I'm the dough boy, the one they talkin' about[|]All these gossipin' ass niggas got my name in they mouth[|]I know the bad bitches but know niggas who bitches too[|]They should bleed once a month 'cause that's what these bitches do[|]You a bitch and ya bitch should expose you[|]All that pillow talkin', nigga, that's what the hoes do[|]You a bitch, word to my nigga, Short[|]We won't never write no statement, we ain't showin' up in court[|]Bitch, we don't do no gossipin', we don't do no arguin'[|]We don't beef on social sites, we just hit our target[|]We don't do no rumors, we don't don't pay no shooters (rumors, brrr)[|]You a little bitty bitch, you should work at Hooters (yo)[|]You a old hater, you a fuckin' cougar[|]You a bitch and he a bitch and y'all like twin sisters[|]Respect ya hustle, get ya money, baby, win with us[|]Ya boyfriend actin' like a bitch then why you still with him?[|]I tell all my hoes: rake it up[|]Break it down, bag it up[|]Fuck it up, fuck it up, back it up, back it up[|]Rake it up, rake it up, back it up, back it up[|]I tell all my hoes: rake it up (what?)[|]Break it down, bag it up[|]Fuck it up, fuck it up, fuck it up, fuck it up (fuck it up)[|]Fuck it up, fuck it up, rake it up, rake it up (fuck it up, rake it up)
Sorry,Im Sorry[|]Im Sorry[|]Im Sorry[|]Im Sorry[|]Im Sorry[|]Im Sorry[|]Im Sorry[|]Im Sorry[|]Im Sorry[|]Im Sorry[|]Im Sorry[|]Im Sorry[|]Im Sorry[|]I Can't Fuck Wit You No Moe Ho And Im Sorry (Im Sorry)[|]You A Disloyal Ass Bitch Ho You Sorry (You Sorry)[|]You Probably Ain't Pregnant Ho You Flaugin (You Sorry)[|]That Probably Ain't My Baby I Need Maury (Im Sorry)[|]A Ho Gone Be A Ho They Ain't A Hunnit (They Ain't A Hunnit)[|]And When A Nigga Broke Them Hoes Act Funny (They Act Funny)[|]My Money Hungry Bitches They Can Smell It(They Can Smell It)[|]Loyalty Them Hoes Can't Even Spell It (Im Sorry)[|]Aye You Can Give That Ho The World That Dont Mean Shit (They Sorry)[|]Cause You Can Rent A Ho But You Can't Buy A Bitch (Im Sorry)[|]I Give It To You Raw (Im Sorry) Straight Up And Down (Straight Up And Down)[|]If She Complaining And Accusing You Prolly Fuck Around (Im Sorry)[|]A Nigga Gone Be A Nigga Im Just Sorry (Im Sorry)[|]And A Ho Gone Be A Ho Regardless (Regardless)[|]If You Think She Fuckin Off She Probably (She Probably)[|]Think Yo Nigga Ain't Real Then Sorry (Sorry)[|]Im Sorry (Im Sorry) Bitch Im Sorry (Im Sorry)[|]Im Sorry (Im Sorry) Ho Im Sorry (Im Sorry)[|]A Ho Gone Be A Ho Regardless (Regardless)[|]A Nigga Gone Be A Nigga Ho Im Sorry (Im Sorry)[|]I Like Different Type Of Bitches Im Sorry (Im Sorry)[|]I Could Never Be Committed And Im Sorry (Im Sorry)[|]How Often You Gone See Me? Hardly (Im Sorry)[|]Cause Ion Want A Girl I Want A Partner (Im Sorry)[|]Ian Talking On The Phone Bitch Im Straight Texting (Texting)[|]Ian Going To The Movies Ho We Straight Sexing (Sexing)[|]Aww Yeen Fucking First Night Ho Stay FLexing (Flexing)[|]A Nigga Call And Sheen Answer Ho Stay Reckless (She Sorry)[|]I Got Trust Issues Thats Some real Shit (Im Sorry)[|]Give Me Head And Kiss yo Nigga You A Ill Bitch (Uggghh)[|]Go Home Like Nothing Happend Thats Some Cold Shit (Ho You Cold)[|]And Ask Yo Nigga Who He Fucking Thats Some Ho Shit (Them Hoes)[|]A Nigga Gone Be A Nigga Im Just Sorry (Im Sorry)[|]And A Ho Gone Be A Ho Regardless (Regardless)[|]If You THink She Fuckin Off She Probably (She Probably)[|]Think Yo Nigga Ain't Real Then Sorry (Sorry)[|]Im Sorry (Im Sorry) Bitch Im Sorry (Im Sorry)[|]Im Sorry (Im Sorry) Ho Im Sorry (Im Sorry)[|]A Ho Gone Be A Ho Regardless (Regardless)[|]A Nigga Gone Be A Nigga Ho Im Sorry (Im Sorry)[|]Sorry (Im Sorry[|]Sorry (Im Sorry)[|]Sorry (Im Sorry)[|]Im Sorry[|]Ha Aye You Know Im Sorry Shawty[|]You Sorry? Damn Right You Sorry![|]As A Matter Of Fact Go Fuck Wit One Of Them Sorry Ass Hoes (I Am)[|]Donit Come To Me Sayin You Sorry After One Of Them Dumb Ass Bitches Don't Keep It Real!
Down In The DM,I see your girl post her BM, so I hit her in her DM[|]All eyes yeah I see'em, yeah this your man I hate to be him (whoop)[|]It goes down in the Dm (it go down) it go down in the dm (it go down, it go... down)[|]It goes down in the dm (it go down) it go down in the dm (it go down, it go... down)[|]I tell her, snapchat me that pussy or facetime me that pussy if its cool[|](whoo) boy my dm poppin, (dm poppin) my dm just caught a body[|]I got celeb's in this dm, they breaking news if they see them[|]But naw we dont do no talking[|](we dont do no talking), we see sucker shit too often (fuck niqqa)[|]I see your girl post her BM, so I hit her in her DM[|]All eyes yeah I see'em, yeah this your man I hate to be him (whoop)[|]It goes down in the Dm (it go down) it go down in the dm (it go down), it go... down)[|]It goes down in the dm (it go down) it go down in the dm (it go down), it go... down)[|]I tell her, dont you hate when you get screenshot (petty)[|]Bitch that dm wasn't for everybody (rules) I love tha gram I love tha gram[|](I love tha gram) im addicted to it I know I am (I know I am) and I just followed[|]Angela Simmons[|]Boy I got a crush on Angela Simmons they like "damn gotti you bold" fuck it ima let[|]the world know[|]Goals[|]I see your girl post her Dm, so I hit her in her dm[|]All eyes yeah I see'em, yeah this your man I hate to be him (whoop)[|]It goes down in the Dm (it go down) it go down in the dm (it go down, it go... down)[|]It goes down in the dm (it go down) it go down in the dm (it go down, it go... down)[|]I tell her, snapchat me that pussy, snapchat me that pussy if its cool[|]I see your girl post her Dm, so I hit her in her dm[|]All eyes yeah I see'em, yeah this your man I hate to be him (whoop)[|]It goes down in the Dm (it go down) it go down in the dm (it go down, it go... down)[|]It goes down in the dm (it go down) it go down in the dm (it go down, it go... down)[|]I tell her it go down
Hunnid,Ayy Gotti, what you gon' do homie[|]You gon' swap it up, slang it out?[|]You gon' keep it street?[|]What you gon' do, nigga?[|]Nigga I'ma re-up, fuck you mean, nigga?[|]Tell Enrique send my shit to Mexico[|]I don't even wanna see it[|]I don't know another nigga that had done it[|]Can't remember last time I got fronted[|]And the watch that I'm rockin' is a hunnid[|]Man the streets everyday, I'm a hunnid[|]If you really want beef, we can run it[|]Pull up on the squad, we dumpin'[|]Ran off on the plug with a hunnid[|]Got the mothafuckin' trap house jumpin'[|]Boy I'm really in the trap, my way strapped[|]Truth be told, I don't really like to rap[|]I got quarter halves a slab, pill percs and tabs[|]Really got a pound runnin' laps[|]Bitch I'm in the hood, really, really, really in the hood[|]Niggas like, "Gotti, what's good?"[|]The coupe two hunnid, nigga I be fuckin' up the money[|]And the drum really hold like a hunnid[|]I don't know another nigga that done it[|]Can't remember last time I got fronted[|]Yeah I remember last time I got fronted[|]I was like, "Fuck the plug," I ain't bring back the money[|]I ain't savin' no hoes, it ain't Sunday[|]Know the alphabet boys, they comin'[|]I blew a 10 at the mall and a 10 at Kamal's[|]And a 20 at Magic last Monday[|]Every weekend I'ma sell a hunnid[|]Plant a money tree and I'ma be up under it[|]3 mil' for the condo, new marble floors[|]And the mothafucka ran like a hunnid[|]I don't know another nigga that had done it[|]Can't remember last time I got fronted[|]And the watch that I'm rockin' is a hunnid[|]Man the streets everyday, I'm a hunnid[|]If you really want beef, we can run it[|]Pull up on the squad, we dumpin'[|]Ran off on the plug with a hunnid[|]Got the mothafuckin' trap house jumpin'[|]Aye Gotti, while we're talkin' 'bout a hunnid[|]We're some niggas who ain't done it[|]That's 45 kis on a calibrated scale, bitch countin' on her stomach[|]If you checkin' the math, countin' on your fingers to add[|]We don't count extras when it's like Tetris[|]Yuugh, let me dummy down my lecture[|]Digest, these watches got sister, cousins[|]My Rollies got missin' numbers[|]These bezels is blindin'[|]The 3 and the 9 is like distant lovers[|]Now guess what I fronted, nigga (take a guess)[|]Keeps at 300, nigga (double that)[|]I say about 5, I kept it alive whenever you want it, nigga[|]Maseratis for the monkeys (fuck them niggas)[|]Any dodge for a flunkie[|]Only one above me is the God in the sky[|]I'm a man without a country[|]I don't know another nigga that had done it[|]Can't remember last time I got fronted[|]And the watch that I'm rockin' is a hunnid[|]Man the streets everyday, I'm a hunnid[|]If you really want beef, we can run it[|]Pull up on the squad, we dumpin'[|]Ran off on the plug with a hunnid[|]Got the mothafuckin' trap house jumpin'[|]I got a hunnid guns, hunnid clips[|]Swear to God I took a hunnid trips[|]Million dollars, that's a hunnid flips[|][?] at a hunnid rip[|]A hunnid grams on the kitchen table[|]Tryna hide a hunnid pounds from my nosy neighbors[|]I got a hunnid problems but it ain't no hoes[|]I got a hunnid robbers tryna take my soul[|]I know a hunnid ways to make a hunnid thou[|]We done skipped public housing[|]Gotta thank God I made today[|]I never joined no gang, I always got my money[|]I never crossed my partners, cause it ain't one hunnid[|]I sold dope on Saturday then went to church on Sunday[|]Call my plug and re-upped on Monday[|]I don't know another nigga that had done it[|]Can't remember last time I got fronted[|]And the watch that I'm rockin' is a hunnid[|]Man the streets everyday, I'm a hunnid[|]If you really want beef, we can run it[|]Pull up on the squad, we dumpin'[|]Ran off on the plug with a hunnid[|]Got the mothafuckin' trap house jumpin
Standing In The Kitchen,Ay, you know what time it is nigga [|]Aw yeah, it's cookin' time homeboy[|]Da Da Da Da Da Da Daa Da[|]Da Da Da Da Da Da Daa Da[|]Da Da Da Da Da Da Daa Da[|]Da Da Da Da Da Da Daa Da[|]I got 36 ounces[|]Fish Scale Entree[|]Newspaper on the floor[|]I break it down bag it up[|]Hit the hood sew it up[|]Hit the kitchen blow it up[|]18 wheelers full of bricks[|]Feds Say they know what's up[|]I'm a keep it swingin[|]Till the day they come and lock me up[|]Basically I don't give a fuck[|]Go ahead try your luck[|]Prices kinda high[|]So you get pansied you get muscled up[|]City kinda dry so this the time for you to hustle up[|]Baking soda beaken cup stretch it out whip it up[|]2 to 4, 4 to 8 I can make it double up[|]Glock 40 hush em up[|]If a nigga rushin up[|]Ak47 banana clip bitch I'll torch em up[|]Standing in the kitchen[|]On that stove is part of whippin[|]Mixin soda with the yoda[|]Girl I can't show you how to get some over[|]Da Da Da Da Da Da Daa Da (I'm yo gotti)[|]Da Da Da Da Da Da Daa Da[|]Da Da Da Da Da Da Daa Da[|]Da Da Da Da Da Da Daa Da[|]I'm a dumb boy painted yam[|]125 Gram for twenty seven fifty all day Nigga here I am[|]Wanna get the whole quarter I'll charge you a nickel flat[|]Let you roll the whole el you gotta bring a nickel back[|]Gotti came a long way for selling nigga nickel sacks[|]Homie track rich cred 15 dollar powder bags[|]You a loyal soldier then I mite front you the whole thing[|]First I need to know where your mama stay and what's your whole name[|]Niggas catchin cases coppin pleases givin long names[|]Fuckin up the whole thing yeh it's a cold game[|]Niggas scared to shop in old Memphis cause they mite get robbed[|]Front a nigga nawl shit he gone pay them off[|]Standing in the kitchen[|]On that stove is part of whippin[|]Mixin soda with the yoda[|]Girl I can't show you how to get some over[|]Da Da Da Da Da Da Daa Da (I'm yo gotti)[|]Da Da Da Da Da Da Daa Da[|]Da Da Da Da Da Da Daa Da[|]
Lets Vibe,And that's real[|]Yo Gotti, Pleasure P[|]Let's do it[|]Shawty ride or die, here if I'm sober or high[|]She know just what to do to help a gangsta get by[|]Shawty know I like yay, she ain't trippin' at all[|]She go down on a nigga and she'll swallow it all[|]Me and her done it all, catch us both at the mall[|]She can get what she wanna and that ain't trickin' at all[|]Shawty fuck with her nigga, her nigga fuck with her back[|]She put her life on the line 'cause she would ride with this sack[|]When I went back to the hood, hustlin', movin' them birds[|]She was takin' up nurses' studyin' and gettin' what's hers[|]I ain't chase her or sweat her, try my best to protect her[|]When you fuck with a gangsta baby, you bet I'ma bless ya[|]And that's real[|]If you wanna come ride, then let's ride[|]If you wanna come smoke, then let's smoke[|]If you wanna come drink, then let's drink[|]If you wanna come vibe, then let's vibe[|]Come vibe baby[|]I been thinkin' 'bout fuckin' you[|]I been thinkin' 'bout kissin' you[|]Touchin' you, lovin' you[|]That's all I wanna do baby[|]When we out on the road, grindin', doin' my shows[|]She be callin' my phone like, "Don't be fuckin' them hoes"[|]She at home with my child, I be flirtin' in the crowd[|]I need help I can't control myself, these hoes be wild[|]Sometimes I think to myself another nig in my bed[|]So I stop thinkin' at all, that shit'll fuck up yo' head[|]I took Federal chances, I hustle hard for the bread[|]Wonder would she keep it real if I ever go to the Fed?[|]She gon' write me and visit me like I think that she should?[|]Or she gon disrespect me, fuck another nig at the hood?[|]I ain't chase her or sweat her try my best to protect her[|]I don't know about love I just know just know money and pleasure[|]Believe that[|]If you wanna come ride, then let's ride[|]If you wanna come smoke, then let's smoke[|]If you wanna come drink, then let's drink[|]If you wanna come vibe, then let's vibe[|]Come vibe baby[|]I been thinkin' 'bout fuckin' you[|]I been thinkin' 'bout kissin' you[|]Touchin' you, lovin' you[|]That's all I wanna do baby[|]Look here shawty, you only know how to be number one[|]Well I is always real, so I ask for the same in return[|]For better, for worse, you know what I'm talkin' 'bout?[|]When yo momma was trippin', talkin' 'bout kickin' you out[|]You had nowhere to go, I let you move in my house[|]You can jump in my Benz, go stunt out on ya friends[|]I took you all around the world and I do it again[|]You respected my grind 'cause you knew I had that work[|]And I respected ya mind because you still went to work[|]See it wasn't 'bout the money, shawty kept it 100[|]She stayed into it with her family because they knew I was hustlin'[|]And that's real[|]If you wanna come ride, then let's ride[|]If you wanna come smoke, then let's smoke[|]If you wanna come drink, then let's drink[|]If you wanna come vibe, then let's vibe[|]Come vibe baby[|]I been thinkin' 'bout fuckin' you[|]I been thinkin' 'bout kissin' you[|]Touchin' you, lovin' you[|]That's all I wanna do baby[|]Let's vibe baby[|]I'm talkin' D girls, college girls[|]I ain't trippin', I like 'em all, ya know?[|]I'm tryna ride with ya shawty, I'm tryna vibe with ya[|]Kick back, get high with ya, whatever you do[|]Know what I'm talkin' 'bout?[|]They ain't expect me to come like this
